Unnamed: 0,Sector,CourseName,Duration,TopicName,URL,Module
8267,Data Science,On-Premises Data Quality,,HOW TO Collect Java based diagnostic files for Developer Client Tool  DxT,https://www.youtube.com/watch?v=5rVBCQEFCi0,Module 4: Informatica Cloud Data Quality Integration
8268,Data Science,On-Premises Data Quality,,How to: Bulk Update the Business Terms in Data Quality 9 6,https://www.youtube.com/watch?v=y3uydCLz5SQ,Module 4: Informatica Cloud Data Quality Integration
8269,Data Science,On-Premises Data Quality,,How to import IDQ Cleanse Library into MDM,https://www.youtube.com/watch?v=zSf-ZiuBCHY,Module 4: Informatica Cloud Data Quality Integration
8270,Data Science,On-Premises Data Quality,,How to use Packet capturing tools - Tcpdump and Wireshark,https://www.youtube.com/watch?v=AqpDs51xmBE,Module 4: Informatica Cloud Data Quality Integration
8271,Data Science,On-Premises Data Quality,,How to migrate Data Quality scorecards,https://www.youtube.com/watch?v=BVtZuAMDrnw,Module 4: Informatica Cloud Data Quality Integration
8272,Data Science,On-Premises Data Quality,,Scorecard Lineage in Data Quality,https://www.youtube.com/watch?v=mMTcgLpG4lE,Module 4: Informatica Cloud Data Quality Integration
8273,Data Science,On-Premises Data Quality,,How to migrate Data Quality scorecards,https://www.youtube.com/watch?v=BVtZuAMDrnw,Module 4: Informatica Cloud Data Quality Integration
8274,Data Science,On-Premises Data Quality,,Data Quality Column Patterns,https://www.youtube.com/watch?v=mg7l7cre-x4,Module 4: Informatica Cloud Data Quality Integration
8275,Data Science,On-Premises Data Quality,,AddressDoctor - Configure PreferredScript option,https://www.youtube.com/watch?v=LGs6J490_wI,Module 4: Informatica Cloud Data Quality Integration
8276,Data Science,On-Premises Data Quality,,How to Install self signed certificate to Trusted Root Authorities in PowerCenter,https://www.youtube.com/watch?v=ATw7yWnWANA,Module 4: Informatica Cloud Data Quality Integration
8277,Data Science,On-Premises Data Quality,,How to download Address Doctor country files,https://www.youtube.com/watch?v=g8mpIkuBr7w,Module 4: Informatica Cloud Data Quality Integration
8278,Data Science,On-Premises Data Quality,,How to Install IDQ Reporting and dashboard Template for Jaspersoft,https://www.youtube.com/watch?v=S1sAakfOsp4,Module 4: Informatica Cloud Data Quality Integration
8279,Data Science,On-Premises Data Quality,,How to update an Address Doctor license for IDQ,https://www.youtube.com/watch?v=daKHDCDh3BA,Module 4: Informatica Cloud Data Quality Integration
8280,Data Science,On-Premises Data Quality,,Data Quality Content Installation,https://www.youtube.com/watch?v=j3SaR1JWTCQ,Module 4: Informatica Cloud Data Quality Integration
8281,Data Science,On-Premises Data Quality,,Migration of Data Quality from 8.6.2 to 9.x,https://www.youtube.com/watch?v=Ck4D11fF_Ao,Module 4: Informatica Cloud Data Quality Integration
8282,Data Science,On-Premises Data Quality,,Checking If Workflow Tasks Ran Successfully in the Developer Tool,https://www.youtube.com/watch?v=werEFgJCkFk,Module 4: Informatica Cloud Data Quality Integration
8283,Data Science,On-Premises Data Quality,,Accessing Flat Files in the Developer Tool,https://www.youtube.com/watch?v=jZYpCBCMpxQ,Module 4: Informatica Cloud Data Quality Integration
8284,Data Science,On-Premises Data Quality,,Multimedia KB: Migrating from Informatica Data Quality 8.6.2 to Informatica 9.0.1,https://www.youtube.com/watch?v=jz_NBNukMoU,Module 4: Informatica Cloud Data Quality Integration
8285,Data Science,On-Premises Data Quality,,Multimedia KB: Introduction to Content set in Data Quality 9.1,https://www.youtube.com/watch?v=cgoFk4quxvE,Module 4: Informatica Cloud Data Quality Integration
8286,Data Science,On-Premises Data Quality,,"INFASupport Webinar recording ""What's new in IDQ V9.5.x""",https://www.youtube.com/watch?v=vFtyvqzjAt0,Module 4: Informatica Cloud Data Quality Integration
8287,Data Science,On-Premises Data Quality,,Multimedia KB: Migrating from Informatica Data Quality 8.6.2 to Informatica 9.0.1,https://www.youtube.com/watch?v=jz_NBNukMoU,Module 4: Informatica Cloud Data Quality Integration
8288,Data Science,On-Premises Data Quality,,Creating Web Service in Data Services 9.5,https://www.youtube.com/watch?v=YcsIk973za4,Module 4: Informatica Cloud Data Quality Integration
8289,Data Science,On-Premises Data Quality,,Exception Record Management,https://www.youtube.com/watch?v=rS6FvrFQ6Ng,Module 4: Informatica Cloud Data Quality Integration
8290,Data Science,On-Premises Data Quality,,Domain Discovery Profile in Data Explorer 9.5,https://www.youtube.com/watch?v=ntlUzPuywFg,Module 4: Informatica Cloud Data Quality Integration
8291,Data Science,On-Premises Data Quality,,Getting started on Data profiling,https://www.youtube.com/watch?v=5A8ocEMEeQg,Module 4: Informatica Cloud Data Quality Integration
8292,Data Science,On-Premises Data Quality,,Developer Workflow in Data Quality 9.5.0,https://www.youtube.com/watch?v=AKgyiwrahlk,Module 4: Informatica Cloud Data Quality Integration
8293,Data Science,On-Premises Data Quality,,"Batch, InterActive Fastcompletion in AddressDoctor",https://www.youtube.com/watch?v=ERaLHnEvBJ0,Module 4: Informatica Cloud Data Quality Integration
8294,Data Science,On-Premises Data Quality,,Address Doctor Web Services made easy with soapUI,https://www.youtube.com/watch?v=l_AzwWH6DxM,Module 4: Informatica Cloud Data Quality Integration
8295,Data Science,On-Premises Data Quality,,Configuring Monitoring Console in Data Quality,https://www.youtube.com/watch?v=wp6S2UtJY0E,Module 4: Informatica Cloud Data Quality Integration
8296,Data Science,On-Premises Data Quality,,Data Quality Address Validation Reference Content (Cycle M and Cycle N),https://www.youtube.com/watch?v=UO3OQ_30dsk,Module 4: Informatica Cloud Data Quality Integration
