Unnamed: 0,Sector,CourseName,Duration,TopicName,URL,Module
8135,Data Science,On-Premises Data Quality,9hrs 17min,IDQ Lifecycle,https://www.youtube.com/watch?v=qbprPFycPAc,Module 1: Introduction to Informatica Data Quality
8136,Data Science,On-Premises Data Quality,,How to Collect PMStack on the Core Files,https://www.youtube.com/watch?v=qGJmC1NFT0o,Module 1: Informatica Data Quality Lifecycle and Architecture
8137,Data Science,On-Premises Data Quality,,Introduction to Informatica Data Quality,https://www.youtube.com/watch?v=X83dzUHCHKs,Module 1: System Level Diagnostics and Log Collection
8138,Data Science,On-Premises Data Quality,,How to Generate Informatica Log Files using the Command Line,https://www.youtube.com/watch?v=RPYYK0yexJ4,Module 1: Developer Tool and Command Line Interface
8139,Data Science,On-Premises Data Quality,,Standard Data Quality Rules - Part 2,https://www.youtube.com/watch?v=0l6fFscPlpc,Module 2: Data Profiling and Quality Rules
8140,Data Science,On-Premises Data Quality,,How to Collect Different System Level Diagnostic Information on Linux,https://www.youtube.com/watch?v=vt9FMvpGQ40,Module 2: Data Validation and Enrichment
8141,Data Science,On-Premises Data Quality,,How to Check the Command Line Arguments and VM Arguments Picked by the Developer Client Tool in IDQ,https://www.youtube.com/watch?v=E5Oma9_DUcE,Module 2: Address Validation and Standardization
8142,Data Science,On-Premises Data Quality,,Element Results Status in AV V5,https://www.youtube.com/watch?v=s2QMdVD8n7Y,Module 2: Data Quality Scorecards and Reporting
8143,Data Science,On-Premises Data Quality,,Element Input Status in AV V5,https://www.youtube.com/watch?v=R_XsQGLQSbA,Module 3: Data Integration Service and Application Deployment
8144,Data Science,On-Premises Data Quality,,How to Check AV Reference Details in GetConfig in IDQ,https://www.youtube.com/watch?v=oUMM3H3_KUI,Module 3: Workflow Management and Job Scheduling
8145,Data Science,On-Premises Data Quality,,How to Apply Patch to Fix Missing Country ISO2,https://www.youtube.com/watch?v=-aHOeTWY3o4,Module 3: High Availability and Performance Tuning
8146,Data Science,On-Premises Data Quality,,How to Rollback Country ISO2 Patch to Fix Performance Issues,https://www.youtube.com/watch?v=fzgnRBmG81I,Module 3: Informatica Data Governance and Administration
8147,Data Science,On-Premises Data Quality,,DualAddress Priority Parameter in AV V5,https://www.youtube.com/watch?v=0L1nvA8EHAs,Module 4: REST Web Services and Data Connectors
8148,Data Science,On-Premises Data Quality,,Preloading AV Reference Files in IDQ,https://www.youtube.com/watch?v=dDMYMBxUQsI,Module 4: Version Control and Model Repository Service
8149,Data Science,On-Premises Data Quality,,How to Perform MRS Reindexing,https://www.youtube.com/watch?v=uSyKf6Aggj8,Module 4: Advanced Troubleshooting and Performance Optimization
8150,Data Science,On-Premises Data Quality,,How to Enable Verbose Data Logging for Deployed Mapping from Admin Console,https://www.youtube.com/watch?v=nm4HPqdSUZM,Module 4: Informatica Cloud Data Quality Integration
8151,Data Science,On-Premises Data Quality,,Data Profiling: Modes of Run,https://www.youtube.com/watch?v=Q8BGJ2LpOKs,Module 4: Informatica Cloud Data Quality Integration
8152,Data Science,On-Premises Data Quality,,How to Read from ADLS gen2 with Gzip Compression Format in IDQ,https://www.youtube.com/watch?v=z5UIq4x3wzY,Module 4: Informatica Cloud Data Quality Integration
8153,Data Science,On-Premises Data Quality,,How to Make a POST Call using Rest Web Service Consumer Transformation in IDQ,https://www.youtube.com/watch?v=6B6pHQ6bpjk,Module 4: Informatica Cloud Data Quality Integration
8154,Data Science,On-Premises Data Quality,,How to Create a Snowflake Connection from the Command Line in Data Quality,https://www.youtube.com/watch?v=ngqj9JhjpIQ,Module 4: Informatica Cloud Data Quality Integration
8155,Data Science,On-Premises Data Quality,,How to Update Parameter Set Entries in Application in IDQ using infacmd Command Line,https://www.youtube.com/watch?v=Pj7v8a24UVg,Module 4: Informatica Cloud Data Quality Integration
8156,Data Science,On-Premises Data Quality,,How to Create and Use Parameter Set in IDQ,https://www.youtube.com/watch?v=Zx_3lHJg8Uw,Module 4: Informatica Cloud Data Quality Integration
8157,Data Science,On-Premises Data Quality,,How to Configure High Availability for Data Integration Service,https://www.youtube.com/watch?v=uwmUTjSvREI,Module 4: Informatica Cloud Data Quality Integration
8158,Data Science,On-Premises Data Quality,,How to Profile an Oracle Table in Informatica Cloud Data Quality,https://www.youtube.com/watch?v=atHEU2xBxM8,Module 4: Informatica Cloud Data Quality Integration
8159,Data Science,On-Premises Data Quality,,How to configure DIS to run on GRID,https://www.youtube.com/watch?v=9fpO6_nNb-s,Module 4: Informatica Cloud Data Quality Integration
8160,Data Science,On-Premises Data Quality,,How to Configure SQL Server Connection in IDQ (Linux),https://www.youtube.com/watch?v=S-1t0VuCwYs,Module 4: Informatica Cloud Data Quality Integration
8161,Data Science,On-Premises Data Quality,,How to Import OOTB Data Domains using infacmd Command Line in IDQ,https://www.youtube.com/watch?v=GcJxGr1LQXY,Module 4: Informatica Cloud Data Quality Integration
8162,Data Science,On-Premises Data Quality,,How to Create a Data Quality Scorecard with Informatica Cloud Data Quality,https://www.youtube.com/watch?v=yEJtWQ3nHiw,Module 4: Informatica Cloud Data Quality Integration
8163,Data Science,On-Premises Data Quality,,How to Configure Operating System Profiles(OSP) in Data Quality,https://www.youtube.com/watch?v=SGKSeSAhS8U,Module 4: Informatica Cloud Data Quality Integration
8164,Data Science,On-Premises Data Quality,,How to Run Profiles/Scorecards using Operating System Profiles (OSP) from Analyst Tool,https://www.youtube.com/watch?v=cnhQfgWzOfc,Module 4: Informatica Cloud Data Quality Integration
8165,Data Science,On-Premises Data Quality,,How to Verify Emails with Informatica Cloud Data Quality,https://www.youtube.com/watch?v=MPbN6iQ9cCw,Module 4: Informatica Cloud Data Quality Integration
8166,Data Science,On-Premises Data Quality,,How to Validate and Enrich Global Telephone Numbers with Informatica Cloud Data Quality,https://www.youtube.com/watch?v=3bJR9Iz4cjc,Module 4: Informatica Cloud Data Quality Integration
8167,Data Science,On-Premises Data Quality,,How to Deduplicate and Consolidate Data with Informatica Cloud Data Quality,https://www.youtube.com/watch?v=mH3GJfnTtBA,Module 4: Informatica Cloud Data Quality Integration
8168,Data Science,On-Premises Data Quality,,How to Configure a Parser and Use in a Mapping Informatica Cloud Data Quality,https://www.youtube.com/watch?v=EJvXfa-4Ykw,Module 4: Informatica Cloud Data Quality Integration
8169,Data Science,On-Premises Data Quality,,Data Quality for Data Integrations and Data Migrations,https://www.youtube.com/watch?v=yCF1MKs3UlI,Module 4: Informatica Cloud Data Quality Integration
8170,Data Science,On-Premises Data Quality,,How to Import OOTB Data Domain in IDA using Developer Client,https://www.youtube.com/watch?v=feEHoFFLfLY,Module 4: Informatica Cloud Data Quality Integration
8171,Data Science,On-Premises Data Quality,,How to Create Rest Web Service from Developer Client,https://www.youtube.com/watch?v=V9VQn6qKmws,Module 4: Informatica Cloud Data Quality Integration
8172,Data Science,On-Premises Data Quality,,How to use a PlatformLogCollector on Unix Platform,https://www.youtube.com/watch?v=O7C-_kxnbOQ,Module 4: Informatica Cloud Data Quality Integration
8173,Data Science,On-Premises Data Quality,,How to Configure CMS within a Multi-Node GRID-DIS Environment in Data Quality,https://www.youtube.com/watch?v=ZAcleOpPKhw,Module 4: Informatica Cloud Data Quality Integration
8174,Data Science,On-Premises Data Quality,,How to Create a Customized Data Object in Developer Tool in IDQ,https://www.youtube.com/watch?v=NgPYd-GHwDM,Module 4: Informatica Cloud Data Quality Integration
8175,Data Science,On-Premises Data Quality,,How to Enable Verbose Data Logging for Mappings in Developer Tool,https://www.youtube.com/watch?v=AMd6DkTYWXU,Module 4: Informatica Cloud Data Quality Integration
8176,Data Science,On-Premises Data Quality,,How to Create an Enterprise Discovery Profile through Analyst Tool in IDQ,https://www.youtube.com/watch?v=OZ60hQ8O4DE,Module 4: Informatica Cloud Data Quality Integration
8177,Data Science,On-Premises Data Quality,,How to Configure Address Validation in PowerCenter,https://www.youtube.com/watch?v=hSC1jQHS9mE,Module 4: Informatica Cloud Data Quality Integration
8178,Data Science,On-Premises Data Quality,,How to Configure Address Validation in Content Management Service in IDQ,https://www.youtube.com/watch?v=TjoQCHfc3Vs,Module 4: Informatica Cloud Data Quality Integration
8179,Data Science,On-Premises Data Quality,,How to Backup and Restore Model Repository Service in IDQ through Command Line,https://www.youtube.com/watch?v=23c6izH1JsU,Module 4: Informatica Cloud Data Quality Integration
8180,Data Science,On-Premises Data Quality,,How to Create Dynamic Mapping for S3 Objects,https://www.youtube.com/watch?v=5as-X4OvQKQ,Module 4: Informatica Cloud Data Quality Integration
8181,Data Science,On-Premises Data Quality,,How to View Monitoring Statistics and Reports in IDQ,https://www.youtube.com/watch?v=gC3iMN3ULso,Module 4: Informatica Cloud Data Quality Integration
8182,Data Science,On-Premises Data Quality,,How to Deploy an Application using Command Line in Informatica Data Quality,https://www.youtube.com/watch?v=oQHntrHGJzk,Module 4: Informatica Cloud Data Quality Integration
8183,Data Science,On-Premises Data Quality,,How to Perform Search Service Cleanup in IDQ,https://www.youtube.com/watch?v=PowLsroSovo,Module 4: Informatica Cloud Data Quality Integration
8184,Data Science,On-Premises Data Quality,,How to Perform Scheduler Service Cleanup in IDQ,https://www.youtube.com/watch?v=1URJw2OhFes,Module 4: Informatica Cloud Data Quality Integration
8185,Data Science,On-Premises Data Quality,,How to Perform Content Management Service Cleanup in IDQ,https://www.youtube.com/watch?v=7Fnly2q8cMc,Module 4: Informatica Cloud Data Quality Integration
8186,Data Science,On-Premises Data Quality,,How to Perform Analyst Service Cleanup in IDQ,https://www.youtube.com/watch?v=NygTFchDHXc,Module 4: Informatica Cloud Data Quality Integration
8187,Data Science,On-Premises Data Quality,,How to Perform Data Integration Service Cleanup in IDQ,https://www.youtube.com/watch?v=AlOG4PrYy6I,Module 4: Informatica Cloud Data Quality Integration
8188,Data Science,On-Premises Data Quality,,How to Configure Reference Data Connection and Audit Tables in IDQ through the Administrator Console,https://www.youtube.com/watch?v=3PAfjeHQsjk,Module 4: Informatica Cloud Data Quality Integration
8189,Data Science,On-Premises Data Quality,,How to Create IDQ Service from Command Line,https://www.youtube.com/watch?v=YuYHxq8xG4M,Module 4: Informatica Cloud Data Quality Integration
8190,Data Science,On-Premises Data Quality,,Informatica Data Governance Automation (The Axon – EDC – DQ Story),https://www.youtube.com/watch?v=1qqp4rMcfs0,Module 4: Informatica Cloud Data Quality Integration
8191,Data Science,On-Premises Data Quality,,How to Create IDQ Service from the Informatica Administrator Console,https://www.youtube.com/watch?v=h62-0WvOLgY,Module 4: Informatica Cloud Data Quality Integration
8192,Data Science,On-Premises Data Quality,,How to Create Native Oracle Connection in Informatica,https://www.youtube.com/watch?v=A7FMTVakvSQ,Module 4: Informatica Cloud Data Quality Integration
8193,Data Science,On-Premises Data Quality,,How to Create Native Oracle Connection in Informatica,https://www.youtube.com/watch?v=A7FMTVakvSQ,Module 4: Informatica Cloud Data Quality Integration
8194,Data Science,On-Premises Data Quality,,How to Create and Run a Profile using Developer Tool,https://www.youtube.com/watch?v=SGqt7dDKYi8,Module 4: Informatica Cloud Data Quality Integration
8195,Data Science,On-Premises Data Quality,,How to Perform Developer Tool Cleanup,https://www.youtube.com/watch?v=FPPjPN636FA,Module 4: Informatica Cloud Data Quality Integration
8196,Data Science,On-Premises Data Quality,,How to Perform Developer Tool Cleanup,https://www.youtube.com/watch?v=FPPjPN636FA,Module 4: Informatica Cloud Data Quality Integration
8197,Data Science,On-Premises Data Quality,,How to Configure Workflow Database and Create Content in Data Quality,https://www.youtube.com/watch?v=ndca3KAlafI,Module 4: Informatica Cloud Data Quality Integration
8198,Data Science,On-Premises Data Quality,,How to Configure Profile Warehouse Content in Data Quality,https://www.youtube.com/watch?v=98o4joafJXs,Module 4: Informatica Cloud Data Quality Integration
8199,Data Science,On-Premises Data Quality,,How to Collect Jstack on Developer Tool,https://www.youtube.com/watch?v=S9TIvmQVG3o,Module 4: Informatica Cloud Data Quality Integration
8200,Data Science,On-Premises Data Quality,,How to Deploy Application Using Developer Tool in Informatica,https://www.youtube.com/watch?v=3W2g9jjQkAU,Module 4: Informatica Cloud Data Quality Integration
8201,Data Science,On-Premises Data Quality,,How to Deploy Application Using Developer Tool in Informatica,https://www.youtube.com/watch?v=3W2g9jjQkAU,Module 4: Informatica Cloud Data Quality Integration
8202,Data Science,On-Premises Data Quality,,How To Configure Email Service in Data Quality,https://www.youtube.com/watch?v=PlmxoXEwPks,Module 4: Informatica Cloud Data Quality Integration
8203,Data Science,On-Premises Data Quality,,After EBF 17258 - Screen Recording (KB 622077),https://www.youtube.com/watch?v=fd375HoaFCA,Module 4: Informatica Cloud Data Quality Integration
8204,Data Science,On-Premises Data Quality,,After EBF 17258 - Screen Recording (KB 622077),https://www.youtube.com/watch?v=fd375HoaFCA,Module 4: Informatica Cloud Data Quality Integration
8205,Data Science,On-Premises Data Quality,,Before EBF - Screen Recording (KB 622077),https://www.youtube.com/watch?v=zHFHlj7HaGU,Module 4: Informatica Cloud Data Quality Integration
8206,Data Science,On-Premises Data Quality,,Before EBF - Screen Recording (KB 622077),https://www.youtube.com/watch?v=zHFHlj7HaGU,Module 4: Informatica Cloud Data Quality Integration
8207,Data Science,On-Premises Data Quality,,How to Create IDQ Services during Installation (UNIX),https://www.youtube.com/watch?v=OoBhEYGNyC8,Module 4: Informatica Cloud Data Quality Integration
8208,Data Science,On-Premises Data Quality,,How to Create IDQ Service from Installer in Windows,https://www.youtube.com/watch?v=tNt26AMI-7M,Module 4: Informatica Cloud Data Quality Integration
8209,Data Science,On-Premises Data Quality,,How to Terminate the Workflow in case of Task/Mapping Failure and Send a Notification,https://www.youtube.com/watch?v=ltKq0hnZNQE,Module 4: Informatica Cloud Data Quality Integration
8210,Data Science,On-Premises Data Quality,,How to Increase the Heap Size for MRS/DIS and Other IDQ Services,https://www.youtube.com/watch?v=I6K3i5XSflY,Module 4: Informatica Cloud Data Quality Integration
8211,Data Science,On-Premises Data Quality,,How to Schedule Profile Jobs in Informatica Data Quality,https://www.youtube.com/watch?v=Q60BvscvL3w,Module 4: Informatica Cloud Data Quality Integration
8212,Data Science,On-Premises Data Quality,,How to  Schedule IDQ Jobs using Informatica Data Quality Scheduler,https://www.youtube.com/watch?v=ylHYZ-0n_2I,Module 4: Informatica Cloud Data Quality Integration
8213,Data Science,On-Premises Data Quality,,How to Generate Mapping from SQL Query in Data Quality,https://www.youtube.com/watch?v=16eKRVxG7Y8,Module 4: Informatica Cloud Data Quality Integration
8214,Data Science,On-Premises Data Quality,,How to Configure Versioned MRS using SVN,https://www.youtube.com/watch?v=HQq9UsifeT0,Module 4: Informatica Cloud Data Quality Integration
8215,Data Science,On-Premises Data Quality,,How to Create Versioned MRS using GIT,https://www.youtube.com/watch?v=jfdu_tDfDqg,Module 4: Informatica Cloud Data Quality Integration
8216,Data Science,On-Premises Data Quality,,How to Deploy an Application using Admin Console,https://www.youtube.com/watch?v=aFsQhyht0ec,Module 4: Informatica Cloud Data Quality Integration
8217,Data Science,On-Premises Data Quality,,How to Backup and Restore Model Repository Service (MRS) in IDQ,https://www.youtube.com/watch?v=QK_GQBiogn8,Module 4: Informatica Cloud Data Quality Integration
8218,Data Science,On-Premises Data Quality,,Introduction to Scheduler Service,https://www.youtube.com/watch?v=CyRX1AHFvAg,Module 4: Informatica Cloud Data Quality Integration
8219,Data Science,On-Premises Data Quality,,HOW TO: Create profile on XML JSON data,https://www.youtube.com/watch?v=fYNRHs-k-Xw,Module 4: Informatica Cloud Data Quality Integration
8220,Data Science,On-Premises Data Quality,,HOW TO: Update AddressDoctor Engine File for PowerCenter and Informatica Data Quality (IDQ),https://www.youtube.com/watch?v=Km3tfFGIDEM,Module 4: Informatica Cloud Data Quality Integration
8221,Data Science,On-Premises Data Quality,,Session on Grid (SONG),https://www.youtube.com/watch?v=OS8QBVfbZJI,Module 4: Informatica Cloud Data Quality Integration
8222,Data Science,On-Premises Data Quality,,Hang Analysis - How to Troubleshoot a Hang,https://www.youtube.com/watch?v=geHE-YebkKA,Module 4: Informatica Cloud Data Quality Integration
8223,Data Science,On-Premises Data Quality,,How to Identify Job and Service logs from Server,https://www.youtube.com/watch?v=LpIh-cMLq1U,Module 4: Informatica Cloud Data Quality Integration
8224,Data Science,On-Premises Data Quality,,Integration Service on Grid,https://www.youtube.com/watch?v=qj2nNTQ9gT8,Module 4: Informatica Cloud Data Quality Integration
8225,Data Science,On-Premises Data Quality,,How to Troubleshoot Job Performance Issues in IDQ,https://www.youtube.com/watch?v=3H40UKHxGQY,Module 4: Informatica Cloud Data Quality Integration
8226,Data Science,On-Premises Data Quality,,Monitoring Tool and  Hang Scenarios,https://www.youtube.com/watch?v=dixbkeL4JLQ,Module 4: Informatica Cloud Data Quality Integration
8227,Data Science,On-Premises Data Quality,,How to Identify Job Logs for a Job Run by DIS on a GRID,https://www.youtube.com/watch?v=bjBxkBwaQ4M,Module 4: Informatica Cloud Data Quality Integration
8228,Data Science,On-Premises Data Quality,,Mapping Failure on DIS,https://www.youtube.com/watch?v=2ycVb3ARBuQ,Module 4: Informatica Cloud Data Quality Integration
8229,Data Science,On-Premises Data Quality,,Profiling and PWH Purge Issues,https://www.youtube.com/watch?v=MjU7HG14frA,Module 4: Informatica Cloud Data Quality Integration
8230,Data Science,On-Premises Data Quality,,How to Troubleshoot Search Service Performance,https://www.youtube.com/watch?v=zhIRm8Vu-B0,Module 4: Informatica Cloud Data Quality Integration
8231,Data Science,On-Premises Data Quality,,How to Troubleshoot Analyst Service Startup Issues,https://www.youtube.com/watch?v=WX3XwN5eZQE,Module 4: Informatica Cloud Data Quality Integration
8232,Data Science,On-Premises Data Quality,,DIS Startup Issue,https://www.youtube.com/watch?v=uycskdKw12w,Module 4: Informatica Cloud Data Quality Integration
8233,Data Science,On-Premises Data Quality,,How to Generate Parameter File for DIS Workflow,https://www.youtube.com/watch?v=VQaJ-ZFM8wk,Module 4: Informatica Cloud Data Quality Integration
8234,Data Science,On-Premises Data Quality,,How to gather DQ application ws log file,https://www.youtube.com/watch?v=Q3HsYLx9BWQ,Module 4: Informatica Cloud Data Quality Integration
8235,Data Science,On-Premises Data Quality,,Finding Objects Without Stakeholders in Axon,https://www.youtube.com/watch?v=4DQOs8XlmqI,Module 4: Informatica Cloud Data Quality Integration
8236,Data Science,On-Premises Data Quality,,Finding Objects Without Glossaries in Axon,https://www.youtube.com/watch?v=T5d9nUsHGZQ,Module 4: Informatica Cloud Data Quality Integration
8237,Data Science,On-Premises Data Quality,,Saving and Managing Searches in Axon,https://www.youtube.com/watch?v=iZ33ZCYXuKQ,Module 4: Informatica Cloud Data Quality Integration
8238,Data Science,On-Premises Data Quality,,Getting Started with the Unison Search in Axon,https://www.youtube.com/watch?v=or9lWuvqMfc,Module 4: Informatica Cloud Data Quality Integration
8239,Data Science,On-Premises Data Quality,,How To Make a GET Call Using REST Consumer Transformation,https://www.youtube.com/watch?v=XF5JbC0nmP0,Module 4: Informatica Cloud Data Quality Integration
8240,Data Science,On-Premises Data Quality,,How To View the XML Response  in the log using REST Consumer Transformation,https://www.youtube.com/watch?v=92tf4J5Hu3E,Module 4: Informatica Cloud Data Quality Integration
8241,Data Science,On-Premises Data Quality,,How to View JSON Response in the log using REST Consumer Transformation,https://www.youtube.com/watch?v=u7fs3x83LIg,Module 4: Informatica Cloud Data Quality Integration
8242,Data Science,On-Premises Data Quality,,How to Make a Get Call and Parse the Data Using REST Consumer Transformation,https://www.youtube.com/watch?v=-X2cdm8KnZs,Module 4: Informatica Cloud Data Quality Integration
8243,Data Science,On-Premises Data Quality,,How to Configure Argument Ports in REST Consumer Transformation,https://www.youtube.com/watch?v=gbc6xThadn0,Module 4: Informatica Cloud Data Quality Integration
8244,Data Science,On-Premises Data Quality,,How To Parse Complex JSON Response Using REST Consumer Transformation,https://www.youtube.com/watch?v=_VKLlITn1RM,Module 4: Informatica Cloud Data Quality Integration
8245,Data Science,On-Premises Data Quality,,How To Configure URL Ports in REST Consumer Transformation,https://www.youtube.com/watch?v=Ba6krzi51T8,Module 4: Informatica Cloud Data Quality Integration
8246,Data Science,On-Premises Data Quality,,How To Parse JSON Response Using Data Processor,https://www.youtube.com/watch?v=vOfdYa0yJVw,Module 4: Informatica Cloud Data Quality Integration
8247,Data Science,On-Premises Data Quality,,How To Make a Get Call Using a Schema in REST Consumer Transformation,https://www.youtube.com/watch?v=_b1NvUNSTos,Module 4: Informatica Cloud Data Quality Integration
8248,Data Science,On-Premises Data Quality,,How to configure the Monitoring MRS,https://www.youtube.com/watch?v=mnsiXRLdQ4I,Module 4: Informatica Cloud Data Quality Integration
8249,Data Science,On-Premises Data Quality,,Configuring the Advanced Approval Workflow,https://www.youtube.com/watch?v=ulCrT35Pk5Y,Module 4: Informatica Cloud Data Quality Integration
8250,Data Science,On-Premises Data Quality,,Analyst Rule Builder Part II - Additional Features,https://www.youtube.com/watch?v=VSSDOLB0ncw,Module 4: Informatica Cloud Data Quality Integration
8251,Data Science,On-Premises Data Quality,,How to get started with the AV-transformation within Informatica 9.6.1,https://www.youtube.com/watch?v=hLItQ2S1aWI,Module 4: Informatica Cloud Data Quality Integration
8252,Data Science,On-Premises Data Quality,,How to use AddressDoctor Download Manager?,https://www.youtube.com/watch?v=7mNOkQJKtic,Module 4: Informatica Cloud Data Quality Integration
8253,Data Science,On-Premises Data Quality,,How to use AddressDoctor Cloud with SOAPui,https://www.youtube.com/watch?v=1MSI3e4dz5Y,Module 4: Informatica Cloud Data Quality Integration
8254,Data Science,On-Premises Data Quality,,How to enable partitioning in Informatica Data quality 10.0,https://www.youtube.com/watch?v=oZAidJaBPkA,Module 4: Informatica Cloud Data Quality Integration
8255,Data Science,On-Premises Data Quality,,Analyst Rule Builder v10 Overview,https://www.youtube.com/watch?v=6YA328V9OtA,Module 4: Informatica Cloud Data Quality Integration
8256,Data Science,On-Premises Data Quality,,How to extracting Heap Dump of a Java process on AIX ?,https://www.youtube.com/watch?v=DspgT5Ee1ps,Module 4: Informatica Cloud Data Quality Integration
8257,Data Science,On-Premises Data Quality,,How to configure Developer client to import Hive table from Kerberized Hive,https://www.youtube.com/watch?v=G2VmGrAzyEo,Module 4: Informatica Cloud Data Quality Integration
8258,Data Science,On-Premises Data Quality,,How to Join Profile in Informatica Data Quality?,https://www.youtube.com/watch?v=rfdPzTz-Ghg,Module 4: Informatica Cloud Data Quality Integration
8259,Data Science,On-Premises Data Quality,,How to create a RULE Specifiaction using Reference table,https://www.youtube.com/watch?v=2U306dV58Bg,Module 4: Informatica Cloud Data Quality Integration
8260,Data Science,On-Premises Data Quality,,How to troubleshoot service startup issues after enabling ia4j trace,https://www.youtube.com/watch?v=ED6meAew9wg,Module 4: Informatica Cloud Data Quality Integration
8261,Data Science,On-Premises Data Quality,,Finding cost of Invalid Data,https://www.youtube.com/watch?v=P7tgMjBvuME,Module 4: Informatica Cloud Data Quality Integration
8262,Data Science,On-Premises Data Quality,,How to create a Rule Specifiction that validates product Information,https://www.youtube.com/watch?v=C4V0eKgBWqU,Module 4: Informatica Cloud Data Quality Integration
8263,Data Science,On-Premises Data Quality,,How to create Rule specification using Rule builder in Analyst 9.6.x,https://www.youtube.com/watch?v=9WF3dyvrjgc,Module 4: Informatica Cloud Data Quality Integration
8264,Data Science,On-Premises Data Quality,,How to create JDBC connection in Informatica Data Quality,https://www.youtube.com/watch?v=N5JvOOV-2wU,Module 4: Informatica Cloud Data Quality Integration
8265,Data Science,On-Premises Data Quality,,Concepts of Router Transformation on IDQ,https://www.youtube.com/watch?v=WlyilPyG1Fk,Module 4: Informatica Cloud Data Quality Integration
8266,Data Science,On-Premises Data Quality,,How to enable Snoop trace for JDBC connection in Data Quality,https://www.youtube.com/watch?v=FtG__fwkhxg,Module 4: Informatica Cloud Data Quality Integration
