Unnamed: 0,Sector,CourseName,Duration,TopicName,URL,Module,ModuleNo
7151,Urban Planning,Urban Governance,24hrs 12min,Emerging Focus on Urban Development and Administrartion,https://www.youtube.com/watch?v=3voM0TctXAk,Module 1: Introduction to Urban Governance,1
7152,Urban Planning,Urban Governance,,Good Urban Governance Norms and Application Process,https://www.youtube.com/watch?v=agp6WcktKT0,Module 1: Urbanisation Trends and Implications,1
7153,Urban Planning,Urban Governance,,Urbanisation Trends and Implications,https://www.youtube.com/watch?v=pXKn4YaHM_Q,Module 1: Emerging Focus on Urban Development and Administrartion,1
7154,Urban Planning,Urban Governance,,Urban Planning Concepts and Application,https://www.youtube.com/watch?v=va1EDyO-jp4,Module 2: Urban Planning Concepts and Application,2
7155,Urban Planning,Urban Governance,,Municipal Finance,https://www.youtube.com/watch?v=3m5wIzWxYoo,Module 2: Good Urban Governance Norms and Application Process,2
7156,Urban Planning,Urban Governance,,Urban services and Infrastructure,https://www.youtube.com/watch?v=f7R8Gvc4QGQ,Module 3: Municipal Finance,3
7157,Urban Planning,Urban Governance,,Smart Urban Governance and Solutions,https://www.youtube.com/watch?v=YmKYySa1WV0,Module 3: Urban services and Infrastructure,3
7158,Urban Planning,Urban Governance,,Smart Urban Governance and Solution,https://www.youtube.com/watch?v=HxYapshGLN8,Module 4: Smart Urban Governance and Solutions,4
7159,Urban Planning,Urban Governance,,Introduction - Urban Governance - Prof K K Pandey | Couses at IIPA,https://www.youtube.com/watch?v=QS8v4635M2k,Module 4: Smart Urban Governance and Solution,4
