Unnamed: 0,Sector,CourseName,Duration,TopicName,URL,Module,ModuleNo
12126,Psychology,Psychopathology - Psychology Alevel (AQA) Paper 1,46hrs 18min,Psychopathology - AQA Psychology under 20 MINS! *NEW* Quick Revision for Paper 1,https://www.youtube.com/watch?v=yVsEcpHkukk,Module 1: Introduction to Psychopathology,1
12127,Psychology,Psychopathology - Psychology Alevel (AQA) Paper 1,,Definitions of Abnormality - Psychopathology [A-Level Psychology],https://www.youtube.com/watch?v=7xz_ucm8Lso,Module 1: Introduction to Psychopathology,2
12128,Psychology,Psychopathology - Psychology Alevel (AQA) Paper 1,,"Characteristics of phobias, depression and OCD - Psychopathology [A-Level Psychology]",https://www.youtube.com/watch?v=QLcAeo2UeRo,Module 1: Introduction to Psychopathology,3
12129,Psychology,Psychopathology - Psychology Alevel (AQA) Paper 1,,Phobias: explaining and treating (behavioural approach) - Psychopathology [A-Level Psychology],https://www.youtube.com/watch?v=DO-rr8v9z2A,Module 2: Explaining and Treating Phobias,4
12130,Psychology,Psychopathology - Psychology Alevel (AQA) Paper 1,,Depression: explaining and treating (cognitive approach) - Psychopathology [A-Level Psychology],https://www.youtube.com/watch?v=NETFOJSenMw,Module 2: Explaining and Treating Phobias,5
12131,Psychology,Psychopathology - Psychology Alevel (AQA) Paper 1,,OCD: explaining and treating (Biological approach) - Psychopathology [A-Level Psychology],https://www.youtube.com/watch?v=EiD24HSCGnM,Module 3: Understanding and Addressing Depression and OCD,6
