Unnamed: 0,Sector,CourseName,Duration,TopicName,URL
5495,Operations Management,inventory control hindi,49hrs 3min,Inventory Management |Production Management |What is inventory model-Part 1,https://www.youtube.com/watch?v=Iu69_o8DNoc
5496,Operations Management,inventory control hindi,,Classification of Inventory Models|Inventory Management |Operation Research-Part 3,https://www.youtube.com/watch?v=kf8VqBzUodA
5497,Operations Management,inventory control hindi,,Economic Order Quantity Hindi |EOQ model example |Deterministic Inventory | Inventory Model-Part 4,https://www.youtube.com/watch?v=6XvRlGyYcYQ
5498,Operations Management,inventory control hindi,,ABC Analysis | abc analysis in inventory management in hindi- Part 5,https://www.youtube.com/watch?v=9qnLpjpnsuQ
5499,Operations Management,inventory control hindi,,Inventory Model Questions |EOQ solved numerical| Deterministic Model no shortage Hindi-Part 6,https://www.youtube.com/watch?v=PWL9dLa2fpA
5500,Operations Management,inventory control hindi,,Inventory Management in Hindi |Types Of Cost involved in Inventory Model|Holding Cost| Shortage Cost,https://www.youtube.com/watch?v=qpGvkSzL7nE
5501,Operations Management,inventory control hindi,,Inventory Model| Economic lot size with finite rate of Replenishment| EOQ Model - Part 7,https://www.youtube.com/watch?v=_BWo8mkq31g
5502,Operations Management,inventory control hindi,,VED Analysis| Ved Analysis in Inventory Control in hindi | Operation Research- Part 8,https://www.youtube.com/watch?v=vdo9sN7Z20Y
