Unnamed: 0,Sector,CourseName,Duration,TopicName,URL
11650,Music,Music Theory,40hrs 4min,Grade 1 Music Theory - Rhythm,https://www.youtube.com/watch?v=6zyv0O7kfcc
11651,Music,Music Theory,,Grade 2 Music Theory - Major Keys & Scales,https://www.youtube.com/watch?v=BcLfuGz_IKE
11652,Music,Music Theory,,Grade 3 Music Theory - Simple & Compound Time Signatures,https://www.youtube.com/watch?v=qi6uuhU1unk
11653,Music,Music Theory,,Grade 4 Music Theory - Orchestral Instruments & Families,https://www.youtube.com/watch?v=qXJo2Nsayi4
11654,Music,Music Theory,,Grade 5 Music Theory - Composing a Melody in a Major Key,https://www.youtube.com/watch?v=n7ZC1YKxF_8
11655,Music,Music Theory,,Grade 5 Music Theory - Composing a Melody in a Minor Key,https://www.youtube.com/watch?v=I3qGURLohNM
11656,Music,Music Theory,,Advanced Music Theory - Harmony,https://www.youtube.com/watch?v=-xZ6m1vBQg8
11657,Music,Music Theory,,Advanced Music Theory - Melody Writing,https://www.youtube.com/watch?v=ei652x61Tbk
11658,Music,Music Theory,,Advanced Music Theory - Figured Bass,https://www.youtube.com/watch?v=VoBVy0-m_V4
11659,Music,Music Theory,,Music Theory - Understanding The Circle of Fifths,https://www.youtube.com/watch?v=_LHv5WN4SiU
11660,Music,Music Theory,,Why Should You Learn Music Theory?,https://www.youtube.com/watch?v=ZdbkTJpULsU
11661,Music,Music Theory,,Transposing a Melody into Another Key - Music Theory,https://www.youtube.com/watch?v=Cwailb5VsUU
11662,Music,Music Theory,,The Perfect Cadence - Music Theory,https://www.youtube.com/watch?v=ouOXGEkLSSc
11663,Music,Music Theory,,The Plagal Cadence - Music Theory,https://www.youtube.com/watch?v=N_hYsHcxwUo
11664,Music,Music Theory,,How Good is Your Harmony? - Music Theory,https://www.youtube.com/watch?v=GNGQZNURHLE
11665,Music,Music Theory,,The Imperfect Cadence - Music Theory,https://www.youtube.com/watch?v=7PMtz8bpS8g
11666,Music,Music Theory,,The Interrupted Cadence - Music Theory,https://www.youtube.com/watch?v=GBVv8_K9SK4
11667,Music,Music Theory,,How to Harmonize a Major Scale - Music Theory,https://www.youtube.com/watch?v=xHmF_ZB94GQ
11668,Music,Music Theory,,Circle of Fifths Quiz - Music Theory,https://www.youtube.com/watch?v=b9X3SDZjkh8
11669,Music,Music Theory,,Extended Chords Made Clear - Music Theory,https://www.youtube.com/watch?v=--l1k_IBDmE
11670,Music,Music Theory,,The Whole Tone Scale - Music Theory,https://www.youtube.com/watch?v=DjsF37sRrE4
11671,Music,Music Theory,,Alto Clef and Tenor Clef Explained - Music Theory,https://www.youtube.com/watch?v=cd8ilYHjqg8
11672,Music,Music Theory,,Spot the Music Notation Mistakes - Music Theory,https://www.youtube.com/watch?v=TtG7RQtz3Wo
11673,Music,Music Theory,,Serialism & Serial Music Explained - Music Theory,https://www.youtube.com/watch?v=8sm3o-2cfIQ
11674,Music,Music Theory,,Anticipation Notes (Non-Harmonic Tones) - Music Theory,https://www.youtube.com/watch?v=VxM5N0cVNHU
11675,Music,Music Theory,,Auxiliary Notes (Non-Harmonic Tones) - Music Theory,https://www.youtube.com/watch?v=skeQak7jsNg
11676,Music,Music Theory,,Reading Notes in the Alto Clef - Music Theory,https://www.youtube.com/watch?v=3-ZjDVAEX6k
11677,Music,Music Theory,,How to Modulate - Music Theory,https://www.youtube.com/watch?v=Tgyq6RfIF6c
11678,Music,Music Theory,,What is a Secondary Dominant? - Music Theory,https://www.youtube.com/watch?v=YVQiE441t2M
11679,Music,Music Theory,,How to Work Out the Key of a Piece of Music - Music Theory,https://www.youtube.com/watch?v=-MdQspoF9wQ
11680,Music,Music Theory,,Reading Notes in the Tenor Clef - Music Theory,https://www.youtube.com/watch?v=szOVbfnmAXg
11681,Music,Music Theory,,What is a Lombard Rhythm? (The Scotch Snap) - Music Theory,https://www.youtube.com/watch?v=_1UrgW1g6W4
11682,Music,Music Theory,,Passing Notes (Non-Harmonic Tones) - Music Theory,https://www.youtube.com/watch?v=75S51R7s2R8
11683,Music,Music Theory,,Diminished 7th Chords - Music Theory,https://www.youtube.com/watch?v=nLli5j0ZJZw
11684,Music,Music Theory,,Intervals Quiz - Music Theory,https://www.youtube.com/watch?v=rWRAE5apzZw
11685,Music,Music Theory,,Swing Rhythm Explained - Music Theory,https://www.youtube.com/watch?v=_OXgWmPCC1U
11686,Music,Music Theory,,What is Texture? - Music Theory,https://www.youtube.com/watch?v=rTKTpY6PJL8
11687,Music,Music Theory,,A Simple Guide to Modes - Music Theory,https://www.youtube.com/watch?v=wMftXzZrv3g
11688,Music,Music Theory,,How Well Do You Know Your Intervals? - Music Theory,https://www.youtube.com/watch?v=2g7IeolUgE8
11689,Music,Music Theory,,How to Draw a Piano Keyboard - Music Theory,https://www.youtube.com/watch?v=V0Jfuha5oIM
11690,Music,Music Theory,,How Does a Pedal Point Work? - Music Theory,https://www.youtube.com/watch?v=WjMO4hb7sQM
11691,Music,Music Theory,,How to Harmonize a Minor Scale - Music Theory,https://www.youtube.com/watch?v=o6jdIDdZtgU
11692,Music,Music Theory,,Name the Time Signatures - Music Theory,https://www.youtube.com/watch?v=iU1WB9UlD_Q
11693,Music,Music Theory,,Reading Bass Clef Ledger Lines - Music Theory,https://www.youtube.com/watch?v=hJHePlu9zoU
11694,Music,Music Theory,,Reading Treble Clef Ledger Lines - Music Theory,https://www.youtube.com/watch?v=Iya1kIw7FRE
11695,Music,Music Theory,,Music Theory Exam Tips & Advice - Music Theory,https://www.youtube.com/watch?v=TigvlBBeu9s
11696,Music,Music Theory,,Can You Work Out the Time Signature of these Rhythms? - Music Theory,https://www.youtube.com/watch?v=nRvXfaiU9pA
11697,Music,Music Theory,,What is a Motif in Music? - Music Theory,https://www.youtube.com/watch?v=iys7Byk6xOw
11698,Music,Music Theory,,Augmented 6th Chords - Music Theory,https://www.youtube.com/watch?v=5PtZQEB-d7A
11699,Music,Music Theory,,Chord Identification - Music Theory,https://www.youtube.com/watch?v=CTfX7JPbz20
11700,Music,Music Theory,,Are You Able to Identify These Intervals? - Music Theory,https://www.youtube.com/watch?v=IpCzy2mrA7o
11701,Music,Music Theory,,The Easy Method to Work Out Intervals - Music Theory,https://www.youtube.com/watch?v=2lVf7Vu09L4
11702,Music,Music Theory,,Naming Chords - Music Theory,https://www.youtube.com/watch?v=XcQRegmKDAY
11703,Music,Music Theory,,How to Harmonize a Melody - Music Theory,https://www.youtube.com/watch?v=6Vy8opl_J8s
11704,Music,Music Theory,,Which Key is this Piece of Music in? - Music Theory,https://www.youtube.com/watch?v=GhjF1RnXPw8
11705,Music,Music Theory,,Modulation using the Circle of Fifths - Music Theory,https://www.youtube.com/watch?v=s4XiEg7kESI
11706,Music,Music Theory,,What is a Hemiola? - Music Theory,https://www.youtube.com/watch?v=pR0sZc8_Gk0
11707,Music,Music Theory,,How to Tell if Music is in Simple Time or Compound Time - Music Theory,https://www.youtube.com/watch?v=UqJxXH2voMI
11708,Music,Music Theory,,Test Your Knowledge of The Circle of Fifths - Music Theory,https://www.youtube.com/watch?v=aG11nvq5KaQ
11709,Music,Music Theory,,How to Harmonize a Melody in a Minor Key - Music Theory,https://www.youtube.com/watch?v=YK_D4I2gbjs
11710,Music,Music Theory,,How to Recognize Written Chords in Sheet Music - Music Theory,https://www.youtube.com/watch?v=SWrQi0tmXPs
11711,Music,Music Theory,,Chord Variations in Four Parts - Music Theory,https://www.youtube.com/watch?v=rTerDooMk7I
11712,Music,Music Theory,,Can You Beam Correctly in 6/8 Compound Time? - Music Theory,https://www.youtube.com/watch?v=1B_YTVBpz2k
11713,Music,Music Theory,,Modulation using Diminished 7ths - Music Theory,https://www.youtube.com/watch?v=vdHyxs8C8tI
11714,Music,Music Theory,,Modulation using the German 6th Chord - Music Theory,https://www.youtube.com/watch?v=vI7LGdCEc4k
11715,Music,Music Theory,,Modulation using a Pivot Note - Music Theory,https://www.youtube.com/watch?v=cQbHSEDpE6s
11716,Music,Music Theory,,True or False Quiz - Music Theory,https://www.youtube.com/watch?v=X8OLG-x2AS4
11717,Music,Music Theory,,Modulation by Semitone Shift - Music Theory,https://www.youtube.com/watch?v=Y2lUmwB7lzI
11718,Music,Music Theory,,Modulation using the Neapolitan Chord - Music Theory,https://www.youtube.com/watch?v=RUN4M6_kT9E
11719,Music,Music Theory,,How to Identify Musical Keys - Music Theory,https://www.youtube.com/watch?v=26URWg7umFo
11720,Music,Music Theory,,Can You Name the Interval? - Music Theory,https://www.youtube.com/watch?v=yIrDmr9AOZY
11721,Music,Music Theory,,What Might an Accidental Be Telling Us in a Piece of Music? - Music Theory,https://www.youtube.com/watch?v=MZaUG7v3Lmk
11722,Music,Music Theory,,Minor Key Harmony - Music Theory,https://www.youtube.com/watch?v=FwensA5d4n0
11723,Music,Music Theory,,Enharmonic Equivalents - Music Theory,https://www.youtube.com/watch?v=5aDP7u78EIU
11724,Music,Music Theory,,Time Signatures Quiz - Music Theory,https://www.youtube.com/watch?v=jXvS9iVMdls
11725,Music,Music Theory,,Extreme Modulation Using Chromatic Harmony - Music Theory,https://www.youtube.com/watch?v=tCNihwOxyG4
11726,Music,Music Theory,,Having Fun with 12 Bar Blues - Music Theory,https://www.youtube.com/watch?v=3ukUFH_D1_Y
11727,Music,Music Theory,,Is it Really a Half Diminished 7th Chord? - Music Theory,https://www.youtube.com/watch?v=Hd4I49YsV2w
11728,Music,Music Theory,,Note Reading Puzzles - Music Theory,https://www.youtube.com/watch?v=WRBXSmwTTBs
11729,Music,Music Theory,,Why the Notes E# B# Cb and Fb Really Do Exist - Music Theory,https://www.youtube.com/watch?v=FDzw1jByVDA
11730,Music,Music Theory,,What is a Cadential 6-4? - Music Theory,https://www.youtube.com/watch?v=HWfBO795B_E
11731,Music,Music Theory,,False Relation - Music Theory,https://www.youtube.com/watch?v=D4r4ONGiy7A
11732,Music,Music Theory,,Can You Name the Key of this Piece of Music? - Music Theory,https://www.youtube.com/watch?v=HIw4bYC2S3k
11733,Music,Music Theory,,Why Do We Have 3 Minor Scales? - Music Theory,https://www.youtube.com/watch?v=MCvh8wN9Ic4
11734,Music,Music Theory,,Dealing with Non-Harmonic Tones - Music Theory,https://www.youtube.com/watch?v=EKSjlsFH9ZQ
11735,Music,Music Theory,,The Difference Between 2/4 and 4/4 Time Signatures - Music Theory,https://www.youtube.com/watch?v=rgknkk9wlJw
11736,Music,Music Theory,,What's the Key of this Piece? - Music Theory,https://www.youtube.com/watch?v=stkAaZ5bE2M
11737,Music,Music Theory,,Escape Notes (Non-Harmonic Tones) - Music Theory,https://www.youtube.com/watch?v=NPz--Fki7tg
11738,Music,Music Theory,,The Most Effective Way to Transpose Music - Music Theory,https://www.youtube.com/watch?v=Z42J5VpYE90
11739,Music,Music Theory,,A Beginner's Guide to Four-Part Harmony - Music Theory,https://www.youtube.com/watch?v=GoUQ_WHCe48
11740,Music,Music Theory,,How Well Do You Know The Circle of Fifths? - Music Theory,https://www.youtube.com/watch?v=JA1HqE7bvTc
11741,Music,Music Theory,,Consecutive Fifths and Consecutive Octaves - Music Theory,https://www.youtube.com/watch?v=nbaqszym90k
11742,Music,Music Theory,,Classical Voice Types - Music Theory,https://www.youtube.com/watch?v=6Qcg7tSoMxE
11743,Music,Music Theory,,Short Score and Open Score for Voices - Music Theory,https://www.youtube.com/watch?v=zucFy4THorM
11744,Music,Music Theory,,Choral Music Notation - Music Theory,https://www.youtube.com/watch?v=OLoqQCe67Xc
11745,Music,Music Theory,,What is a Nota Cambiata? - Music Theory,https://www.youtube.com/watch?v=thjgKPNV0tI
11746,Music,Music Theory,,The Difference Between 3/4 and 6/8 Time Signatures - Music Theory,https://www.youtube.com/watch?v=gxynOZ_vt6U
11747,Music,Music Theory,,How to Remember Which Notes Stringed Instruments Are Tuned to - Music Theory,https://www.youtube.com/watch?v=4fQqAikhQ7g
11748,Music,Music Theory,,The Difference Between 2/2 and 4/4 Time Signatures - Music Theory,https://www.youtube.com/watch?v=0NOmCvMjkIM
11749,Music,Music Theory,,How Chord Inversions Work - Music Theory,https://www.youtube.com/watch?v=YBHY-0mmKkA
11750,Music,Music Theory,,Musical Note Names in the USA and UK - Music Theory,https://www.youtube.com/watch?v=7l9X-K1_pNs
11751,Music,Music Theory,,What is Pandiatonicism in Music? - Music Theory,https://www.youtube.com/watch?v=VTJz0ipMoZM
11752,Music,Music Theory,,The Difference Between 3/4 and 3/8 Time Signatures - Music Theory,https://www.youtube.com/watch?v=5j16_w0-z-E
11753,Music,Music Theory,,What are Messiaen's Modes of Limited Transposition? - Music Theory,https://www.youtube.com/watch?v=sINOS_3RwQ8
11754,Music,Music Theory,,How to Realize Simple Figured Bass - Music Theory,https://www.youtube.com/watch?v=jMQebrF1Xec
11755,Music,Music Theory,,How to Realize More Advanced Figured Bass - Music Theory,https://www.youtube.com/watch?v=VKpDdsnThYY
11756,Music,Music Theory,,How to Recognise Modulation in a Piece of Music - Music Theory,https://www.youtube.com/watch?v=Ja9itMnYXng
11757,Music,Music Theory,,How to Build Major and Minor Chords - Music Theory,https://www.youtube.com/watch?v=yrL6f2M2aFc
11758,Music,Music Theory,,The Difference Between a German 6th and a Dominant 7th - Music Theory,https://www.youtube.com/watch?v=Z3rvb42lEvU
11759,Music,Music Theory,,Roman Numeral Chord Notation - Music Theory,https://www.youtube.com/watch?v=PAiSQ7g3LuA
11760,Music,Music Theory,,How to Write Five-Part Harmony - Music Theory,https://www.youtube.com/watch?v=S30Sq6Dajng
11761,Music,Music Theory,,Modulation Using a Tritone - Music Theory,https://www.youtube.com/watch?v=4zCMONIYXco
11762,Music,Music Theory,,How to Change Key with One Note - Music Theory,https://www.youtube.com/watch?v=feM9Mr_h_J0
11763,Music,Music Theory,,What is the Pentatonic Scale? - Music Theory,https://www.youtube.com/watch?v=MPHWcy5I-Uc
11764,Music,Music Theory,,Using the Circle of Fifths on Piano - Music Theory,https://www.youtube.com/watch?v=7lbF3EBkPuM
11765,Music,Music Theory,,Why Learn Figured Bass? - Music Theory,https://www.youtube.com/watch?v=zgIhvABslQE
11766,Music,Music Theory,,How to Analyze Harmony in Music - Music Theory,https://www.youtube.com/watch?v=P8SGb_RAg8I
11767,Music,Music Theory,,Identifying Non-Chord Tones - Music Theory,https://www.youtube.com/watch?v=OAcAjuIaP4I
11768,Music,Music Theory,,Two Against Three Rhythms - Music Theory,https://www.youtube.com/watch?v=FBxxJZxvnU4
11769,Music,Music Theory,,Who Needs the Rule of the Octave? - Music Theory,https://www.youtube.com/watch?v=eY3vaIdxwq8
11770,Music,Music Theory,,How to Vary the Harmony for Repeated Notes - Music Theory,https://www.youtube.com/watch?v=wgEpva3WJo0
11771,Music,Music Theory,,Why There's Only One Way to Resolve a Flat II Chord - Music Theory,https://www.youtube.com/watch?v=Vlyo6cpKbJs
11772,Music,Music Theory,,Harmonizing a Chromatic Scale is Not Impossible - Music Theory,https://www.youtube.com/watch?v=IdFc_nhTv0M
11773,Music,Music Theory,,Changing Harmony from Major to Minor - Music Theory,https://www.youtube.com/watch?v=csXcXYyvq40
11774,Music,Music Theory,,Using Chords in the Natural Minor - Music Theory,https://www.youtube.com/watch?v=3oEgjMZ96Kk
11775,Music,Music Theory,,What are Polychords? - Music Theory,https://www.youtube.com/watch?v=_siNoMCpJNg
