Unnamed: 0,Sector,CourseName,Duration,TopicName,URL,Module,ModuleNo
5502,Physical Education,Dance Education Playlist,0hrs 2641min,Kotchegna Dance Company,https://www.youtube.com/watch?v=hYf3pF4kM58,Module 1: Introduction to Dance,1.1
5503,Physical Education,Dance Education Playlist,,Short History of Dance - prehistory and ancient times,https://www.youtube.com/watch?v=wTKKnhmNMu0,Module 1: Introduction to Dance,1.2
5504,Physical Education,Dance Education Playlist,,"Why humans love to bust a move | Dance, Dance Evolution",https://www.youtube.com/watch?v=FyTqEl1yKbQ,Module 1: Introduction to Dance,1.3
5505,Physical Education,Dance Education Playlist,,Why Do We Dance To Music?,https://www.youtube.com/watch?v=eWMP22dbv4k,Module 1: Introduction to Dance,1.4
5506,Physical Education,Dance Education Playlist,,THE HISTORY OF BACHATA - DOCUMENTARY MUSIC & DANCE DOMINICAN REPUBLIC Historia De Bachata Documental,https://www.youtube.com/watch?v=StMiABRzjZc,Module 2: Dance History and Evolution,2.1
5507,Physical Education,Dance Education Playlist,,6 TYPES OF SALSA DANCING - VERY WELL EXPLAINED,https://www.youtube.com/watch?v=Z8kGAkvuwnA,Module 2: Dance History and Evolution,2.2
5508,Physical Education,Dance Education Playlist,,"Free to Dance  Episode 2: ""Steps of the Gods"" (part 1)",https://www.youtube.com/watch?v=UcN0G7xItwo,Module 2: Dance History and Evolution,2.3
5509,Physical Education,Dance Education Playlist,,A BRIEF HISTORY OF BALLET : Ballet Through the Different Time Periods Renaissance to Contemporary,https://www.youtube.com/watch?v=YrkUxglHvzA,Module 3: Exploring Dance Styles,3.1
