Unnamed: 0,Sector,CourseName,Duration,TopicName,URL
2564,Marketing,Retail Management,22hrs 8min,"Retail Management - Meaning, Examples, Factors, Nature, Scope, Functions, Importance, Process",https://www.youtube.com/watch?v=jr5z__omU3w
2565,Marketing,Retail Management,,"Retail Management scope, scope of Retail Management, nature and scope retailing",https://www.youtube.com/watch?v=57moZbvR-yU
2566,Marketing,Retail Management,,"Nature of retailing, nature of retail management, nature and scope of retailing",https://www.youtube.com/watch?v=K9ej2UJQAB0
2567,Marketing,Retail Management,,"Importance of Retailing, importance of retail management, importance of retailing in hindi",https://www.youtube.com/watch?v=dpRBsJiOWaE
2568,Marketing,Retail Management,,"Factors affecting retailing, factors influencing retailing, factors influencing retail management",https://www.youtube.com/watch?v=8BaaLxsWqlc
2569,Marketing,Retail Management,,"Functions of retailing, functions of retail management, functions of retailing in hindi",https://www.youtube.com/watch?v=QMp0MFCcVTo
2570,Marketing,Retail Management,,Characteristics of retailing | Characteristics of retail management,https://www.youtube.com/watch?v=K4Oi_kAPcR4
2571,Marketing,Retail Management,,"Recent trends in retailing, Emerging trends in retail marketing, Modern trends in retailing",https://www.youtube.com/watch?v=fb8aWfSowQI
2572,Marketing,Retail Management,,"Retailing is superior than other forms, retail, retailing, retail management ,retailing",https://www.youtube.com/watch?v=emlhs31SgNQ
2573,Marketing,Retail Management,,"Retail formats, Types of Retailing Formats in Hindi - Retail Management",https://www.youtube.com/watch?v=ELogb63QesY
2574,Marketing,Retail Management,,"Reasons for the growth of Indian retail sectors, Factors responsible for the growth of retailing",https://www.youtube.com/watch?v=UtL-amVHk9Q
2575,Marketing,Retail Management,,"Retail Manager, retail manager skills, how to be a good retail manager, retail, manager",https://www.youtube.com/watch?v=Lrxz0T77k6o
2576,Marketing,Retail Management,,"Retail Mix, retail mix in retail management, retail mix in hindi, 7ps retail mix",https://www.youtube.com/watch?v=oZHkgQzt6vA
2577,Marketing,Retail Management,,"Retail planning process, strategic planning, strategic retail planning process in hindi",https://www.youtube.com/watch?v=lOqH6mFq468
2578,Marketing,Retail Management,,"What is Retail Management in hindi,  What is retailing,  retail management",https://www.youtube.com/watch?v=1nmolATTxEk
2579,Marketing,Retail Management,,"Theories of Retailing, Theories of Retail Development, Theories of Retail Management in Hindi",https://www.youtube.com/watch?v=AUkEbmA7M1k
2580,Marketing,Retail Management,,"Organised and Unorganised retailing, Organize and Unorganize retail",https://www.youtube.com/watch?v=j7V8mFzekH0
2581,Marketing,Retail Management,,"Retail life cycle, retail life cycle theory, retail life cycle in hindi, retail management",https://www.youtube.com/watch?v=hDJjyWqfgY8
2582,Marketing,Retail Management,,"Wheels of retailing, wheels of retailing theory, what is retailing wheels",https://www.youtube.com/watch?v=Iw1cHBu7Pgw
2583,Marketing,Retail Management,,"Retailers vs Wholesaler , Difference between Retailers and Wholesaler,  Retail Management",https://www.youtube.com/watch?v=3zrHigh4jwM
2584,Marketing,Retail Management,,"Retail Marketing Environment, retail environment in India, retail marketing environment",https://www.youtube.com/watch?v=pGeKDP0BHi4
2585,Marketing,Retail Management,,"Retail planning, retail marketing planning, retail strategic planning process, retail management",https://www.youtube.com/watch?v=iEuaZHIMVQo
2586,Marketing,Retail Management,,"Retail Marketing Strategy, Retail Marketing Strategy in Hindi, Retail Marketing",https://www.youtube.com/watch?v=W52DvNF1Dkc
2587,Marketing,Retail Management,,"challenges faced by retail sector in india, challenges faced by retailers",https://www.youtube.com/watch?v=RcMCi6gKgAQ
2588,Marketing,Retail Management,,"Retail Marketing, Retail Marketing in hindi, retail marketing in tamil, retail marketing mix",https://www.youtube.com/watch?v=dez-2Er4MT4
2589,Marketing,Retail Management,,"Retail Promotion, Retail Promotion Mix, Retail Promotion Strategy, Retail Management",https://www.youtube.com/watch?v=JnnDhQCjVNA
2590,Marketing,Retail Management,,"Retail Information System, Retail Information System in Hindi, Retail Management Information System",https://www.youtube.com/watch?v=x2qZKhjg7UQ
2591,Marketing,Retail Management,,"Retail Locations, Types of retail locations, retail location in Hindi, retail management",https://www.youtube.com/watch?v=oGZyo71BHlU
2592,Marketing,Retail Management,,"Retail Location - Meaning, Factors, Importance, Types, Objective, Functions, Retail Management",https://www.youtube.com/watch?v=aLCnunCmUMw
2593,Marketing,Retail Management,,"Retail Pricing, Retail Pricing Strategies, Retail Pricing in Retail Management",https://www.youtube.com/watch?v=VFoEE34BttI
2594,Marketing,Retail Management,,"Retail store management, retail store design, retail design, store design",https://www.youtube.com/watch?v=4Y5bwmMXK80
2595,Marketing,Retail Management,,"Retail space management, space management in retail, effective retail space management",https://www.youtube.com/watch?v=r4oFx-Y_GRs
2596,Marketing,Retail Management,,"Evolution of retail in India, Evolution of retailing, evolution of retail management",https://www.youtube.com/watch?v=GKbGHbuAZyE
2597,Marketing,Retail Management,,"Visual Merchandising, visual merchandising in retail, visual merchandising in hindi",https://www.youtube.com/watch?v=0QHPt58y0TQ
2598,Marketing,Retail Management,,"Merchandising, Merchandising in retail management, Merchandising meaning, Merchandising kya hota hai",https://www.youtube.com/watch?v=p42UWk_TYD0
2599,Marketing,Retail Management,,"CRM in Retail management, cutomer relationship management in retail, Retail in CRM",https://www.youtube.com/watch?v=TfEWYGGwYT8
2600,Marketing,Retail Management,,"Merchandising planning, merchandising, merchandising planning process, merchandising",https://www.youtube.com/watch?v=elQqM5Cq4Qk
2601,Marketing,Retail Management,,"Mom and Pop Stores, mom & pop stores, kirana stores, retail management, retailing, retail",https://www.youtube.com/watch?v=0sTvzpTozLc
2602,Marketing,Retail Management,,"E retailing, e-retailing, types, features, benefits, model, advantages and disadvantages, examples",https://www.youtube.com/watch?v=uOot36MMHWM
2603,Marketing,Retail Management,,"Discount stores, discount stores in india, discount stores in retail",https://www.youtube.com/watch?v=fk3bqnphVeY
2604,Marketing,Retail Management,,"Department store, department store business plan, department store business",https://www.youtube.com/watch?v=_7bmDWsacgE
2605,Marketing,Retail Management,,"Supermarket stores, supermarket, supermarket meaning and definition in marketing, examples",https://www.youtube.com/watch?v=BGsmD2PD6M4
2606,Marketing,Retail Management,,"Green retailing  -  Meaning, example, features, ppt, pdf, research paper, world",https://www.youtube.com/watch?v=do7qI33pnBU
2607,Marketing,Retail Management,,"Chain stores, chain stores class 11, chain store management, chain store, retail management",https://www.youtube.com/watch?v=OITj4LMZW00
2608,Marketing,Retail Management,,"Category management, category management in retail, category management process, strategy,",https://www.youtube.com/watch?v=Png9AYiot_E
2609,Marketing,Retail Management,,"omnichannel vs multichannel, multichannel vs omnichannel, multichannel, omnichannel.mp4",https://www.youtube.com/watch?v=hc1FlIlJ4hg
2610,Marketing,Retail Management,,"international retailing, internation, retailing, global retailing, international retail",https://www.youtube.com/watch?v=hHruZie1P80
2611,Marketing,Retail Management,,"Multichannel retailing, Multi-channel retailing, multichannel, retailing, omnichannel",https://www.youtube.com/watch?v=IIlKHQuFnIE
2612,Marketing,Retail Management,,"ethics in retailing, ethics in retail marketing, ethical and legal issues in retailing",https://www.youtube.com/watch?v=On6px8x9lrs
2613,Marketing,Retail Management,,"Non store retailing, non store retail, retail management, non store retail management",https://www.youtube.com/watch?v=92QLUMdg5lM
2614,Marketing,Retail Management,,"Store-based retailing, store retailing, store, retailing, types of store based retailing",https://www.youtube.com/watch?v=QEjfuuav4xY
2615,Marketing,Retail Management,,"types of retailing, classification of retailing, types of retail store,Differenet types of retailing",https://www.youtube.com/watch?v=oz6eo_0al60
2616,Marketing,Retail Management,,"Franchise business, franchise kya hota hai, franchising, franchise, franchise business idea",https://www.youtube.com/watch?v=-T7LpEaWtCw
2617,Marketing,Retail Management,,"nature and scope of retaiing, scope and nature of retailing, nature of retailing, scope of retailing",https://www.youtube.com/watch?v=1FOUSPCzAgQ
2618,Marketing,Retail Management,,"Wholesaler, wholesalling, functions, importance, types, types of wholesaler, meaning, trends,",https://www.youtube.com/watch?v=KyvgThb373w
2619,Marketing,Retail Management,,Role of information technology in retailing | Role of technology in retailing | Retail Management,https://www.youtube.com/watch?v=hf0YqaK9czs
2620,Marketing,Retail Management,,"Types of sales channels, sales management, retailer, wholesalers, b2b, business to business, D2C,",https://www.youtube.com/watch?v=rB05yJSx5ss
2621,Marketing,Retail Management,,"Service retailing, service retailer, customer service retail, service and retail marketing",https://www.youtube.com/watch?v=680c_TBUWvA
2622,Marketing,Retail Management,,"Managing demand and capacity in service marketing, demand management and capacity management",https://www.youtube.com/watch?v=-K1duUoSNWI
2623,Marketing,Retail Management,,Career options after Class 12 | Commerce | Government sector | Professional courses etc,https://www.youtube.com/watch?v=Q0g0w1lVG7w
2624,Marketing,Retail Management,,TOP 10 MBA COLLEGES IN INDIA | BEST MBA COLLEGES IN INDIA | BEST B - SCHOOLS IN INDIA,https://www.youtube.com/watch?v=jmGhl8DfmcY
