Unnamed: 0,Sector,CourseName,Duration,TopicName,URL,Module,Minimum Education,Language
6741,Information Technology,Cyber Security Playlist [2024 Updated]🔥,,CompTIA Security+ Certification | CompTIA Security+ SYO-601 | Cyber Security Training | Simplilearn,https://www.youtube.com/watch?v=mF7659O8n6o,Module 9: Cybersecurity Trends and Future,12th,English/Hindi
6742,Information Technology,Cyber Security Playlist [2024 Updated]🔥,,CEH V11 Certification | How To Get CEH V11 Certification | CEH V11 Exam Details | Simplilearn,https://www.youtube.com/watch?v=m1qNXMrC1zw,Module 9: Cybersecurity Trends and Future,12th,English/Hindi
6743,Information Technology,Cyber Security Playlist [2024 Updated]🔥,,CISSP Tutorial | CISSP Tutorial For Beginners | CISSP Certification | CISSP Training | Simplilearn,https://www.youtube.com/watch?v=UlVfN4LrGs4,Module 9: Cybersecurity Trends and Future,12th,English/Hindi
6744,Information Technology,Cyber Security Playlist [2024 Updated]🔥,,CISSP Security And Risk Management | CISSP Domain 1: Security And Risk Management | Simplilearn,https://www.youtube.com/watch?v=8zKVCaocSp4,Module 9: Cybersecurity Trends and Future,12th,English/Hindi
6745,Information Technology,Cyber Security Playlist [2024 Updated]🔥,,CISSP Asset Security Domain | CISSP Domain 2: Asset Security | CISSP Training | Simplilearn,https://www.youtube.com/watch?v=ShnkzKjb1o0,Module 9: Cybersecurity Trends and Future,12th,English/Hindi
6746,Information Technology,Cyber Security Playlist [2024 Updated]🔥,,CISSP Exam Questions 2021 | CISSP Exam Preparation | CISSP Training Video 2021 | Simplilearn,https://www.youtube.com/watch?v=oaVn-YMS91A,Module 9: Cybersecurity Trends and Future,12th,English/Hindi
6747,Information Technology,Cyber Security Playlist [2024 Updated]🔥,,Cyber Security Interview Questions And Answers | Network Security Interview Preparation |Simplilearn,https://www.youtube.com/watch?v=q5pQ_YtJWpA,Module 9: Cybersecurity Trends and Future,12th,English/Hindi
6748,Information Technology,Cyber Security Playlist [2024 Updated]🔥,,Top 10 Networking Interview Questions And Answers | Networking Interview Preparation | Simplilearn,https://www.youtube.com/watch?v=N1dAIFGakxY,Module 9: Cybersecurity Trends and Future,12th,English/Hindi
6749,Information Technology,Cyber Security Playlist [2024 Updated]🔥,,Cyber Security Interview Questions Part - 2 | Software Programming Interview Questions | Simplilearn,https://www.youtube.com/watch?v=HtzxRM2aKMM,Module 9: Cybersecurity Trends and Future,12th,English/Hindi
6750,Information Technology,Cyber Security Playlist [2024 Updated]🔥,,Cyber Security Interview Questions Part - 3 | Operating System Interview Questions | Simplilearn,https://www.youtube.com/watch?v=0eKgeTH13RY,Module 9: Cybersecurity Trends and Future,12th,English/Hindi
6751,Information Technology,Cyber Security Playlist [2024 Updated]🔥,,Cyber Security Interview Questions Part - 4 | Cyber Attacks Interview Questions | Simplilearn,https://www.youtube.com/watch?v=7U1Zh4JCdJ4,Module 9: Cybersecurity Trends and Future,12th,English/Hindi
6752,Information Technology,Cyber Security Playlist [2024 Updated]🔥,,Cyber Security Interview Questions Part - 5 | Cryptography Interview Questions | Simplilearn,https://www.youtube.com/watch?v=T8e_lUPImvo,Module 9: Cybersecurity Trends and Future,12th,English/Hindi
6753,Information Technology,Cyber Security Playlist [2024 Updated]🔥,,Post Graduate Program In Cyber Security - Modules From MIT Schwarzman College Of Computing,https://www.youtube.com/watch?v=RWf4nbU9EgU,Module 9: Cybersecurity Trends and Future,12th,English/Hindi
6754,Information Technology,Cyber Security Playlist [2024 Updated]🔥,,FREE Cyber Security Course For Beginners | Learn Cyber Security | Cyber Security | Simplilearn,https://www.youtube.com/watch?v=9_IEcEl5BZI,Module 9: Cybersecurity Trends and Future,12th,English/Hindi
6755,Information Technology,Cyber Security Playlist [2024 Updated]🔥,,Cyber Security Expert Course | Cyber Security Expert Training | #Shorts | Simplilearn,https://www.youtube.com/watch?v=ItA49mtrvS4,Module 9: Cybersecurity Trends and Future,12th,English/Hindi
6756,Information Technology,Cyber Security Playlist [2024 Updated]🔥,,Advanced Executive Program in Cybersecurity | Cyber Security Course | #Shorts | Simplilearn,https://www.youtube.com/watch?v=O0-JWy4ps4c,Module 9: Cybersecurity Trends and Future,12th,English/Hindi
6757,Information Technology,Cyber Security Playlist [2024 Updated]🔥,,Advanced Executive Program in Cybersecurity | Cyber Security Course | #Shorts | Simplilearn,https://www.youtube.com/watch?v=nHPgdiqycHE,Module 9: Cybersecurity Trends and Future,12th,English/Hindi
6758,Information Technology,Cyber Security Playlist [2024 Updated]🔥,,Advanced Executive Program in Cybersecurity | Cyber Security Course | #Shorts | Simplilearn,https://www.youtube.com/watch?v=rwGNU-YiniM,Module 9: Cybersecurity Trends and Future,12th,English/Hindi
6759,Information Technology,Cyber Security Playlist [2024 Updated]🔥,,Better Solutions And Becoming An SME | Sael Celly's Cyber Security PGP Journey | Simplilearn Reviews,https://www.youtube.com/watch?v=wFmEifT9ppI,Module 9: Cybersecurity Trends and Future,12th,English/Hindi
6760,Information Technology,Cyber Security Playlist [2024 Updated]🔥,,Advanced Executive Program In Cybersecurity | Cyber Security Course | IIIT Bangalore | Simplilearn,https://www.youtube.com/watch?v=6DeZ-scCuT0,Module 9: Cybersecurity Trends and Future,12th,English/Hindi
6761,Information Technology,Cyber Security Playlist [2024 Updated]🔥,,Cryptography Course 🔥FREE | Cryptography Lecture | Cryptography Course Online Free | Simplilearn,https://www.youtube.com/watch?v=eREDAm-2w2o,Module 9: Cybersecurity Trends and Future,12th,English/Hindi
6762,Information Technology,Cyber Security Playlist [2024 Updated]🔥,,🔥 Free Cybercrime Online Course With Certificate | What is Cybercrime? | SkillUp | Simplilearn,https://www.youtube.com/watch?v=OSDWKFk1nms,Module 9: Cybersecurity Trends and Future,12th,English/Hindi
6763,Information Technology,Cyber Security Playlist [2024 Updated]🔥,,Post Graduate Program in Cyber Security By Simplilearn | Next Cohort Starting Soon!| Simplilearn,https://www.youtube.com/watch?v=lyXN9rphpis,Module 9: Cybersecurity Trends and Future,12th,English/Hindi
6764,Information Technology,Cyber Security Playlist [2024 Updated]🔥,,How to Become a Cyber Security Expert in 2023 | Cyber Security Career Roadmap | Simplilearn,https://www.youtube.com/watch?v=hpqVbAbVJxQ,Module 9: Cybersecurity Trends and Future,12th,English/Hindi
6765,Information Technology,Cyber Security Playlist [2024 Updated]🔥,,Cyber Security Full Course 2024 | Cyber Security Course Training For Beginners 2024 | Simplilearn,https://www.youtube.com/watch?v=hXSFdwIOfnE,Module 9: Cybersecurity Trends and Future,12th,English/Hindi
6766,Information Technology,Cyber Security Playlist [2024 Updated]🔥,,Cybersecurity Roadmap For Beginners 2023 | How to Become a Cybersecurity Expert ? | Simplilearn,https://www.youtube.com/watch?v=D4fYyu305jg,Module 9: Cybersecurity Trends and Future,12th,English/Hindi
6767,Information Technology,Cyber Security Playlist [2024 Updated]🔥,,🔥Ethical Hacking Full Course 2023 | Ethical Hacking Course For Beginners 2023 | Simplilearn,https://www.youtube.com/watch?v=Xv-O2HizYCY,Module 9: Cybersecurity Trends and Future,12th,English/Hindi
6768,Information Technology,Cyber Security Playlist [2024 Updated]🔥,,Cybersecurity Bootcamp 2023 | Cybersecurity Bootcamp for Beginners | Simplilearn,https://www.youtube.com/watch?v=C2NQ0jScRno,Module 9: Cybersecurity Trends and Future,12th,English/Hindi
6769,Information Technology,Cyber Security Playlist [2024 Updated]🔥,,🔥Top 5 Online Bootcamps 2023 | Best Online Bootcamps for Beginners | Simplilearn,https://www.youtube.com/watch?v=rdHRRQzV2Vs,Module 9: Cybersecurity Trends and Future,12th,English/Hindi
6770,Information Technology,Cyber Security Playlist [2024 Updated]🔥,,Cyber Security Salary for Freshers and Experienced 🤑🤑💰💰 | Highest Paying Jobs 2023 | Simplilearn,https://www.youtube.com/watch?v=0ACoPBK2qO8,Module 9: Cybersecurity Trends and Future,12th,English/Hindi
6771,Information Technology,Cyber Security Playlist [2024 Updated]🔥,,🔥 5 Best Cyber Security Courses for Beginners | Top 5 Cybersecurity Courses 2023 | Simplilearn,https://www.youtube.com/watch?v=cyVxH7VAOAc,Module 9: Cybersecurity Trends and Future,12th,English/Hindi
6772,Information Technology,Cyber Security Playlist [2024 Updated]🔥,,5 Best Ethical Hacking Certification for 2023 | Top 5 Ethical Hacking Certification | Simplilearn,https://www.youtube.com/watch?v=nhvioT8mdk4,Module 9: Cybersecurity Trends and Future,12th,English/Hindi
6773,Information Technology,Cyber Security Playlist [2024 Updated]🔥,,Ethical Hacker Salary 2023🤑 | How Much Do Ethical Hackers Make | Ethical Hacking Career|Simplilearn,https://www.youtube.com/watch?v=sQmXQskuON0,Module 9: Cybersecurity Trends and Future,12th,English/Hindi
6774,Information Technology,Cyber Security Playlist [2024 Updated]🔥,,🔥 Salary Hike Upto to 150 % | Become a Certified Ethical Hacker| Enroll the Course Now |Simplilearn,https://www.youtube.com/watch?v=0AmG4rtDkmU,Module 9: Cybersecurity Trends and Future,12th,English/Hindi
6775,Information Technology,Cyber Security Playlist [2024 Updated]🔥,,🔥 Ethical Hacking Bootcamp 2023 | Complete Ethical Hacking Bootcamp in 7 Hours | Simplilearn,https://www.youtube.com/watch?v=D5fRB-Zzm84,Module 9: Cybersecurity Trends and Future,12th,English/Hindi
6776,Information Technology,Cyber Security Playlist [2024 Updated]🔥,,Cyber Security Expert Skills 2023 | Top 6 Cybersecurity Skills You Must Have | Simplilearn,https://www.youtube.com/watch?v=fwbwhiNbhZM,Module 9: Cybersecurity Trends and Future,12th,English/Hindi
6777,Information Technology,Cyber Security Playlist [2024 Updated]🔥,,Computer Networking Full Course 2023 | Networking Full Course For Beginners | Simplilearn,https://www.youtube.com/watch?v=fErDcUtd8fA,Module 9: Cybersecurity Trends and Future,12th,English/Hindi
6778,Information Technology,Cyber Security Playlist [2024 Updated]🔥,,5 Reasons to Learn Cyber Security | Why Learn Cybersecurity in 2023 | Simplilearn,https://www.youtube.com/watch?v=9QIg5AIYaAg,Module 9: Cybersecurity Trends and Future,12th,English/Hindi
6779,Information Technology,Cyber Security Playlist [2024 Updated]🔥,,Cybersecurity or Cloud Computing: Which Is the Better Career 🤔🤔 | Simplilearn,https://www.youtube.com/watch?v=rV_Z8TFwzow,Module 9: Cybersecurity Trends and Future,12th,English/Hindi
6780,Information Technology,Cyber Security Playlist [2024 Updated]🔥,,Why to Learn Networking in 2023? | 5 Reasons to Learn Networking | Computer Networks | Simplilearn,https://www.youtube.com/watch?v=Jihg61nafgE,Module 9: Cybersecurity Trends and Future,12th,English/Hindi
6781,Information Technology,Cyber Security Playlist [2024 Updated]🔥,,Why to Learn Ethical Hacking? | 8 Reasons to Learn Ethical Hacking in 2023 | Simplilearn,https://www.youtube.com/watch?v=wTk01S7Xt70,Module 9: Cybersecurity Trends and Future,12th,English/Hindi
6782,Information Technology,Cyber Security Playlist [2024 Updated]🔥,,Career in Cybersecurity | Cyber Security Jobs |Cyber Security Career in 2023 | Simplilearn,https://www.youtube.com/watch?v=OFeTyvEe02Y,Module 9: Cybersecurity Trends and Future,12th,English/Hindi
6783,Information Technology,Cyber Security Playlist [2024 Updated]🔥,,5 Best Computer Courses After Graduation | Trending Courses in 2023 | Simplilearn,https://www.youtube.com/watch?v=LGmQ4RA7nC4,Module 9: Cybersecurity Trends and Future,12th,English/Hindi
6784,Information Technology,Cyber Security Playlist [2024 Updated]🔥,,ChatGPT in Cybersecurity | Cyber Security Using ChatGPT | Chat GPT for Beginners | Simplilearn,https://www.youtube.com/watch?v=m3kiZzBggz8,Module 9: Cybersecurity Trends and Future,12th,English/Hindi
6785,Information Technology,Cyber Security Playlist [2024 Updated]🔥,,🔥 Best Cybersecurity Bootcamp 2023 | Cybersecurity Bootcamp for Beginners | Simplilearn,https://www.youtube.com/watch?v=v7gPSzCkBEg,Module 9: Cybersecurity Trends and Future,12th,English/Hindi
6786,Information Technology,Cyber Security Playlist [2024 Updated]🔥,,🔥 Top 5 Cybersecurity Careers in 2023 | Introduction to Cybersecurity Careers 2023 | Simplilearn,https://www.youtube.com/watch?v=ZpcOc--Oh3U,Module 9: Cybersecurity Trends and Future,12th,English/Hindi
6787,Information Technology,Cyber Security Playlist [2024 Updated]🔥,,🔥 Top 5 Cybersecurity Skills 2023 | Cybersecurity Skills for Beginners 2023 | Simplilearn,https://www.youtube.com/watch?v=T6_3GLWSWyc,Module 9: Cybersecurity Trends and Future,12th,English/Hindi
6788,Information Technology,Cyber Security Playlist [2024 Updated]🔥,,What Is VPN and How Does It Work ?| VPN Explained | How Does VPN Work | Simplilearn,https://www.youtube.com/watch?v=_ZIvO9VU-24,Module 9: Cybersecurity Trends and Future,12th,English/Hindi
6789,Information Technology,Cyber Security Playlist [2024 Updated]🔥,,What Is CDN ? | CDN Explained | Content Delivery Network | Simplilearn,https://www.youtube.com/watch?v=OvzvhWj7bj0,Module 9: Cybersecurity Trends and Future,12th,English/Hindi
6790,Information Technology,Cyber Security Playlist [2024 Updated]🔥,,SQL Injection Explained | SQL Injection Attack in Cyber Security | Cybersecurity | Simplilearn,https://www.youtube.com/watch?v=8XVHftQskxk,Module 9: Cybersecurity Trends and Future,12th,English/Hindi
6791,Information Technology,Cyber Security Playlist [2024 Updated]🔥,,Do Entry Level Cyber Security Jobs Exist? | Cyber Security Job Career 2023 | Simplilearn,https://www.youtube.com/watch?v=KOwSBmIBu-Y,Module 9: Cybersecurity Trends and Future,12th,English/Hindi
6792,Information Technology,Cyber Security Playlist [2024 Updated]🔥,,Multi Factor Authentication Vs 2 Factor Authentication | What Is MFA And 2FA? | Simplilearn,https://www.youtube.com/watch?v=fAYE8i-l1Dk,Module 9: Cybersecurity Trends and Future,12th,English/Hindi
6793,Information Technology,Cyber Security Playlist [2024 Updated]🔥,,Advanced Cyber Security Course | Cybersecurity Training for 2023 | Cyber Security | Simplilearn,https://www.youtube.com/watch?v=Dsl-ILWzUHM,Module 9: Cybersecurity Trends and Future,12th,English/Hindi
6794,Information Technology,Cyber Security Playlist [2024 Updated]🔥,,Skills to Learn for Cyber Security in 2023 | Cyber Security Skills | Simplilearn,https://www.youtube.com/watch?v=a1ycPlgH7uo,Module 9: Cybersecurity Trends and Future,12th,English/Hindi
6795,Information Technology,Cyber Security Playlist [2024 Updated]🔥,,Is Cybersecurity Certifications Worth It | Is a Cyber Security Degree Worth It In 2023 | Simplilearn,https://www.youtube.com/watch?v=UxA_Dk_-lvw,Module 9: Cybersecurity Trends and Future,12th,English/Hindi
6796,Information Technology,Cyber Security Playlist [2024 Updated]🔥,,What Is Malware And Types Of Malware | Introduction To Malware | Cyber Security Training|Simplilearn,https://www.youtube.com/watch?v=xXkevJcOBTw,Module 9: Cybersecurity Trends and Future,12th,English/Hindi
6797,Information Technology,Cyber Security Playlist [2024 Updated]🔥,,Cyber Security Interview Questions and Answers | Cyber Security Interview Tips | Simplilearn,https://www.youtube.com/watch?v=sog7vjshaLQ,Module 9: Cybersecurity Trends and Future,12th,English/Hindi
6798,Information Technology,Cyber Security Playlist [2024 Updated]🔥,,🔥 Roadmap to Cyber Security 2023 - Complete Guide ft. @BittenTech  | Simplilearn,https://www.youtube.com/watch?v=LKzntCOqeNQ,Module 9: Cybersecurity Trends and Future,12th,English/Hindi
6799,Information Technology,Cyber Security Playlist [2024 Updated]🔥,,What Is Network File Share ? | Network File Share Exploit | What Is Network File System |Simplilearn,https://www.youtube.com/watch?v=yagAG4urhiQ,Module 9: Cybersecurity Trends and Future,12th,English/Hindi
6800,Information Technology,Cyber Security Playlist [2024 Updated]🔥,,Advanced Ethical Hacking Course For 2023 | Ethical Hacking Advanced Course 2023 | Simplilearn,https://www.youtube.com/watch?v=eKzML6_h_6k,Module 9: Cybersecurity Trends and Future,12th,English/Hindi
6801,Information Technology,Cyber Security Playlist [2024 Updated]🔥,,What Is BGP ? | Border Gateway Protocol Explained | BGP Protocol | Simplilearn,https://www.youtube.com/watch?v=NnP4SRe6MDc,Module 9: Cybersecurity Trends and Future,12th,English/Hindi
6802,Information Technology,Cyber Security Playlist [2024 Updated]🔥,,Hackers Roadmap 2023 | How to Become a Hacker in 2023 | Hacking Roadmap for Beginners | Simplilearn,https://www.youtube.com/watch?v=pPAOXLTIOVg,Module 9: Cybersecurity Trends and Future,12th,English/Hindi
6803,Information Technology,Cyber Security Playlist [2024 Updated]🔥,,🔥 Cyber Security Salary in USA | Salary Of Cyber Security Expert In USA | Simplilearn,https://www.youtube.com/watch?v=UF4gFo2t3cQ,Module 9: Cybersecurity Trends and Future,12th,English/Hindi
6804,Information Technology,Cyber Security Playlist [2024 Updated]🔥,,What is Termux? | Termux Tutorial | Learn Termux for Beginners | Simplilearn,https://www.youtube.com/watch?v=ulLjGFwFqbs,Module 9: Cybersecurity Trends and Future,12th,English/Hindi
6805,Information Technology,Cyber Security Playlist [2024 Updated]🔥,,5 Most Common Types of Cyber Attacks | Types of Cyber Security Threats | Cyber Threats | Simplilearn,https://www.youtube.com/watch?v=_jzSvSk-lX0,Module 9: Cybersecurity Trends and Future,12th,English/Hindi
6806,Information Technology,Cyber Security Playlist [2024 Updated]🔥,,🔥 Complete Cyber Security Course For 2023 | Cyber Security Full Course for Beginners | Simplilearn,https://www.youtube.com/watch?v=EKdZutMkmTE,Module 9: Cybersecurity Trends and Future,12th,English/Hindi
6807,Information Technology,Cyber Security Playlist [2024 Updated]🔥,,How Does a Ransomware Attack Work ? | What Is Ransomware ? | Ransomware Explained | Simplilearn,https://www.youtube.com/watch?v=yIGDXzAd9MA,Module 9: Cybersecurity Trends and Future,12th,English/Hindi
6808,Information Technology,Cyber Security Playlist [2024 Updated]🔥,,Kali Linux Tutorial 2023 | Kali Linux Explained | Kali Linux for Beginners | Simplilearn,https://www.youtube.com/watch?v=B6zGwbW5_Ns,Module 9: Cybersecurity Trends and Future,12th,English/Hindi
6809,Information Technology,Cyber Security Playlist [2024 Updated]🔥,,🔥 How to Become Cyber Security Expert in 2023  ft. @BittenTech  | Simplilearn,https://www.youtube.com/watch?v=-uPPICyLhrg,Module 9: Cybersecurity Trends and Future,12th,English/Hindi
6810,Information Technology,Cyber Security Playlist [2024 Updated]🔥,,🔥 What Is Trojan? | Trojan Horse Virus In Cybersecurity | Trojan in Cyber Security | Simplilearn,https://www.youtube.com/watch?v=061QRJa26kU,Module 9: Cybersecurity Trends and Future,12th,English/Hindi
6811,Information Technology,Cyber Security Playlist [2024 Updated]🔥,,"🔥 Top 5 Cybersecurity Careers In 2023 - Jobs, Salary And Certifications | Simplilearn",https://www.youtube.com/watch?v=T4f9fe_tVmA,Module 9: Cybersecurity Trends and Future,12th,English/Hindi
6812,Information Technology,Cyber Security Playlist [2024 Updated]🔥,,🔥 Top 5 Cyber Security Certification 2023 ft. @BittenTech  | Simplilearn,https://www.youtube.com/watch?v=U1ps7gWNVss,Module 9: Cybersecurity Trends and Future,12th,English/Hindi
6813,Information Technology,Cyber Security Playlist [2024 Updated]🔥,,Types of Cyber Attacks | 10 Real World Cyber Attacks | Cyber Security Tutorial | Simplilearn,https://www.youtube.com/watch?v=9VNHhxRTbSI,Module 9: Cybersecurity Trends and Future,12th,English/Hindi
6814,Information Technology,Cyber Security Playlist [2024 Updated]🔥,,🔥 Cyber Security Expert Course For 2023 | Learn Cybersecurity In 7 Hours | Simplilearn,https://www.youtube.com/watch?v=6KZyR1xJvY0,Module 9: Cybersecurity Trends and Future,12th,English/Hindi
6815,Information Technology,Cyber Security Playlist [2024 Updated]🔥,,5 Best Universities For Cybersecurity In USA | Best Cybersecurity Universities in USA | Simplilearn,https://www.youtube.com/watch?v=ZHdRAPrW8WY,Module 9: Cybersecurity Trends and Future,12th,English/Hindi
6816,Information Technology,Cyber Security Playlist [2024 Updated]🔥,,🔥 Cyber Security Specialist Course 2023 | Cyber Security Full Course for Beginners | Simplilearn,https://www.youtube.com/watch?v=9OGDygEVqVI,Module 9: Cybersecurity Trends and Future,12th,English/Hindi
6817,Information Technology,Cyber Security Playlist [2024 Updated]🔥,,🔥 Ethical Hacker Course 2023 | Ethical Hacking Complete Course In 11 Hours | Simplilearn,https://www.youtube.com/watch?v=xQRmc7pNjRE,Module 9: Cybersecurity Trends and Future,12th,English/Hindi
6818,Information Technology,Cyber Security Playlist [2024 Updated]🔥,,🔥 Cyber Security Engineer Course 2023 | Cyber Security Engineer Training | Simplilearn,https://www.youtube.com/watch?v=No3CYOwCgmA,Module 9: Cybersecurity Trends and Future,12th,English/Hindi
6819,Information Technology,Cyber Security Playlist [2024 Updated]🔥,,🔥 Cybersecurity Course For 2023 | Learn Cybersecurity In 11 Hours | Cybersecurity | Simplilearn,https://www.youtube.com/watch?v=g-h0r85Dp2Y,Module 9: Cybersecurity Trends and Future,12th,English/Hindi
6820,Information Technology,Cyber Security Playlist [2024 Updated]🔥,,🔥 Penetration Tester Salary In 2023 | Cyber Security Penetration Testing Salary | Simplilearn,https://www.youtube.com/watch?v=S38eYwF9XKg,Module 9: Cybersecurity Trends and Future,12th,English/Hindi
6821,Information Technology,Cyber Security Playlist [2024 Updated]🔥,,🔥 How to Remove Trojan Virus? | Removing Trojan Virus From System | Simplilearn,https://www.youtube.com/watch?v=ET3KMw1v1Sw,Module 9: Cybersecurity Trends and Future,12th,English/Hindi
6822,Information Technology,Cyber Security Playlist [2024 Updated]🔥,,🔥 Top 5 Ethical Hacking Courses In India | 5 Best Ethical Hacking Courses in India | Simplilearn,https://www.youtube.com/watch?v=Twi29Wme5_8,Module 9: Cybersecurity Trends and Future,12th,English/Hindi
6823,Information Technology,Cyber Security Playlist [2024 Updated]🔥,,What Is DNS? | Introduction to Domain Name System| How Domain Name Server Works? | Simplilearn,https://www.youtube.com/watch?v=9dX7S-xgS60,Module 9: Cybersecurity Trends and Future,12th,English/Hindi
6824,Information Technology,Cyber Security Playlist [2024 Updated]🔥,,🔥 Network Security Engineer Full Course 2023 | Learn Networking In 4 Hours | Simplilearn,https://www.youtube.com/watch?v=zIWGjkr0ENE,Module 9: Cybersecurity Trends and Future,12th,English/Hindi
6825,Information Technology,Cyber Security Playlist [2024 Updated]🔥,,Types Of Cybercrime In Cyber Security | Cybercrimes & Its Types | Cybersecurity Tutorial|Simplilearn,https://www.youtube.com/watch?v=38RZdFK7Prg,Module 9: Cybersecurity Trends and Future,12th,English/Hindi
6826,Information Technology,Cyber Security Playlist [2024 Updated]🔥,,🔥 Cybersecurity Crash Course 2023 | Learn Cybersecurity Fundamentals In 5 Hours | Simplilearn,https://www.youtube.com/watch?v=rbGm2V2MKz8,Module 9: Cybersecurity Trends and Future,12th,English/Hindi
6827,Information Technology,Cyber Security Playlist [2024 Updated]🔥,,🔥 Cyber Security Engineer Vs Ethical Hacker: What's The Difference | Cybersecurity | Simplilearn,https://www.youtube.com/watch?v=J9Kh0iH5CUA,Module 9: Cybersecurity Trends and Future,12th,English/Hindi
6828,Information Technology,Cyber Security Playlist [2024 Updated]🔥,,How Hacking Works ? | How Hacking Actually Looks Like ? | Step by Step Hacking | Simplilearn,https://www.youtube.com/watch?v=l7S75MNRZCY,Module 9: Cybersecurity Trends and Future,12th,English/Hindi
6829,Information Technology,Cyber Security Playlist [2024 Updated]🔥,,🔥 Ethical Hacking Crash Course 2023 | Ethical Hacking Course for Beginners | Simplilearn,https://www.youtube.com/watch?v=BZULiASQzgQ,Module 9: Cybersecurity Trends and Future,12th,English/Hindi
6830,Information Technology,Cyber Security Playlist [2024 Updated]🔥,,🔥 Top 10 Highest Paying Cybersecurity Jobs For 2024 | Cybersecurity Career 2024 | Simplilearn,https://www.youtube.com/watch?v=eaTC5aReb3w,Module 9: Cybersecurity Trends and Future,12th,English/Hindi
6831,Information Technology,Cyber Security Playlist [2024 Updated]🔥,,🔥 How To Make Money In Cybersecurity? 🤑🤑 | Cybersecurity Career 2024 | Simplilearn,https://www.youtube.com/watch?v=xt5uduRqMio,Module 9: Cybersecurity Trends and Future,12th,English/Hindi
6832,Information Technology,Cyber Security Playlist [2024 Updated]🔥,,🔥 Cybersecurity Roadmap 2024 | Cyber Security Career Roadmap For 2024 | Simplilearn,https://www.youtube.com/watch?v=mHOSiDIzL9k,Module 9: Cybersecurity Trends and Future,12th,English/Hindi
6833,Information Technology,Cyber Security Playlist [2024 Updated]🔥,,🔥 Networking Crash Course 2023 | Computer Networks Crash Course 2023 | Simplilearn,https://www.youtube.com/watch?v=bArObJmuomc,Module 9: Cybersecurity Trends and Future,12th,English/Hindi
6834,Information Technology,Cyber Security Playlist [2024 Updated]🔥,,💰 Cyber Security Salaries 2024 🤑 ft. @BittenTech  | Simplilearn,https://www.youtube.com/watch?v=MpF1NmhBxJ0,Module 9: Cybersecurity Trends and Future,12th,English/Hindi
6835,Information Technology,Cyber Security Playlist [2024 Updated]🔥,,🔥 Cybersecurity Fundamentals Course 2023 | Cybersecurity Crash Course 2023 | Simplilearn,https://www.youtube.com/watch?v=Asurd09LmCU,Module 9: Cybersecurity Trends and Future,12th,English/Hindi
