Unnamed: 0,Sector,CourseName,Duration,TopicName,URL,Module,Minimum Education,Language
6646,Information Technology,Cyber Security Playlist [2024 Updated]🔥,17hrs 19min,What Is Cyber Security | How It Works? | Cyber Security In 7 Minutes | Cyber Security | Simplilearn,https://www.youtube.com/watch?v=inWWhr5tnEA,Module 1: Introduction to Cybersecurity,12th,English/Hindi
6647,Information Technology,Cyber Security Playlist [2024 Updated]🔥,,What Is Firewall ? | Firewall Explained | Firewalls and Network Security | Simplilearn,https://www.youtube.com/watch?v=9GZlVOafYTg,Module 1: Introduction to Cybersecurity,12th,English/Hindi
6648,Information Technology,Cyber Security Playlist [2024 Updated]🔥,,Phishing Explained In 6 Minutes | What Is A Phishing Attack? | Phishing Attack | Simplilearn,https://www.youtube.com/watch?v=XBkzBrXlle0,Module 1: Introduction to Cybersecurity,12th,English/Hindi
6649,Information Technology,Cyber Security Playlist [2024 Updated]🔥,,Ransomware In Cybersecurity | What Is Ransomware? | Ransomware Attack | Simplilearn,https://www.youtube.com/watch?v=-KL9APUjj3E,Module 1: Introduction to Cybersecurity,12th,English/Hindi
6650,Information Technology,Cyber Security Playlist [2024 Updated]🔥,,What Is VPN & How Does It Work? | VPN Explained In 5 Minutes | Virtual Private Network | Simplilearn,https://www.youtube.com/watch?v=_-DekqEyAV0,Module 2: Network Security,12th,English/Hindi
6651,Information Technology,Cyber Security Playlist [2024 Updated]🔥,,Proxy In 5 Minutes | What Is A Proxy? | What Is A Proxy Server? | Proxy Explained | Simplilearn,https://www.youtube.com/watch?v=j9-Y0KWVJ1k,Module 2: Network Security,12th,English/Hindi
6652,Information Technology,Cyber Security Playlist [2024 Updated]🔥,,5G Explained In 7 Minutes | What is 5G? | How 5G Works? | 5G: The Next-Gen Network | Simplilearn,https://www.youtube.com/watch?v=mo1lNRKnayA,Module 2: Network Security,12th,English/Hindi
6653,Information Technology,Cyber Security Playlist [2024 Updated]🔥,,Cyber War Explained In 6 Minutes | What Is Cyber War? | Cyber Security For Beginners | Simplilearn,https://www.youtube.com/watch?v=XbMUJpmSkxY,Module 2: Network Security,12th,English/Hindi
6654,Information Technology,Cyber Security Playlist [2024 Updated]🔥,,What Is Cybersecurity: How It Works? |Cyber Security In 2 Minutes | Cyber Security | Simplilearn,https://www.youtube.com/watch?v=Q2W_nNdReXM,Module 3: Cyber Threats and Attacks,12th,English/Hindi
6655,Information Technology,Cyber Security Playlist [2024 Updated]🔥,,Cybersecurity in 1 Minute | What Is Cybersecurity? | Introduction to Cybersecurity | Simplilearn,https://www.youtube.com/watch?v=Y6nauquu3CY,Module 3: Cyber Threats and Attacks,12th,English/Hindi
6656,Information Technology,Cyber Security Playlist [2024 Updated]🔥,,Cyber Security Crash Course | Cyber Security Training For Beginners | Cyber Security | Simplilearn,https://www.youtube.com/watch?v=U-fpEHLIzQE,Module 3: Cyber Threats and Attacks,12th,English/Hindi
6657,Information Technology,Cyber Security Playlist [2024 Updated]🔥,,Cyber Security Full Course - Learn Cyber Security In 8 Hours | Cyber Security Training |Simplilearn,https://www.youtube.com/watch?v=PlHnamdwGmw,Module 3: Cyber Threats and Attacks,12th,English/Hindi
6658,Information Technology,Cyber Security Playlist [2024 Updated]🔥,,Kali Linux Tutorial 2022 | Kali Linux For Beginners | Learn Kali Linux | Ethical Hacking|Simplilearn,https://www.youtube.com/watch?v=M3JhyWh1HgQ,Module 4: Ethical Hacking and Penetration Testing,12th,English/Hindi
6659,Information Technology,Cyber Security Playlist [2024 Updated]🔥,,🔥Cybersecurity basics | Cybersecurity Basic Knowledge | Cybersecurity | 2024 | Simplilearn,https://www.youtube.com/watch?v=njPY7pQTRWg,Module 4: Ethical Hacking and Penetration Testing,12th,English/Hindi
6660,Information Technology,Cyber Security Playlist [2024 Updated]🔥,,Cyber Security Course | Learn Cyber Security In One Video | Cyber Security Training | Simplilearn,https://www.youtube.com/watch?v=GE-T1o-6zUM,Module 4: Ethical Hacking and Penetration Testing,12th,English/Hindi
6661,Information Technology,Cyber Security Playlist [2024 Updated]🔥,,CISSP Full Training Masterclass In 3 Hours | CISSP Training Video 2022 | CISSP Tutorial |Simplilearn,https://www.youtube.com/watch?v=i6vKjSa20iw,Module 4: Ethical Hacking and Penetration Testing,12th,English/Hindi
6662,Information Technology,Cyber Security Playlist [2024 Updated]🔥,,Expert Tips For A Successful Cyber Security Career Today | Cyber Security Training 2020| Simplilearn,https://www.youtube.com/watch?v=VGsfzHRga6s,Module 5: Cryptography,12th,English/Hindi
6663,Information Technology,Cyber Security Playlist [2024 Updated]🔥,,Free CISSP Training Video | CISSP Tutorial Online Part 1,https://www.youtube.com/watch?v=JWqd_qaR81g,Module 5: Cryptography,12th,English/Hindi
6664,Information Technology,Cyber Security Playlist [2024 Updated]🔥,,Communications and Network Security | CISSP Training Videos,https://www.youtube.com/watch?v=n6S5wR-NDyc,Module 5: Cryptography,12th,English/Hindi
6665,Information Technology,Cyber Security Playlist [2024 Updated]🔥,,CISA Training Video | Process of Auditing Information Systems - Part 1,https://www.youtube.com/watch?v=i7XGhj3UPxE,Module 5: Cryptography,12th,English/Hindi
6666,Information Technology,Cyber Security Playlist [2024 Updated]🔥,,CISA Domain 2 | Governance And Management Of IT | Simplilearn,https://www.youtube.com/watch?v=tt80zOSj9Ko,Module 6: Cybersecurity Certifications and Career Paths,12th,English/Hindi
6667,Information Technology,Cyber Security Playlist [2024 Updated]🔥,,CISA Domain 4 | Information Systems Operations | Simplilearn,https://www.youtube.com/watch?v=1HA0anHwXMI,Module 6: Cybersecurity Certifications and Career Paths,12th,English/Hindi
6668,Information Technology,Cyber Security Playlist [2024 Updated]🔥,,"Expert Talk On Cyber Security With Faiz A Shaikh, CIO | Why Cybersecurity Is Important?| Simplilearn",https://www.youtube.com/watch?v=WgnvwKlVy4g,Module 6: Cybersecurity Certifications and Career Paths,12th,English/Hindi
6669,Information Technology,Cyber Security Playlist [2024 Updated]🔥,,The Need Of Cyber Security In Present Era | Simplilearn Webinar,https://www.youtube.com/watch?v=D2j4tTNKL-Q,Module 6: Cybersecurity Certifications and Career Paths,12th,English/Hindi
6670,Information Technology,Cyber Security Playlist [2024 Updated]🔥,,Cyber Security Tutorial | Cyber Security Training For Beginners | CyberSecurity Course | Simplilearn,https://www.youtube.com/watch?v=OLRDsgg9mPw,Module 7: Operating Systems and Tools,12th,English/Hindi
6671,Information Technology,Cyber Security Playlist [2024 Updated]🔥,,Cyber Security Training For Beginners | Cyber Security Tutorial | #LearningMarathon2021 |Simplilearn,https://www.youtube.com/watch?v=54YCY8_vB2U,Module 7: Operating Systems and Tools,12th,English/Hindi
6672,Information Technology,Cyber Security Playlist [2024 Updated]🔥,,Cyber Security Training For Beginners | Cyber Security Tutorial | Cyber Security Course |Simplilearn,https://www.youtube.com/watch?v=wMRzjwYMou0,Module 7: Operating Systems and Tools,12th,English/Hindi
6673,Information Technology,Cyber Security Playlist [2024 Updated]🔥,,Introduction To Cyber Security | Cyber Security Training For Beginners | CyberSecurity | Simplilearn,https://www.youtube.com/watch?v=z5nc9MDbvkw,Module 7: Operating Systems and Tools,12th,English/Hindi
6674,Information Technology,Cyber Security Playlist [2024 Updated]🔥,,Top 10 Reasons to Learn Cyber Security in 2022 | Why Should You Learn Cyber Security? | Simplilearn,https://www.youtube.com/watch?v=PzKCR_Jsi-A,Module 8: Advanced Cybersecurity Concepts,12th,English/Hindi
6675,Information Technology,Cyber Security Playlist [2024 Updated]🔥,,Computer Security | What Is Computer Security | Cyber Security Tutorial | Simplilearn,https://www.youtube.com/watch?v=cs3B0zcRJco,Module 8: Advanced Cybersecurity Concepts,12th,English/Hindi
6676,Information Technology,Cyber Security Playlist [2024 Updated]🔥,,Top 5 Cybersecurity Skills | Cyber Security Career | Cyber Security Training | Simplilearn,https://www.youtube.com/watch?v=U3LMnJSNsLY,Module 8: Advanced Cybersecurity Concepts,12th,English/Hindi
6677,Information Technology,Cyber Security Playlist [2024 Updated]🔥,,Top 5 Ethical Hacking Tools | Ethical Hacking Tools And Uses | Ethical Hacking | Simplilearn,https://www.youtube.com/watch?v=Fn4O1rumWrY,Module 8: Advanced Cybersecurity Concepts,12th,English/Hindi
6678,Information Technology,Cyber Security Playlist [2024 Updated]🔥,,What Is Tor Browser And How It Works? | Why Should You Use It? | Tor Browser Explained | Simplilearn,https://www.youtube.com/watch?v=YWBrtTu3l64,Module 9: Cybersecurity Trends and Future,12th,English/Hindi
6679,Information Technology,Cyber Security Playlist [2024 Updated]🔥,,SSL Handshake Explained | What Is SSL/TLS Handshake? | SSL/TLS Handshake Protocol | Simplilearn,https://www.youtube.com/watch?v=tKqSSOEjbgs,Module 9: Cybersecurity Trends and Future,12th,English/Hindi
6680,Information Technology,Cyber Security Playlist [2024 Updated]🔥,,Email Header Analysis Tutorial | Email Header Analysis Steps | Cyber Security Tutorial | Simplilearn,https://www.youtube.com/watch?v=3wwaYc_Yuhc,Module 9: Cybersecurity Trends and Future,12th,English/Hindi
6681,Information Technology,Cyber Security Playlist [2024 Updated]🔥,,"What Is Network Topology? | Types of Network Topology | BUS, RING, STAR, TREE, MESH | Simplilearn",https://www.youtube.com/watch?v=QGykYWbdf0A,Module 9: Cybersecurity Trends and Future,12th,English/Hindi
6682,Information Technology,Cyber Security Playlist [2024 Updated]🔥,,What Is An IP Address And How Does It Work? | IP Address Explained Simply | Simplilearn,https://www.youtube.com/watch?v=ak9fzojnMaM,Module 9: Cybersecurity Trends and Future,12th,English/Hindi
6683,Information Technology,Cyber Security Playlist [2024 Updated]🔥,,IPv4 vs IPv6 | Difference Between IPv4 and IPv6 | IP Address Explained | IP Address | Simplilearn,https://www.youtube.com/watch?v=JiaL5A3qezg,Module 9: Cybersecurity Trends and Future,12th,English/Hindi
6684,Information Technology,Cyber Security Playlist [2024 Updated]🔥,,TCP/IP Protocol Explained | What Is TCP/IP Address? | TCP/IP Configuration Tutorial | Simplilearn,https://www.youtube.com/watch?v=CsektxtqA8c,Module 9: Cybersecurity Trends and Future,12th,English/Hindi
6685,Information Technology,Cyber Security Playlist [2024 Updated]🔥,,Network Address Translation Explained | What Is Network Address Translation? | NAT | Simplilearn,https://www.youtube.com/watch?v=YbqYTAiSIWI,Module 9: Cybersecurity Trends and Future,12th,English/Hindi
6686,Information Technology,Cyber Security Playlist [2024 Updated]🔥,,DHCP Explained | Dynamic Host Configuration Protocol | DHCP Server Configuration | Simplilearn,https://www.youtube.com/watch?v=bj8dq6hhUMk,Module 9: Cybersecurity Trends and Future,12th,English/Hindi
6687,Information Technology,Cyber Security Playlist [2024 Updated]🔥,,Subneting Explained | What Is Subneting? | How It Works? | Networking Tutorial | Simplilearn,https://www.youtube.com/watch?v=mgu4blmFF_w,Module 9: Cybersecurity Trends and Future,12th,English/Hindi
6688,Information Technology,Cyber Security Playlist [2024 Updated]🔥,,"Switching Techniques In Networking | Circuit, Message, Packet Switching Explained | Simplilearn",https://www.youtube.com/watch?v=bPNVT_xzxbs,Module 9: Cybersecurity Trends and Future,12th,English/Hindi
6689,Information Technology,Cyber Security Playlist [2024 Updated]🔥,,Ethernet | Ethernet In Computer Networks | What is Ethernet ? | Simplilearn,https://www.youtube.com/watch?v=idlYfhvE9lI,Module 9: Cybersecurity Trends and Future,12th,English/Hindi
6690,Information Technology,Cyber Security Playlist [2024 Updated]🔥,,Go Back N ARQ Protocol Explained| What Is Go Back N ARQ Protocol | Networking Tutorial | Simplilearn,https://www.youtube.com/watch?v=SGGJdR4qD7M,Module 9: Cybersecurity Trends and Future,12th,English/Hindi
6691,Information Technology,Cyber Security Playlist [2024 Updated]🔥,,Stop And Wait Protocol Explained | How Stop & Wait Protocol Works? | Computer Networks | Simplilearn,https://www.youtube.com/watch?v=QgdFm7Ynh_8,Module 9: Cybersecurity Trends and Future,12th,English/Hindi
6692,Information Technology,Cyber Security Playlist [2024 Updated]🔥,,Sliding Window Protocol | Working Of Sliding Window Protocol | Networking Tutorial | Simplilearn,https://www.youtube.com/watch?v=L6nroRENiAk,Module 9: Cybersecurity Trends and Future,12th,English/Hindi
6693,Information Technology,Cyber Security Playlist [2024 Updated]🔥,,Selective Repeat ARQ Explained | Selective Repeat Protocol | Networking Tutorial | Simplilearn,https://www.youtube.com/watch?v=dUX8A6VTqdk,Module 9: Cybersecurity Trends and Future,12th,English/Hindi
6694,Information Technology,Cyber Security Playlist [2024 Updated]🔥,,Google Dorking Tutorial | What Is Google Dorks And How To Use It? | Ethical Hacking | Simplilearn,https://www.youtube.com/watch?v=Jsg9JOyoeg0,Module 9: Cybersecurity Trends and Future,12th,English/Hindi
6695,Information Technology,Cyber Security Playlist [2024 Updated]🔥,,Most Common CyberSecurity Threats | CyberSecurity Attacks | CyberSecurity For Beginners |Simplilearn,https://www.youtube.com/watch?v=y6E_CxkLLw8,Module 9: Cybersecurity Trends and Future,12th,English/Hindi
6696,Information Technology,Cyber Security Playlist [2024 Updated]🔥,,Most Dangerous Computer Viruses | Top 6 Computer Viruses In The World | Cyber Security | Simplilearn,https://www.youtube.com/watch?v=6DzX0Try-vo,Module 9: Cybersecurity Trends and Future,12th,English/Hindi
6697,Information Technology,Cyber Security Playlist [2024 Updated]🔥,,What Is Malware? | Malware Explained | What Is Malware And It's Types? | Malware Attack |Simplilearn,https://www.youtube.com/watch?v=Bvqyg51Czdk,Module 9: Cybersecurity Trends and Future,12th,English/Hindi
6698,Information Technology,Cyber Security Playlist [2024 Updated]🔥,,SQL Injection Tutorial For Beginners | What Is SQL Injection? | Cyber Security Course | Simplilearn,https://www.youtube.com/watch?v=QzP-B69LC5o,Module 9: Cybersecurity Trends and Future,12th,English/Hindi
6699,Information Technology,Cyber Security Playlist [2024 Updated]🔥,,DDOS Attack Explained | What Is DDOS Attack? | Cyber Security Training For Beginners | Simplilearn,https://www.youtube.com/watch?v=duIzgCr5myk,Module 9: Cybersecurity Trends and Future,12th,English/Hindi
6700,Information Technology,Cyber Security Playlist [2024 Updated]🔥,,DDoS Attack | DDoS Attack Explained | What Is A DDoS Attack? | Cyber Attacks Explained | Simplilearn,https://www.youtube.com/watch?v=JZY6_Ws6sKE,Module 9: Cybersecurity Trends and Future,12th,English/Hindi
6701,Information Technology,Cyber Security Playlist [2024 Updated]🔥,,Cross Site Scripting Explained| What Is Cross Site Scripting Attack? | Web Attacks | Simplilearn,https://www.youtube.com/watch?v=43yYsui3xZc,Module 9: Cybersecurity Trends and Future,12th,English/Hindi
6702,Information Technology,Cyber Security Playlist [2024 Updated]🔥,,What is Brute Force Attack? | Learn to Crack Passwords using Brute Force Attack | Simplilearn,https://www.youtube.com/watch?v=XkaJ3IPqGLw,Module 9: Cybersecurity Trends and Future,12th,English/Hindi
6703,Information Technology,Cyber Security Playlist [2024 Updated]🔥,,What Is Botnet? | What Is Botnet And How It Works? | Botnet Explained | Botnet Tutorial |Simplilearn,https://www.youtube.com/watch?v=NbvBQRXL7WQ,Module 9: Cybersecurity Trends and Future,12th,English/Hindi
6704,Information Technology,Cyber Security Playlist [2024 Updated]🔥,,Keylogger | What Is Keylogger And How Does It Work? | Keylogger Explained | Simplilearn,https://www.youtube.com/watch?v=6NdPeYCwEFE,Module 9: Cybersecurity Trends and Future,12th,English/Hindi
6705,Information Technology,Cyber Security Playlist [2024 Updated]🔥,,Pegasus Spyware | What Is Pegasus Spyware And How Does It Work? | Pegasus Explained | Simplilearn,https://www.youtube.com/watch?v=zZfXNWgklpg,Module 9: Cybersecurity Trends and Future,12th,English/Hindi
6706,Information Technology,Cyber Security Playlist [2024 Updated]🔥,,SolarWinds Attack Explained | What Is SolarWinds Attack? | Cyber Security | Simplilearn,https://www.youtube.com/watch?v=RxGI-l4VxL0,Module 9: Cybersecurity Trends and Future,12th,English/Hindi
6707,Information Technology,Cyber Security Playlist [2024 Updated]🔥,,How To Know If Your Computer Is Hacked | How To Detect Computer Virus | Computer Hacks | Simplilearn,https://www.youtube.com/watch?v=nU0jdP0PbJg,Module 9: Cybersecurity Trends and Future,12th,English/Hindi
6708,Information Technology,Cyber Security Playlist [2024 Updated]🔥,,Top 10 Cyber Attacks In History | Biggest Cyber Attacks Of All Time | Cyber Security | Simplilearn,https://www.youtube.com/watch?v=fUeJtM1bgGo,Module 9: Cybersecurity Trends and Future,12th,English/Hindi
6709,Information Technology,Cyber Security Playlist [2024 Updated]🔥,,Top 10 Cyber Attacks in World | Top 10 Cyber Attacks of All Time | Cybersecurity | Simplilearn,https://www.youtube.com/watch?v=_gMyN5Pdv5Y,Module 9: Cybersecurity Trends and Future,12th,English/Hindi
6710,Information Technology,Cyber Security Playlist [2024 Updated]🔥,,Top 10 Most Dangerous Hackers Of All Time | Top 10 Hackers In The World | Simplilearn,https://www.youtube.com/watch?v=Itopz-raZSY,Module 9: Cybersecurity Trends and Future,12th,English/Hindi
6711,Information Technology,Cyber Security Playlist [2024 Updated]🔥,,Application Security Tutorial | Application Security Basics | Cyber Security Tutorial | Simplilearn,https://www.youtube.com/watch?v=b_pebwsmRgw,Module 9: Cybersecurity Trends and Future,12th,English/Hindi
6712,Information Technology,Cyber Security Playlist [2024 Updated]🔥,,This Is How Hackers Crack Your Password | Password Cracking and Brute Force Tools | Simplilearn,https://www.youtube.com/watch?v=_CwGYkxrP-k,Module 9: Cybersecurity Trends and Future,12th,English/Hindi
6713,Information Technology,Cyber Security Playlist [2024 Updated]🔥,,How to Create a Strong Password | Tips to Create Strong Passwords | Cyber Security | Simplilearn,https://www.youtube.com/watch?v=VDbMObpHWhw,Module 9: Cybersecurity Trends and Future,12th,English/Hindi
6714,Information Technology,Cyber Security Playlist [2024 Updated]🔥,,How To Keep WhatsApp Safe From Hackers? | WhatsApp Hacking Prevention | Cyber Security | Simplilearn,https://www.youtube.com/watch?v=A9HVhrM5OoE,Module 9: Cybersecurity Trends and Future,12th,English/Hindi
6715,Information Technology,Cyber Security Playlist [2024 Updated]🔥,,How To Install Kali Linux On Windows 10 | Kali Linux Tutorial 2021 | Kali Linux Install |Simplilearn,https://www.youtube.com/watch?v=P3T1uEh77r0,Module 9: Cybersecurity Trends and Future,12th,English/Hindi
6716,Information Technology,Cyber Security Playlist [2024 Updated]🔥,,Parrot Security OS Installation Tutorial 2021 | How To Install Parrot OS In Virtualbox | Simplilearn,https://www.youtube.com/watch?v=NoivU2LrUrI,Module 9: Cybersecurity Trends and Future,12th,English/Hindi
6717,Information Technology,Cyber Security Playlist [2024 Updated]🔥,,Nmap Tutorial For Beginners | How To Scan Your Network Using Nmap | Ethical Hacking | Simplilearn,https://www.youtube.com/watch?v=NtPcoDtetvk,Module 9: Cybersecurity Trends and Future,12th,English/Hindi
6718,Information Technology,Cyber Security Playlist [2024 Updated]🔥,,Ubuntu vs Debian 2022: Which One Should You Choose? | Ubuntu And Debian Difference | Simplilearn,https://www.youtube.com/watch?v=IVpwBHLA-Wg,Module 9: Cybersecurity Trends and Future,12th,English/Hindi
6719,Information Technology,Cyber Security Playlist [2024 Updated]🔥,,What Is Intrusion Detection System? | Intrusion Detection System (IDS) | Cyber Security |Simplilearn,https://www.youtube.com/watch?v=dfVAi87BSEs,Module 9: Cybersecurity Trends and Future,12th,English/Hindi
6720,Information Technology,Cyber Security Playlist [2024 Updated]🔥,,What Is IAM? | Identity and Access Management for Beginners (IAM) | IAM for Beginners | Simplilearn,https://www.youtube.com/watch?v=gsgdAyGhV0o,Module 9: Cybersecurity Trends and Future,12th,English/Hindi
6721,Information Technology,Cyber Security Playlist [2024 Updated]🔥,,Command Prompt Tricks 2022 | Command Prompt Hacks | Command Prompt Tutorial 2022 | Simplilearn,https://www.youtube.com/watch?v=iUp-VqfSaR8,Module 9: Cybersecurity Trends and Future,12th,English/Hindi
6722,Information Technology,Cyber Security Playlist [2024 Updated]🔥,,Networking Commands For Beginners 2022 | Networking Commands In Windows With Example | Simplilearn,https://www.youtube.com/watch?v=gvsgo8gho0U,Module 9: Cybersecurity Trends and Future,12th,English/Hindi
6723,Information Technology,Cyber Security Playlist [2024 Updated]🔥,,Encryption Explained Simply | What Is Encryption? | Cryptography And Network Security | Simplilearn,https://www.youtube.com/watch?v=LA3fah6i-4A,Module 9: Cybersecurity Trends and Future,12th,English/Hindi
6724,Information Technology,Cyber Security Playlist [2024 Updated]🔥,,What Is Cryptography? | Introduction To Cryptography | Cryptography Tutorial | Simplilearn,https://www.youtube.com/watch?v=rjWx39mB4Sc,Module 9: Cybersecurity Trends and Future,12th,English/Hindi
6725,Information Technology,Cyber Security Playlist [2024 Updated]🔥,,Symmetric Key Cryptography | Stream Cipher & Block Cipher Explained | Network Security | Simplilearn,https://www.youtube.com/watch?v=uzGzSHGip_o,Module 9: Cybersecurity Trends and Future,12th,English/Hindi
6726,Information Technology,Cyber Security Playlist [2024 Updated]🔥,,AES and DES Algorithm Explained | Difference between AES and DES | Network Security | Simplilearn,https://www.youtube.com/watch?v=ZzVV0llZoII,Module 9: Cybersecurity Trends and Future,12th,English/Hindi
6727,Information Technology,Cyber Security Playlist [2024 Updated]🔥,,Asymmetric Key Cryptography | RSA Encryption Algorithm | Asymmetric Encryption | Simplilearn,https://www.youtube.com/watch?v=sH74nrEefyI,Module 9: Cybersecurity Trends and Future,12th,English/Hindi
6728,Information Technology,Cyber Security Playlist [2024 Updated]🔥,,Diffie Hellman Key Exchange Algorithm | Cryptography And Network Security | Simplilearn,https://www.youtube.com/watch?v=_0vdcgwC5Zg,Module 9: Cybersecurity Trends and Future,12th,English/Hindi
6729,Information Technology,Cyber Security Playlist [2024 Updated]🔥,,DSA Algorithm | DSA Algorithm Explained | Digital Signature Algorithm | Simplilearn,https://www.youtube.com/watch?v=ANsg4wIQFn4,Module 9: Cybersecurity Trends and Future,12th,English/Hindi
6730,Information Technology,Cyber Security Playlist [2024 Updated]🔥,,RSA Encryption Algorithm | Rivest–Shamir–Adleman | RSA Algorithm Explained | Simplilearn,https://www.youtube.com/watch?v=vf1z7GlG6Qo,Module 9: Cybersecurity Trends and Future,12th,English/Hindi
6731,Information Technology,Cyber Security Playlist [2024 Updated]🔥,,RSA and DSA Encryption Algorithms Explained | Cryptography & Network Security Tutorial | Simplilearn,https://www.youtube.com/watch?v=bO4lEQfPn60,Module 9: Cybersecurity Trends and Future,12th,English/Hindi
6732,Information Technology,Cyber Security Playlist [2024 Updated]🔥,,Symmetric Key Cryptography And Asymmetric Key Cryptography | Cryptography Tutorial | Simplilearn,https://www.youtube.com/watch?v=vYF8fWiV0vI,Module 9: Cybersecurity Trends and Future,12th,English/Hindi
6733,Information Technology,Cyber Security Playlist [2024 Updated]🔥,,What Is Hashing? | What Is Hashing With Example | Hashing Explained Simply | Simplilearn,https://www.youtube.com/watch?v=jmtzX-NPFDc,Module 9: Cybersecurity Trends and Future,12th,English/Hindi
6734,Information Technology,Cyber Security Playlist [2024 Updated]🔥,,MD5 Algorithm | What Is MD5 Algorithm? | MD5 Algorithm Explained | Network Security | Simplilearn,https://www.youtube.com/watch?v=r6GlzIWiMD0,Module 9: Cybersecurity Trends and Future,12th,English/Hindi
6735,Information Technology,Cyber Security Playlist [2024 Updated]🔥,,Top Hashing Algorithms In Cryptography | MD5 and SHA 256 Algorithms Explained | Simplilearn,https://www.youtube.com/watch?v=Plp4F3ZfC7A,Module 9: Cybersecurity Trends and Future,12th,English/Hindi
6736,Information Technology,Cyber Security Playlist [2024 Updated]🔥,,"Cyber Security Career - Salary, Jobs And Skills | Cyber Security Career Roadmap | Simplilearn",https://www.youtube.com/watch?v=BlsW9jp9NJM,Module 9: Cybersecurity Trends and Future,12th,English/Hindi
6737,Information Technology,Cyber Security Playlist [2024 Updated]🔥,,Top 10 Highest Paying Cyber Security Jobs in 2022 | Cyber Security- Jobs & Salaries | Simplilearn,https://www.youtube.com/watch?v=Jz6jogA29ps,Module 9: Cybersecurity Trends and Future,12th,English/Hindi
6738,Information Technology,Cyber Security Playlist [2024 Updated]🔥,,"Cyber Security Career Path | Cyber Security Jobs, Salary, Skills and Roles | Simplilearn",https://www.youtube.com/watch?v=nLKtI99f0es,Module 9: Cybersecurity Trends and Future,12th,English/Hindi
6739,Information Technology,Cyber Security Playlist [2024 Updated]🔥,,How To Become A Cybersecurity Expert  | Cybersecurity Engineer | Cybersecurity Course|Simplilearn,https://www.youtube.com/watch?v=cwQlRIpaLLo,Module 9: Cybersecurity Trends and Future,12th,English/Hindi
6740,Information Technology,Cyber Security Playlist [2024 Updated]🔥,,Cyber Security Certifications 2021 | Cyber Security Certification For Beginners | Simplilearn,https://www.youtube.com/watch?v=JDMAkUAvKEE,Module 9: Cybersecurity Trends and Future,12th,English/Hindi
