Unnamed: 0,Sector,CourseName,Duration,TopicName,URL
4146,Medicine,Emergency Medicine Lectures,44hrs 14min,"CARDIAC ARREST EMERGENCY MANAGEMENT, UNCONSCIOUS PULSELESS PATIENT TREATMENT ACLS RHYTHM REVIEW 2021",https://www.youtube.com/watch?v=0d85qKobfP8
4147,Medicine,Emergency Medicine Lectures,,"ANAPHYLACTIC SHOCK(ANAPHYLAXIS) EMERGENCY MANAGEMENT PROTOCOL,ANAPHYLAXIS REACTION TREATMENT NURSING",https://www.youtube.com/watch?v=yQv9ZgNSkDA
4148,Medicine,Emergency Medicine Lectures,,"Status Epilepticus Emergency Treatment and Management Step Wise, Emergency Medicine Lecture Series",https://www.youtube.com/watch?v=8wVeLn5uKgw
4149,Medicine,Emergency Medicine Lectures,,"Emergency Treatment For Stroke - Investigations,Types, Long-Term Management, Stroke Medicine Lecture",https://www.youtube.com/watch?v=CP-WEh9C9Eg
4150,Medicine,Emergency Medicine Lectures,,"Snake Bite First Aid Emergency Treatment, Management in Hospital/at Home Guidelines Nursing, Lecture",https://www.youtube.com/watch?v=1zP9bMv78D4
4151,Medicine,Emergency Medicine Lectures,,"Transient Ischemic Attack (TIA) Emergency Treatment & Management, Symtoms, Medicine Lecture USMLE",https://www.youtube.com/watch?v=uEMJCjsl3mM
4152,Medicine,Emergency Medicine Lectures,,"HYPERTENSIVE CRISES (EMERGENCY AND URGENCY) TREATMENT, HYPERTENSIVE EMERGENCY MANAGEMENT ALOGRITHAM",https://www.youtube.com/watch?v=O-PAsam2pnw
4153,Medicine,Emergency Medicine Lectures,,"Myocardial Infarction (MI,Heart Attack) Treatment in Emergency | Step wise  STEMI Management USMLE",https://www.youtube.com/watch?v=k_cMaukhoUw
4154,Medicine,Emergency Medicine Lectures,,"Acute Decompensated Heart Failure (Flash Pulmonary Edema) Emergency Treatment, Medicine Lecture",https://www.youtube.com/watch?v=xPGBLB-ejtU
4155,Medicine,Emergency Medicine Lectures,,"Hyperkalemia Treatment In Emergency,Hyperkalemia Causes,ECG changes and Management",https://www.youtube.com/watch?v=xmafdsADGi0
4156,Medicine,Emergency Medicine Lectures,,Esophageal Varices & Variceal Hemorrhage Treatment and Managment(STEP WISE APPROACH),https://www.youtube.com/watch?v=X308-qVBeqI
4157,Medicine,Emergency Medicine Lectures,,"STATUS ASTHAMATICUS (ACUTE SEVERE ASTHMA) EMERGENCY MANAGEMENT/TREATMENT, EMERGENCY MEDICINE LECTURE",https://www.youtube.com/watch?v=_A7jgGAs0VI
4158,Medicine,Emergency Medicine Lectures,,"Acute COPD Exacerbation Emergency Management/Treatment, Symptoms,Causes, Emergency Medicine Lectures",https://www.youtube.com/watch?v=JhzUUn9YiMM
4159,Medicine,Emergency Medicine Lectures,,"Diabetic Ketoacidosis (DKA) Emergency Treatment & Management Guidelines, Medicine Lecture, USMLE",https://www.youtube.com/watch?v=4Rqxvge4Y_c
4160,Medicine,Emergency Medicine Lectures,,"ATRIAL FIBRILLATION (AFIB) TREATMENT, ECG INTERPRETATION, PATHOPHYSIOLOGY, AFIB MANAGEMENT LECTURE",https://www.youtube.com/watch?v=2apynLGrTe4
4161,Medicine,Emergency Medicine Lectures,,"Sepsis and Septic Shock Treatment in Emergency, Sepsis Treatment Guidelines, Symptoms & Management",https://www.youtube.com/watch?v=QyZ9KMZREJo
4162,Medicine,Emergency Medicine Lectures,,"CHOKING FIRST AID, TREATMENT IN INFANTS (BABY) ADULTS, HEIMLICH MANEUVER, UNCONCIOUS CHOKING VICTIM",https://www.youtube.com/watch?v=jx4uOV9y9bY
4163,Medicine,Emergency Medicine Lectures,,Angina Pectoris - An Approach To Chest Pain & Acute Coronary Syndrome | Stable & Unstable Angina |,https://www.youtube.com/watch?v=AEvVcCPOp_E
4164,Medicine,Emergency Medicine Lectures,,"Pulmonary Embolism(PE), Diagnosis Alogritham, Treatment, Well's Criteria, CT, Medicine Lecture,USMLE",https://www.youtube.com/watch?v=kKH5CYFM9FE
4165,Medicine,Emergency Medicine Lectures,,"HYPOKALEMIA TREATMENT GUIDELINES, SYMPTOMS, MANAGEMENT, ECG CHANGES, POTTASSIUM REPLACEMENT PROTOCOL",https://www.youtube.com/watch?v=WWVxuSDk8js
4166,Medicine,Emergency Medicine Lectures,,"Hyperosmolar Hyperglycemic State (HHS) vs DKA, Hyperglycemic Nonketotic Coma Syndrome Management",https://www.youtube.com/watch?v=S62DEsEraSw
4167,Medicine,Emergency Medicine Lectures,,"THYROTOXICOSIS, THYROTOXIC CRISES (THYROID STORM) EMERGENCY TREATMENT MANAGEMENT LECTURE, USMLE",https://www.youtube.com/watch?v=STIGHMJxDgs
4168,Medicine,Emergency Medicine Lectures,,MYXEDEMA COMA (MYXOEDEMA) PATIENT EMERGENCY MANAGEMENT & TREATMENT MYXEDEMIC HYPOTHYROIDISM LECTURE,https://www.youtube.com/watch?v=C5x7VyGxjX8
4169,Medicine,Emergency Medicine Lectures,,"HOW TO TREAT ADDISONIAN CRISES IN EMERGENCY, PATHOPHYSIOLOGY, CAUSES, SYMPTOMS ADDISONS CRISES USMLE",https://www.youtube.com/watch?v=yYuv6z8ORQA
4170,Medicine,Emergency Medicine Lectures,,"Pneumonia (Community & Hospital Acquired) Treatment Guidelines, Symptoms, Medicine Lecture USMLE",https://www.youtube.com/watch?v=RJOLs8HV4P0
4171,Medicine,Emergency Medicine Lectures,,"Poisoning Treatment/Management in Emergency Department, Symptoms, Toxicology Medicine Lecture USMLE",https://www.youtube.com/watch?v=L9sYvxD7HB0
4172,Medicine,Emergency Medicine Lectures,,"Paracetamol Overdose/Poisoning Patient Treatment & Management in Emergency, Toxicology Lecture USMLE",https://www.youtube.com/watch?v=iQKuUi126nk
4173,Medicine,Emergency Medicine Lectures,,"Organophosphate Poisoning Pesticides Treatment/Management, Pathophysiology Toxicology Medicine USMLE",https://www.youtube.com/watch?v=ZYuFjJu6kRc
4174,Medicine,Emergency Medicine Lectures,,"BETA BLOCKERS OVERDOSE/TOXICITY EMERGENCY TREATMENT WITH GLUCAGON, TOXICOLOGY LECTURES USMLE",https://www.youtube.com/watch?v=VGnKmRRtmXY
4175,Medicine,Emergency Medicine Lectures,,"Benzodiazepine (Alprazolam) Overdose/Toxicity Treatment in Emergency, Toxicology Lectures",https://www.youtube.com/watch?v=c2AwmD1vgRw
4176,Medicine,Emergency Medicine Lectures,,"Salicylate (Aspirin) Poisoning/Overdose Treatment & Management, Forensic Toxicology lectures, USMLE",https://www.youtube.com/watch?v=IVEsgABJrAI
4177,Medicine,Emergency Medicine Lectures,,"Opiod Overdose Crises Treatment & Management in Emergency, How to Administer Nalaxone, Toxicology",https://www.youtube.com/watch?v=JVUo_a60cLY
4178,Medicine,Emergency Medicine Lectures,,"Head Injury FirstAid/Treatment & Management Guidelines Symptoms Lecture USMLE, Emergency Medicine",https://www.youtube.com/watch?v=Qdb8xnErnXk
4179,Medicine,Emergency Medicine Lectures,,"Coma (Comatose Patient) Unconscious Patient First Aid Emergency Care Treatment & Management, USMLE",https://www.youtube.com/watch?v=J0b_3yRN8zQ
4180,Medicine,Emergency Medicine Lectures,,"Raised Intracranial Pressure (ICP,) Cushing's Triad, Bradycardia, Signs & Features,Management,USMLE",https://www.youtube.com/watch?v=X1SD5O84UE4
4181,Medicine,Emergency Medicine Lectures,,"Migraine Headache Treatment , Prophylaxis, Symptoms, Types, Triggers, Neurology Lectures USMLE",https://www.youtube.com/watch?v=WezOwldp0Dc
4182,Medicine,Emergency Medicine Lectures,,"Meningitis Treatment, Examination Signs, Symptoms, Causes, Pathology, Medicine Lecture, USMLE",https://www.youtube.com/watch?v=ZAIJn_7Cs1A
4183,Medicine,Emergency Medicine Lectures,,"Encephalitis Treatment, Signs & Symptoms, Causes, Pathology, Management, Medicine Lecture, USMLE",https://www.youtube.com/watch?v=1TpcVTWtKG8
4184,Medicine,Emergency Medicine Lectures,,"Urinary Tract Infection(UTI) Treatment, Cystitis, Pyelonephritis, Symptoms(Men & Women),  USMLE",https://www.youtube.com/watch?v=Qh7OBuzc8mc
4185,Medicine,Emergency Medicine Lectures,,"Urinary Tract Infection (UTI) in Pregnancy Treatment in Women, Symptoms  Pregnant Female USMLE/NCLEX",https://www.youtube.com/watch?v=5YQEzNjWTeY
4186,Medicine,Emergency Medicine Lectures,,"Dog Bite (Rabies Virus) Emergency Treatment, Rabies Symptoms,Post-Exposure Prophylaxis Vaccine USMLE",https://www.youtube.com/watch?v=hmBNlUPPmrQ
4187,Medicine,Emergency Medicine Lectures,,"Malaria Treatment Guidelines, Life Cycle, Symptoms, Prevention, Medicine Lecture USMLE/NCLEX",https://www.youtube.com/watch?v=tQ1FkG1Si3w
4188,Medicine,Emergency Medicine Lectures,,"Severe Complicated Falciparum Malaria Treatment & Management, Symptoms, Complications, USMLE/NCLEX",https://www.youtube.com/watch?v=ZrqZhao4UGk
4189,Medicine,Emergency Medicine Lectures,,"Basics of Ventilator (Mechanical Ventilation) Modes and Settings Made Easy (AC, SIMV, PCV, CMV, VC)",https://www.youtube.com/watch?v=GZeFkCGClSU
4190,Medicine,Emergency Medicine Lectures,,"Malignant hyperthermia USMLE/Nursing, Dantrolene,Pathophysiology, Presentation, Treatment, Mechanism",https://www.youtube.com/watch?v=j0MKDmTx7OY
4191,Medicine,Emergency Medicine Lectures,,"Dengue Fever Treatment (Dengue Hemorrhagic Fever) Symptoms, Rashes, Diagnosis, Management Lecture",https://www.youtube.com/watch?v=Of2XBq635xg
4192,Medicine,Emergency Medicine Lectures,,"Supraventricular Tachycardia/Arrhythmia (SVT) Treatment, Vagal Maneuvers, ECG, Lecture USMLE/NCLEX",https://www.youtube.com/watch?v=4KNUXfHED9k
4193,Medicine,Emergency Medicine Lectures,,"Bronchiectasis Treatment, Pathophysiology, Symptoms, Exacerbation Management, Medicine Lecture USMLE",https://www.youtube.com/watch?v=aTanvjXsT_c
4194,Medicine,Emergency Medicine Lectures,,"Neuroleptic Malignant Syndrome (nms), Presentation, USMLE/NCLEX, vs serotonin syndrome, treatment",https://www.youtube.com/watch?v=dFyxZ0sDMjQ
4195,Medicine,Emergency Medicine Lectures,,"Facial palsy (Bell's Palsy) Treatment, Upper and Lower motor neuron (UMN vs LMN), Symptoms, USMLE",https://www.youtube.com/watch?v=yfjPqOTBQNs
4196,Medicine,Emergency Medicine Lectures,,"Hiccups (Persistent/Intractable) Treatment, Physical Maneuveurs, Medications, Medicine Lecture USMLE",https://www.youtube.com/watch?v=92wq7hIrFEA
4197,Medicine,Emergency Medicine Lectures,,Hemorrhagic Stroke (Intracerebral Hemorrhage) Emergency Treatment Management Medicine Lecture USMLE,https://www.youtube.com/watch?v=iEo6TF5QnUY
4198,Medicine,Emergency Medicine Lectures,,"Acute Pancreatitis Treatment/Management, Diagnosis, Pathophysiology, Surgery/Medicine Lecture USMLE",https://www.youtube.com/watch?v=dnTGTwKaGsI
4199,Medicine,Emergency Medicine Lectures,,"Acute Kidney Injury (AKI) Trearment/Management Stepwise Medicine Lecture, Staging,  USMLE/Neetpg",https://www.youtube.com/watch?v=6dt_ipPz94w
4200,Medicine,Emergency Medicine Lectures,,"Neutropenic Fever/Sepsis Treatment & Management Guidelines, Diagnosis Medicine Lecture, USMLE/Neetpg",https://www.youtube.com/watch?v=v2XZ6_nPD7E
4201,Medicine,Emergency Medicine Lectures,,"Pain management Lecture Part 1, Referred Pain, Introduction, Definition, Classification, USMLE/NCLEX",https://www.youtube.com/watch?v=B_l1ACkzl8U
4202,Medicine,Emergency Medicine Lectures,,"Pain Management, WHO Analgesic Ladder, Pharmacology, Drugs, Lecture, USMLE, NEETPG Part 2",https://www.youtube.com/watch?v=--Jc5xl4niY
4203,Medicine,Emergency Medicine Lectures,,"Hypoglycemia In Non-Diabetics Treatment, Symptoms, Workup, Treatment of Hypoglycemia USMLE NEETPG",https://www.youtube.com/watch?v=EvoGhpMEGGA
