Unnamed: 0,Sector,CourseName,Duration,TopicName,URL,Module,ModuleNo
7335,Anthropology,Native American & Indigenous Studies Playlist,0hrs 162min,End of the Line — The Women of Standing Rock Trailer,https://www.youtube.com/watch?v=E6oVN_mWLpo,Module 1: Introduction to Native American & Indigenous Studies,1
7336,Anthropology,Native American & Indigenous Studies Playlist,,Pearl Means: The Spiritual Essence of the Lakota People,https://www.youtube.com/watch?v=X1v5KXtcFhY,Module 1: Introduction to Native American & Indigenous Studies,1
7337,Anthropology,Native American & Indigenous Studies Playlist,,Postindian Warrior: Creating a New Consciousness in Native America,https://www.youtube.com/watch?v=Tx1uvgmXP48,Module 1: Introduction to Native American & Indigenous Studies,1
7338,Anthropology,Native American & Indigenous Studies Playlist,,"Rowen White: Clip from ""What Kind of Ancestor Do You Want to Be?"" Conversation in November 2021",https://www.youtube.com/watch?v=FEBwuMmY4Ms,Module 1: Introduction to Native American & Indigenous Studies,1
7339,Anthropology,Native American & Indigenous Studies Playlist,,SAND Archives: The Resurgence of Indigenous Wisdom: Lyla June,https://www.youtube.com/watch?v=yCzuQXW06-M,Module 2: Indigenous Knowledge Systems and Practices,2
7340,Anthropology,Native American & Indigenous Studies Playlist,,Why Historical Trauma Must Inform American Indian Healthcare,https://www.youtube.com/watch?v=4zfiGdV_WQk,Module 2: Indigenous Knowledge Systems and Practices,2
7341,Anthropology,Native American & Indigenous Studies Playlist,,Stan Rushworth Interview,https://www.youtube.com/watch?v=Kir_1mX7OSE,Module 2: Indigenous Knowledge Systems and Practices,2
7342,Anthropology,Native American & Indigenous Studies Playlist,,UO Today interview: Leanne Betasamosake Simpson,https://www.youtube.com/watch?v=3vg_7Ar6JsE,Module 2: Indigenous Knowledge Systems and Practices,2
7343,Anthropology,Native American & Indigenous Studies Playlist,,Indigenous Peoples in American History [2021/01-17],https://www.youtube.com/watch?v=cZ6RvvfqqJY,"Module 3:  Historical Trauma, Resilience, and Resistance",3
7344,Anthropology,Native American & Indigenous Studies Playlist,,"SPPH Voices in Health - April 16, 2020",https://www.youtube.com/watch?v=t7ALJ7viGog,"Module 3:  Historical Trauma, Resilience, and Resistance",3
7345,Anthropology,Native American & Indigenous Studies Playlist,,Kahente Horn Miller - Tsi ni tsi wen:a: To Make Alive in the Minds of the People,https://www.youtube.com/watch?v=r4LdcoidMIY,"Module 3:  Historical Trauma, Resilience, and Resistance",3
7346,Anthropology,Native American & Indigenous Studies Playlist,,Full Future History Interview - Rematriation,https://www.youtube.com/watch?v=i97IZsVFqiw,"Module 3:  Historical Trauma, Resilience, and Resistance",3
7347,Anthropology,Native American & Indigenous Studies Playlist,,Nikki Sanchez: Decolonize Together,https://www.youtube.com/watch?v=sPySao8Rvq4,"Module 4: Land, Environment, and Sustainability",4
7348,Anthropology,Native American & Indigenous Studies Playlist,,Missing & Murdered Indigenous Women Day | Symone,https://www.youtube.com/watch?v=ch3kWyMYLCU,"Module 4: Land, Environment, and Sustainability",4
7349,Anthropology,Native American & Indigenous Studies Playlist,,Hobiyee Drum Drill,https://www.youtube.com/watch?v=FW3vj4_Uq8Y,"Module 4: Land, Environment, and Sustainability",4
7350,Anthropology,Native American & Indigenous Studies Playlist,,Remember,https://www.youtube.com/watch?v=KIBM55W5e_I,"Module 4: Land, Environment, and Sustainability",4
7351,Anthropology,Native American & Indigenous Studies Playlist,,Ode in Te Reo Maori - He Mihi Whakamaumahara,https://www.youtube.com/watch?v=rSKnHmf6sGg,"Module 5: Indigenous Art, Culture, and Language",5
7352,Anthropology,Native American & Indigenous Studies Playlist,,Artist Nikau Hindin on Toi Tū Toi Ora: Contemporary Māori Art,https://www.youtube.com/watch?v=jVoQgZzz1co,"Module 5: Indigenous Art, Culture, and Language",5
7353,Anthropology,Native American & Indigenous Studies Playlist,,Unfurling Tākiri with Nikau Gabrielle Hindin,https://www.youtube.com/watch?v=Hptlacp96N0,"Module 5: Indigenous Art, Culture, and Language",5
7354,Anthropology,Native American & Indigenous Studies Playlist,,Te Iwa o Matariki // Tupuārangi // Nikau Hindin (2020),https://www.youtube.com/watch?v=S5o1x-fb0kA,"Module 5: Indigenous Art, Culture, and Language",5
7355,Anthropology,Native American & Indigenous Studies Playlist,,"Dina Gilio-Whitaker author of ""As Long as Grass Grows""",https://www.youtube.com/watch?v=id2FI6P__jg,"Module 6: Indigenous Identity, Worldviews, and Spirituality",6
7356,Anthropology,Native American & Indigenous Studies Playlist,,David Suzuki Witnesses the Unraveling,https://www.youtube.com/watch?v=o_Sh44uFNbY,"Module 6: Indigenous Identity, Worldviews, and Spirituality",6
7357,Anthropology,Native American & Indigenous Studies Playlist,,The importance of water from a Syilx perspective,https://www.youtube.com/watch?v=j6TEoCnJGm8,"Module 6: Indigenous Identity, Worldviews, and Spirituality",6
7358,Anthropology,Native American & Indigenous Studies Playlist,,Jeannette Armstrong - Knowledge of Place,https://www.youtube.com/watch?v=dOnbzyP9PZs,"Module 6: Indigenous Identity, Worldviews, and Spirituality",6
7359,Anthropology,Native American & Indigenous Studies Playlist,,Excerpt - Consciously Apply Mystery to Everything with TIOKASIN GHOSTHORSE,https://www.youtube.com/watch?v=MtttmApns9I,Module 7:  Social and Political Issues,7
7360,Anthropology,Native American & Indigenous Studies Playlist,,How to Build Great Soil - A Soil Science Masterclass with Dr. Elaine Ingham (Part 1 of 4),https://www.youtube.com/watch?v=ErMHR6Mc4Bk,Module 7:  Social and Political Issues,7
7361,Anthropology,Native American & Indigenous Studies Playlist,,How to Build Great Soil - A Soil Science Masterclass with Dr. Elaine Ingham (Part 2 of 4),https://www.youtube.com/watch?v=N_2i9AUGmmg,Module 7:  Social and Political Issues,7
7362,Anthropology,Native American & Indigenous Studies Playlist,,Indigenous Knowledge and Western Science: Dr. Gregory Cajete Talk,https://www.youtube.com/watch?v=nFeNIOgIbzw,Module 7:  Social and Political Issues,7
7363,Anthropology,Native American & Indigenous Studies Playlist,,"'We are part of nature, not apart from it’ - He Kete Mātauranga",https://www.youtube.com/watch?v=WNSiAB9h-xs,Module 8:  Decolonization and Reconciliation,8
7364,Anthropology,Native American & Indigenous Studies Playlist,,Erin Matariki Carr - The Resurgence of Māori Law | Bioneers 2023,https://www.youtube.com/watch?v=4wVFNmPvHEg,Module 8:  Decolonization and Reconciliation,8
7365,Anthropology,Native American & Indigenous Studies Playlist,,Suzanne Simard – Dispatches From the Mother Trees | Bioneers,https://www.youtube.com/watch?v=muHoxFIy6HE,Module 8:  Decolonization and Reconciliation,8
7366,Anthropology,Native American & Indigenous Studies Playlist,,Wakan Tipi: Dakota Sacred Land,https://www.youtube.com/watch?v=nt1fG_5UFkI,Module 8:  Decolonization and Reconciliation,8
7367,Anthropology,Native American & Indigenous Studies Playlist,,Mni Sota: Dakota Sacred Waters,https://www.youtube.com/watch?v=SOQm7Emo6pU,Module 9: Indigenous Futurisms: Sustainability and Beyond,9
7368,Anthropology,Native American & Indigenous Studies Playlist,,Bdoté—An Introduction by Leonard Wabasha1,https://www.youtube.com/watch?v=WhEm02Sa3l8,Module 9: Indigenous Futurisms: Sustainability and Beyond,9
7369,Anthropology,Native American & Indigenous Studies Playlist,,Colin Fogarty - Columbia River Confluence Project,https://www.youtube.com/watch?v=VazmCQK2xzc,Module 9: Indigenous Futurisms: Sustainability and Beyond,9
7370,Anthropology,Native American & Indigenous Studies Playlist,,Celilo Falls silenced by the Dalles Dam | Echo of Water Against Rocks,https://www.youtube.com/watch?v=oWdxY_5DHq0,Module 9: Indigenous Futurisms: Sustainability and Beyond,9
7371,Anthropology,Native American & Indigenous Studies Playlist,,The Mi'kmaq Origin Story/Ktaqmkuk as told by Michelle Bennett at Port au Port Peninsula,https://www.youtube.com/watch?v=AGQETzVrEk0,Module 9: Indigenous Futurisms: Sustainability and Beyond,9
7372,Anthropology,Native American & Indigenous Studies Playlist,,2017 Geography of Hope: Lyla June Johnston on Forgiveness,https://www.youtube.com/watch?v=DnBWEBt7nk0,Module 9: Indigenous Futurisms: Sustainability and Beyond,9
7373,Anthropology,Native American & Indigenous Studies Playlist,,"""""TENDING THE WILD"" by M. Kat Anderson",https://www.youtube.com/watch?v=MDM2nnTIZD0,Module 9: Indigenous Futurisms: Sustainability and Beyond,9
7374,Anthropology,Native American & Indigenous Studies Playlist,,T1.1 Environmental Value Systems,https://www.youtube.com/watch?v=QhJLtJC_uL8,Module 9: Indigenous Futurisms: Sustainability and Beyond,9
7375,Anthropology,Native American & Indigenous Studies Playlist,,IB ESS Topic 1 1 Environmental Value Systems,https://www.youtube.com/watch?v=4204AMnQW7w,Module 9: Indigenous Futurisms: Sustainability and Beyond,9
7376,Anthropology,Native American & Indigenous Studies Playlist,,The Wicked Problem of Climate Change,https://www.youtube.com/watch?v=q-V_JMYGW8g,Module 9: Indigenous Futurisms: Sustainability and Beyond,9
7377,Anthropology,Native American & Indigenous Studies Playlist,,"Jan. 10, 2021: Indigenizing Environmental Justice (Dina Gilio-Whitaker)",https://www.youtube.com/watch?v=jRIY3xx7sKo,Module 9: Indigenous Futurisms: Sustainability and Beyond,9
7378,Anthropology,Native American & Indigenous Studies Playlist,,"A healthy economy should be designed to thrive, not grow | Kate Raworth",https://www.youtube.com/watch?v=Rhcrbcg8HBw,Module 9: Indigenous Futurisms: Sustainability and Beyond,9
7379,Anthropology,Native American & Indigenous Studies Playlist,,Daniel Schmachtenberger - How can we live a meaningful life?,https://www.youtube.com/watch?v=uEAsKkjDURs,Module 9: Indigenous Futurisms: Sustainability and Beyond,9
7380,Anthropology,Native American & Indigenous Studies Playlist,,Dr. Debra Harry - Q6. How is an indigenous people’s worldview different from Western societies?,https://www.youtube.com/watch?v=xUaNSV311Gs,Module 9: Indigenous Futurisms: Sustainability and Beyond,9
7381,Anthropology,Native American & Indigenous Studies Playlist,,Rick Hill: What is Indigenous knowledge?,https://www.youtube.com/watch?v=AZ6gvd-HaP8,Module 9: Indigenous Futurisms: Sustainability and Beyond,9
7382,Anthropology,Native American & Indigenous Studies Playlist,,Rick Hill: How do Indigenous art forms convey knowledge?,https://www.youtube.com/watch?v=4ztcSvtMnbA,Module 9: Indigenous Futurisms: Sustainability and Beyond,9
7383,Anthropology,Native American & Indigenous Studies Playlist,,Cornel Pewewardy: Indigenous Voices,https://www.youtube.com/watch?v=a8l4QNsoxvs,Module 9: Indigenous Futurisms: Sustainability and Beyond,9
7384,Anthropology,Native American & Indigenous Studies Playlist,,A Pueblo Story of Sustainability | Gregory A. Cajete | TEDxABQSalon,https://www.youtube.com/watch?v=5_nxJMhSlOg,Module 9: Indigenous Futurisms: Sustainability and Beyond,9
7385,Anthropology,Native American & Indigenous Studies Playlist,,Dr. Greg Cajete:  Rebuilding Sustainable Indigenous Communities....,https://www.youtube.com/watch?v=wg5h7Fd0Bio,Module 9: Indigenous Futurisms: Sustainability and Beyond,9
7386,Anthropology,Native American & Indigenous Studies Playlist,,Stephen Harrod Buhner on Plant Intelligence & The Imaginal Realm Part 2 /14 (Encore),https://www.youtube.com/watch?v=eKSU5J1OJHs,Module 9: Indigenous Futurisms: Sustainability and Beyond,9
7387,Anthropology,Native American & Indigenous Studies Playlist,,Tribal land management | Healing through Reclaiming land | Oregon Field Guide,https://www.youtube.com/watch?v=VpCW0m21L0A,Module 9: Indigenous Futurisms: Sustainability and Beyond,9
7388,Anthropology,Native American & Indigenous Studies Playlist,,"7 Georgina Stewart - Clip: Revisiting “What does 'indigenous' mean, for me?”",https://www.youtube.com/watch?v=dsWYm8YTiLw,Module 9: Indigenous Futurisms: Sustainability and Beyond,9
7389,Anthropology,Native American & Indigenous Studies Playlist,,"7 Georgina Stewart - Clip: Modernity, colonialism, science, and the hyphen",https://www.youtube.com/watch?v=D61lnoTxsi4,Module 9: Indigenous Futurisms: Sustainability and Beyond,9
7390,Anthropology,Native American & Indigenous Studies Playlist,,Georgina Stewart Interview 211102,https://www.youtube.com/watch?v=8o48s9nc5Rs,Module 9: Indigenous Futurisms: Sustainability and Beyond,9
7391,Anthropology,Native American & Indigenous Studies Playlist,,"Addressing Legacies of Colonialism in Science, an Asking Different Questions training",https://www.youtube.com/watch?v=DUiFRL9hPCI,Module 9: Indigenous Futurisms: Sustainability and Beyond,9
7392,Anthropology,Native American & Indigenous Studies Playlist,,"TEDxOkanaganCollege - Jeannette Armstrong, PhD - Indigenization",https://www.youtube.com/watch?v=jLOfXsFlb18,Module 9: Indigenous Futurisms: Sustainability and Beyond,9
7393,Anthropology,Native American & Indigenous Studies Playlist,,Nemonte Nenquimo - Waorani Song on Earth Day 2023,https://www.youtube.com/watch?v=uyXkczHjml0,Module 9: Indigenous Futurisms: Sustainability and Beyond,9
7394,Anthropology,Native American & Indigenous Studies Playlist,,Lyla June Johnston Music | Hedge School at The Trailblazery,https://www.youtube.com/watch?v=rO_d8rtfe6c,Module 9: Indigenous Futurisms: Sustainability and Beyond,9
7395,Anthropology,Native American & Indigenous Studies Playlist,,Diné Bina'nitin Dóó O'hoo'aah: Rekindling Ancestral Knowledge,https://www.youtube.com/watch?v=QTmGbo56ZJQ,Module 9: Indigenous Futurisms: Sustainability and Beyond,9
7396,Anthropology,Native American & Indigenous Studies Playlist,,Faces of Change: Lyla June,https://www.youtube.com/watch?v=5s7Wc8dv-GU,Module 9: Indigenous Futurisms: Sustainability and Beyond,9
7397,Anthropology,Native American & Indigenous Studies Playlist,,Lyla June Johnston Interview,https://www.youtube.com/watch?v=kwzkLNFBm48,Module 9: Indigenous Futurisms: Sustainability and Beyond,9
7398,Anthropology,Native American & Indigenous Studies Playlist,,Who Are The Sami?,https://www.youtube.com/watch?v=_6sQPJvGaO0,Module 9: Indigenous Futurisms: Sustainability and Beyond,9
7399,Anthropology,Native American & Indigenous Studies Playlist,,0 Sami singing joik,https://www.youtube.com/watch?v=Ae4o06KE_T4,Module 9: Indigenous Futurisms: Sustainability and Beyond,9
7400,Anthropology,Native American & Indigenous Studies Playlist,,Did The Polynesians Discover America?,https://www.youtube.com/watch?v=R913npL7Cg8,Module 9: Indigenous Futurisms: Sustainability and Beyond,9
7401,Anthropology,Native American & Indigenous Studies Playlist,,How trees talk to each other | Suzanne Simard,https://www.youtube.com/watch?v=Un2yBgIAxYs,Module 9: Indigenous Futurisms: Sustainability and Beyond,9
7402,Anthropology,Native American & Indigenous Studies Playlist,,Atossa Soltani: Keep the Oil in the Ground,https://www.youtube.com/watch?v=AhFOS8_P1Zc,Module 9: Indigenous Futurisms: Sustainability and Beyond,9
7403,Anthropology,Native American & Indigenous Studies Playlist,,Sacred Water Canoe Family  - Suquamish Drum Songs 2015,https://www.youtube.com/watch?v=Ynw63RXWzKs,Module 9: Indigenous Futurisms: Sustainability and Beyond,9
7404,Anthropology,Native American & Indigenous Studies Playlist,,Medicine Wheel,https://www.youtube.com/watch?v=khPZc_Acwz0,Module 9: Indigenous Futurisms: Sustainability and Beyond,9
7405,Anthropology,Native American & Indigenous Studies Playlist,,Medicine Wheel Teaching with Elder Elsey,https://www.youtube.com/watch?v=0cweuuLPKIc,Module 9: Indigenous Futurisms: Sustainability and Beyond,9
7406,Anthropology,Native American & Indigenous Studies Playlist,,2022 03 30 Webinar Series Medicine Wheel and Intro to Self Advocacy,https://www.youtube.com/watch?v=-t1GBGqKcLw,Module 9: Indigenous Futurisms: Sustainability and Beyond,9
7407,Anthropology,Native American & Indigenous Studies Playlist,,Circle of Life: What is the Aboriginal Worldview?,https://www.youtube.com/watch?v=zc-Enykb028,Module 9: Indigenous Futurisms: Sustainability and Beyond,9
7408,Anthropology,Native American & Indigenous Studies Playlist,,How to SMUDGE Your House 🏡(After MOVING in to a new home!),https://www.youtube.com/watch?v=QYrfyaa4dxw,Module 9: Indigenous Futurisms: Sustainability and Beyond,9
7409,Anthropology,Native American & Indigenous Studies Playlist,,Interview with Eduardo Duran 200614,https://www.youtube.com/watch?v=rKyrCC0VgMQ,Module 9: Indigenous Futurisms: Sustainability and Beyond,9
7410,Anthropology,Native American & Indigenous Studies Playlist,,"""Healing the Soul Wound"" with Dr. Eduardo Duran Conversation",https://www.youtube.com/watch?v=TKVTzJYyyRY,Module 9: Indigenous Futurisms: Sustainability and Beyond,9
7411,Anthropology,Native American & Indigenous Studies Playlist,,Pathways to Indigenous Equity: An Indigenous Lens on Health Systems Transformation & Research,https://www.youtube.com/watch?v=OwFDwjqdT4w,Module 9: Indigenous Futurisms: Sustainability and Beyond,9
7412,Anthropology,Native American & Indigenous Studies Playlist,,A conversation with Professor Linda Tuhiwai Smith,https://www.youtube.com/watch?v=vnAhKeZXmZk,Module 9: Indigenous Futurisms: Sustainability and Beyond,9
7413,Anthropology,Native American & Indigenous Studies Playlist,,Recognizing coloniality: A prerequisite to co-building a new eco-social world by Hilary N. Weaver,https://www.youtube.com/watch?v=iHhqv2RVQ4w,Module 9: Indigenous Futurisms: Sustainability and Beyond,9
7414,Anthropology,Native American & Indigenous Studies Playlist,,"Darcia Narvaez: ""The Indigenous Worldview: Original Practices for Becoming and Being Human",https://www.youtube.com/watch?v=wmQ3CkUkhuw,Module 9: Indigenous Futurisms: Sustainability and Beyond,9
7415,Anthropology,Native American & Indigenous Studies Playlist,,Indigenous activists on tackling the climate crisis: 'we have done more than any government',https://www.youtube.com/watch?v=Nm8Ctb2w81Y,Module 9: Indigenous Futurisms: Sustainability and Beyond,9
7416,Anthropology,Native American & Indigenous Studies Playlist,,What is a status card?,https://www.youtube.com/watch?v=3uP9b3FFz9s,Module 9: Indigenous Futurisms: Sustainability and Beyond,9
7417,Anthropology,Native American & Indigenous Studies Playlist,,Dino Gilio-Whitaker: Every square inch of the land on this continent was indigenous territory,https://www.youtube.com/watch?v=PPRVDwUPFO4,Module 9: Indigenous Futurisms: Sustainability and Beyond,9
7418,Anthropology,Native American & Indigenous Studies Playlist,,"Oregon, Indigenous Nations, Manifest Destiny, and the Doctrine of Discovery",https://www.youtube.com/watch?v=7BOuK-ztL_w,Module 9: Indigenous Futurisms: Sustainability and Beyond,9
7419,Anthropology,Native American & Indigenous Studies Playlist,,Land Back: Indigenous Perspectives | The Agenda,https://www.youtube.com/watch?v=pGscdzV6SfY,Module 9: Indigenous Futurisms: Sustainability and Beyond,9
7420,Anthropology,Native American & Indigenous Studies Playlist,,My Second Cup of Coffee: Vatican Repudiates the Doctrine of Discovery but seeks to limit the liab…,https://www.youtube.com/watch?v=Flony1HkrD4,Module 9: Indigenous Futurisms: Sustainability and Beyond,9
7421,Anthropology,Native American & Indigenous Studies Playlist,,Spreading the Seeds of Knowledge - Etuaptmumk - The Gift of Multiple Perspectives or Two-Eyed Seeing,https://www.youtube.com/watch?v=z7GoEnt5EIw,Module 9: Indigenous Futurisms: Sustainability and Beyond,9
7422,Anthropology,Native American & Indigenous Studies Playlist,,Mi’kmaq spiritual leader spreads love and compassion | WIDE,https://www.youtube.com/watch?v=f-oW3cc2ZX4,Module 9: Indigenous Futurisms: Sustainability and Beyond,9
7423,Anthropology,Native American & Indigenous Studies Playlist,,Talking Circle Ceremony Services at Sunrise Native Recovery | Sunrise Native Recovery,https://www.youtube.com/watch?v=LMuYpijklwA,Module 9: Indigenous Futurisms: Sustainability and Beyond,9
7424,Anthropology,Native American & Indigenous Studies Playlist,,Nipîy,https://www.youtube.com/watch?v=jA1Ze32PLxQ,Module 9: Indigenous Futurisms: Sustainability and Beyond,9
7425,Anthropology,Native American & Indigenous Studies Playlist,,PE2.0: Water Protectors [OFFICIAL],https://www.youtube.com/watch?v=iPWOgd2zXsc,Module 9: Indigenous Futurisms: Sustainability and Beyond,9
7426,Anthropology,Native American & Indigenous Studies Playlist,,Medicine Song # Ninawa Pai Da Mata and Txana Ikakuru - Huni Kuin - Kaxinawà,https://www.youtube.com/watch?v=VcqZDX7jqUs,Module 9: Indigenous Futurisms: Sustainability and Beyond,9
7427,Anthropology,Native American & Indigenous Studies Playlist,,#BNStorytime: Joy Harjo reads Remember,https://www.youtube.com/watch?v=U5FJ64I5wO4,Module 9: Indigenous Futurisms: Sustainability and Beyond,9
7428,Anthropology,Native American & Indigenous Studies Playlist,,J.NiCole Hatfield,https://www.youtube.com/watch?v=QN0aMW7-fq4,Module 9: Indigenous Futurisms: Sustainability and Beyond,9
7429,Anthropology,Native American & Indigenous Studies Playlist,,Giga-waasakonetamaagoowaag: An Ojibwe Metaphor,https://www.youtube.com/watch?v=J-P21DGnYk0,Module 9: Indigenous Futurisms: Sustainability and Beyond,9
7430,Anthropology,Native American & Indigenous Studies Playlist,,Creative Native - Nikau Hinden (Aute Maker),https://www.youtube.com/watch?v=QzSuyriCQ0w,Module 9: Indigenous Futurisms: Sustainability and Beyond,9
7431,Anthropology,Native American & Indigenous Studies Playlist,,Tai Timu - Nikau Hindin and Artspace Aotearoa,https://www.youtube.com/watch?v=wdnIpx6Czoo,Module 9: Indigenous Futurisms: Sustainability and Beyond,9
7432,Anthropology,Native American & Indigenous Studies Playlist,,Te Kuru Dewes on Toi Tū Toi Ora: Contemporary Māori Art,https://www.youtube.com/watch?v=_rViPLxvFMM,Module 9: Indigenous Futurisms: Sustainability and Beyond,9
7433,Anthropology,Native American & Indigenous Studies Playlist,,Lyla June Explains Indigenous Rights Issues Behind the Black Hills Unity Concert,https://www.youtube.com/watch?v=JDSkJmMo6JE,Module 9: Indigenous Futurisms: Sustainability and Beyond,9
7434,Anthropology,Native American & Indigenous Studies Playlist,,Alex Janvier: The Land,https://www.youtube.com/watch?v=PXUk2Iht1Gc,Module 9: Indigenous Futurisms: Sustainability and Beyond,9
7435,Anthropology,Native American & Indigenous Studies Playlist,,Morning Star by Alex Janvier unveiled,https://www.youtube.com/watch?v=oHwEFqhIREo,Module 9: Indigenous Futurisms: Sustainability and Beyond,9
7436,Anthropology,Native American & Indigenous Studies Playlist,,Alex Janvier: Meet the Curator,https://www.youtube.com/watch?v=Z1dYVQDTUE0,Module 9: Indigenous Futurisms: Sustainability and Beyond,9
7437,Anthropology,Native American & Indigenous Studies Playlist,,The Clan System,https://www.youtube.com/watch?v=0eOs-qIdqgo,Module 9: Indigenous Futurisms: Sustainability and Beyond,9
7438,Anthropology,Native American & Indigenous Studies Playlist,,Leah Dorion - On her art #2,https://www.youtube.com/watch?v=Nqz31o0i9S8,Module 9: Indigenous Futurisms: Sustainability and Beyond,9
7439,Anthropology,Native American & Indigenous Studies Playlist,,Artist Gregg Deal: Modern Indigenous,https://www.youtube.com/watch?v=bk1qlxy4zA0,Module 9: Indigenous Futurisms: Sustainability and Beyond,9
7440,Anthropology,Native American & Indigenous Studies Playlist,,Modern Indigenous Living with Gregg Deal - Live Performance at ASLD,https://www.youtube.com/watch?v=cZUYDAuuw2Y,Module 9: Indigenous Futurisms: Sustainability and Beyond,9
7441,Anthropology,Native American & Indigenous Studies Playlist,,Joy Harjo Teaches Poetic Thinking | Official Trailer | MasterClass,https://www.youtube.com/watch?v=cPgbx_dsngU,Module 9: Indigenous Futurisms: Sustainability and Beyond,9
7442,Anthropology,Native American & Indigenous Studies Playlist,,The power of art: Artivism and Witness Blanket: Preserving a Legacy,https://www.youtube.com/watch?v=2GOuiw4CjLg,Module 9: Indigenous Futurisms: Sustainability and Beyond,9
7443,Anthropology,Native American & Indigenous Studies Playlist,,Kent Monkman - mistikôsiwak (Wooden Boat People),https://www.youtube.com/watch?v=qQ20rvEdUAE,Module 9: Indigenous Futurisms: Sustainability and Beyond,9
7444,Anthropology,Native American & Indigenous Studies Playlist,,Artist Interview—Kent Monkman: mistikôsiwak (Wooden Boat People) | Met Exhibitions,https://www.youtube.com/watch?v=GwNpUevsKzc,Module 9: Indigenous Futurisms: Sustainability and Beyond,9
7445,Anthropology,Native American & Indigenous Studies Playlist,,Alex Janvier paints the vast landscape of Indigenous life,https://www.youtube.com/watch?v=3clUf6YEy_0,Module 9: Indigenous Futurisms: Sustainability and Beyond,9
7446,Anthropology,Native American & Indigenous Studies Playlist,,Counternarratives: Native American Artists In Our Own Words,https://www.youtube.com/watch?v=Y5JiqS_eAME,Module 9: Indigenous Futurisms: Sustainability and Beyond,9
7447,Anthropology,Native American & Indigenous Studies Playlist,,Denise Lajimodiere Stringing Rosaries,https://www.youtube.com/watch?v=OPR45z3yBPE,Module 9: Indigenous Futurisms: Sustainability and Beyond,9
7448,Anthropology,Native American & Indigenous Studies Playlist,,Walking With Our Sisters: Art Installation,https://www.youtube.com/watch?v=1V-4hnW79H0,Module 9: Indigenous Futurisms: Sustainability and Beyond,9
7449,Anthropology,Native American & Indigenous Studies Playlist,,“Prey” actor Amber Midthunder on why she doesn’t often pursue Indigenous roles. #shorts,https://www.youtube.com/watch?v=XNLrq9YBa4Y,Module 9: Indigenous Futurisms: Sustainability and Beyond,9
