Unnamed: 0,Sector,CourseName,Duration,TopicName,URL,Module,ModuleNo
8472,Anthropology,Native American & Indigenous Studies Playlist,,Origins of the horse nation,https://www.youtube.com/watch?v=HZRBpUm3Uzk,Module 9: Indigenous Futurisms: Sustainability and Beyond,9
8473,Anthropology,Native American & Indigenous Studies Playlist,,Decolonizing Methodologies for Sustainability Research Session 4 with Prof. Linda Tuhiwai Smith,https://www.youtube.com/watch?v=R1p8R_XQqqU,Module 9: Indigenous Futurisms: Sustainability and Beyond,9
8474,Anthropology,Native American & Indigenous Studies Playlist,,"Linda Smith, Kaupapa Maori Methodology, 2006",https://www.youtube.com/watch?v=OCc4Jp9hcSE,Module 9: Indigenous Futurisms: Sustainability and Beyond,9
8475,Anthropology,Native American & Indigenous Studies Playlist,,Decolonising Knowledge: How to Combine Ancient and Modern Knowledge | Jamie van Lede,https://www.youtube.com/watch?v=aTQEGm4R2zE,Module 9: Indigenous Futurisms: Sustainability and Beyond,9
8476,Anthropology,Native American & Indigenous Studies Playlist,,"Amber Midthunder interview Prey premiere, Predator, female lead, indigenous representation – London",https://www.youtube.com/watch?v=FLhyKt_58MQ,Module 9: Indigenous Futurisms: Sustainability and Beyond,9
8477,Anthropology,Native American & Indigenous Studies Playlist,,Storytelling in Indigenous Communities & its Role in Suicide Prevention with Dr. Lewis Mehl-Madrona,https://www.youtube.com/watch?v=4LWXX7o8c60,Module 9: Indigenous Futurisms: Sustainability and Beyond,9
8478,Anthropology,Native American & Indigenous Studies Playlist,,John Fetterman: Self-aware with Stephen Colbert,https://www.youtube.com/watch?v=9tAMoPDTsTM,Module 9: Indigenous Futurisms: Sustainability and Beyond,9
8479,Anthropology,Native American & Indigenous Studies Playlist,,Tanya Talaga: Indigenous Youth in Crisis | The Agenda,https://www.youtube.com/watch?v=0knWp8PyQo0,Module 9: Indigenous Futurisms: Sustainability and Beyond,9
8480,Anthropology,Native American & Indigenous Studies Playlist,,Blood Cobalt: The Congo's Dangerous and Deadly Green Energy Mines | Foreign Correspondent,https://www.youtube.com/watch?v=_V3bIzNX4co,Module 9: Indigenous Futurisms: Sustainability and Beyond,9
8481,Anthropology,Native American & Indigenous Studies Playlist,,The Disturbing Connection Between Your Phone And Violence In The Congo,https://www.youtube.com/watch?v=japfUdlcNvY,Module 9: Indigenous Futurisms: Sustainability and Beyond,9
8482,Anthropology,Native American & Indigenous Studies Playlist,,Race and Racialization,https://www.youtube.com/watch?v=itDbxCIXxy8,Module 9: Indigenous Futurisms: Sustainability and Beyond,9
8483,Anthropology,Native American & Indigenous Studies Playlist,,The History of Race and Racialization,https://www.youtube.com/watch?v=i1GjU01AMjE,Module 9: Indigenous Futurisms: Sustainability and Beyond,9
8484,Anthropology,Native American & Indigenous Studies Playlist,,How Structural Racism Works,https://www.youtube.com/watch?v=X3KsVRkbnn4,Module 9: Indigenous Futurisms: Sustainability and Beyond,9
8485,Anthropology,Native American & Indigenous Studies Playlist,,How Systemic Racism Works with Tricia Rose | Embrace Ambition Summit,https://www.youtube.com/watch?v=XgOzDfFmjfs,Module 9: Indigenous Futurisms: Sustainability and Beyond,9
8486,Anthropology,Native American & Indigenous Studies Playlist,,FAIR Perspectives Ep. 31 - How To End Racialization w/ Dr. Carlos Hoyt,https://www.youtube.com/watch?v=I6sQ9iy11-0,Module 9: Indigenous Futurisms: Sustainability and Beyond,9
8487,Anthropology,Native American & Indigenous Studies Playlist,,Angela Davis: We can't eradicate racism without eradicating racial capitalism,https://www.youtube.com/watch?v=qhh3CMkngkY,Module 9: Indigenous Futurisms: Sustainability and Beyond,9
8488,Anthropology,Native American & Indigenous Studies Playlist,,Ecuador's Waorani tribe vows to protect life in Amazon,https://www.youtube.com/watch?v=--3iZVDxs3E,Module 9: Indigenous Futurisms: Sustainability and Beyond,9
8489,Anthropology,Native American & Indigenous Studies Playlist,,This is what Native Americans want you to know,https://www.youtube.com/watch?v=b3XUEpaENQk,Module 9: Indigenous Futurisms: Sustainability and Beyond,9
8490,Anthropology,Native American & Indigenous Studies Playlist,,Why don t Native Americans celebrate the 4th of July?,https://www.youtube.com/watch?v=ruDe602I_H4,Module 9: Indigenous Futurisms: Sustainability and Beyond,9
8491,Anthropology,Native American & Indigenous Studies Playlist,,Professor Linda T. Smith – Decolonial Research Methods webinar series,https://www.youtube.com/watch?v=EFQ09rPQFyA,Module 9: Indigenous Futurisms: Sustainability and Beyond,9
8492,Anthropology,Native American & Indigenous Studies Playlist,,171018 Georgina Stewart mock media training interview,https://www.youtube.com/watch?v=VaoBP05wQu4,Module 9: Indigenous Futurisms: Sustainability and Beyond,9
8493,Anthropology,Native American & Indigenous Studies Playlist,,Nationality vs. Ethnicity vs. Race...What's the difference?!,https://www.youtube.com/watch?v=MLeskBwmSPs,Module 9: Indigenous Futurisms: Sustainability and Beyond,9
8494,Anthropology,Native American & Indigenous Studies Playlist,,"Exploring Race, Ethnicity and Nationality",https://www.youtube.com/watch?v=vZXmOnO8v7A,Module 9: Indigenous Futurisms: Sustainability and Beyond,9
8495,Anthropology,Native American & Indigenous Studies Playlist,,What is Ethnicity?,https://www.youtube.com/watch?v=E1AY95Z64gg,Module 9: Indigenous Futurisms: Sustainability and Beyond,9
8496,Anthropology,Native American & Indigenous Studies Playlist,,Dr. Jo-ann Archibald - The Many Facets of Decolonizing and Indigenizing the Academy,https://www.youtube.com/watch?v=bYpSiCCdocM,Module 9: Indigenous Futurisms: Sustainability and Beyond,9
8497,Anthropology,Native American & Indigenous Studies Playlist,,Polynesian Contact with the Americas: An Update,https://www.youtube.com/watch?v=7p-78VRl0fs,Module 9: Indigenous Futurisms: Sustainability and Beyond,9
8498,Anthropology,Native American & Indigenous Studies Playlist,,Tikanga Rangahau Webinar Series - Kaupapa Māori Theory,https://www.youtube.com/watch?v=4t54ZQF_nkY,Module 9: Indigenous Futurisms: Sustainability and Beyond,9
8499,Anthropology,Native American & Indigenous Studies Playlist,,Amber Midthunder on ‘The Ice Road’ and Her Thoughts on the ‘Legion’ Series Finale,https://www.youtube.com/watch?v=0evk_gBxZ9k,Module 9: Indigenous Futurisms: Sustainability and Beyond,9
8500,Anthropology,Native American & Indigenous Studies Playlist,,"If Mexican isn't a Race, then what Race are they? Race of Hispanics and Latinos",https://www.youtube.com/watch?v=HOSPD4K1ymg,Module 9: Indigenous Futurisms: Sustainability and Beyond,9
8501,Anthropology,Native American & Indigenous Studies Playlist,,Ethical Data Science with Cathy O'Neil #datascience #uva #podcast,https://www.youtube.com/watch?v=UtCWcMdZA5g,Module 9: Indigenous Futurisms: Sustainability and Beyond,9
8502,Anthropology,Native American & Indigenous Studies Playlist,,Shame and power in the age of humiliation | RSA REPLAY,https://www.youtube.com/watch?v=MDb8cBhCk9c,Module 9: Indigenous Futurisms: Sustainability and Beyond,9
8503,Anthropology,Native American & Indigenous Studies Playlist,,The Condemnation of Blackness,https://www.youtube.com/watch?v=1z_A1ediUWY,Module 9: Indigenous Futurisms: Sustainability and Beyond,9
8504,Anthropology,Native American & Indigenous Studies Playlist,,Khalil Gibran Muhammad: The Condemnation of Blackness,https://www.youtube.com/watch?v=IChWMj1dq28,Module 9: Indigenous Futurisms: Sustainability and Beyond,9
8505,Anthropology,Native American & Indigenous Studies Playlist,,"DHRC Annual MLK, Jr. Lecture. ""The Condemnation of Blackness: Race, Crime, and Modern Urban America""",https://www.youtube.com/watch?v=BTLOUQZaFfg,Module 9: Indigenous Futurisms: Sustainability and Beyond,9
8506,Anthropology,Native American & Indigenous Studies Playlist,,"The Condemnation of Blackness: Race, Crime, and the Making of Modern Urban America",https://www.youtube.com/watch?v=Qr-jT22PReE,Module 9: Indigenous Futurisms: Sustainability and Beyond,9
8507,Anthropology,Native American & Indigenous Studies Playlist,,"Khalil Gibran Muhammad   ""The Condemnation of Blackness"" w/ Rhinold Lamar Ponder at Princeton",https://www.youtube.com/watch?v=eaZ6idumCkQ,Module 9: Indigenous Futurisms: Sustainability and Beyond,9
8508,Anthropology,Native American & Indigenous Studies Playlist,,From slavery to George Floyd: The racist history of U.S. policing,https://www.youtube.com/watch?v=F1vr4eg37L0,Module 9: Indigenous Futurisms: Sustainability and Beyond,9
8509,Anthropology,Native American & Indigenous Studies Playlist,,The History of New Zealand,https://www.youtube.com/watch?v=wOhCI5m2jEY,Module 9: Indigenous Futurisms: Sustainability and Beyond,9
8510,Anthropology,Native American & Indigenous Studies Playlist,,New generation of Māori politicians set to enter Parliament | 1News Election 2023,https://www.youtube.com/watch?v=xHN5vWPwJtU,Module 9: Indigenous Futurisms: Sustainability and Beyond,9
8511,Anthropology,Native American & Indigenous Studies Playlist,,Indigenous youth are six times more likely to die from suicide | APTN News,https://www.youtube.com/watch?v=u4RRL-2ounQ,Module 9: Indigenous Futurisms: Sustainability and Beyond,9
8512,Anthropology,Native American & Indigenous Studies Playlist,,Wicahpi Oyate: The Star Knowledge of the Lakotas,https://www.youtube.com/watch?v=zHBhlz3Dfoo,Module 9: Indigenous Futurisms: Sustainability and Beyond,9
8513,Anthropology,Native American & Indigenous Studies Playlist,,John Carpenter what The Thing is about,https://www.youtube.com/watch?v=O8ZTmYGeE58,Module 9: Indigenous Futurisms: Sustainability and Beyond,9
8514,Anthropology,Native American & Indigenous Studies Playlist,,Native Language as Prevention,https://www.youtube.com/watch?v=4PmUHIdHzKQ,Module 9: Indigenous Futurisms: Sustainability and Beyond,9
8515,Anthropology,Native American & Indigenous Studies Playlist,,Dealing with Shame Culture as a Queer Indian Immigrant - Kevin’s Corner,https://www.youtube.com/watch?v=omVl063o2ZM,Module 9: Indigenous Futurisms: Sustainability and Beyond,9
8516,Anthropology,Native American & Indigenous Studies Playlist,,"""T'ŁALIS – Pushing Boundaries"" Exhibition featuring Trevor Hunt | Spirits of the West Coast",https://www.youtube.com/watch?v=nS65gLhiSfM,Module 9: Indigenous Futurisms: Sustainability and Beyond,9
8517,Anthropology,Native American & Indigenous Studies Playlist,,4 signs of emotional abuse - Viann Nguyen-Feng,https://www.youtube.com/watch?v=x2Q_kYyCH9Q,Module 9: Indigenous Futurisms: Sustainability and Beyond,9
8518,Anthropology,Native American & Indigenous Studies Playlist,,"Shame and Self-Loathing in the Treatment of Trauma with Janina Fisher, Ph.D.",https://www.youtube.com/watch?v=p-0czfPH0rA,Module 9: Indigenous Futurisms: Sustainability and Beyond,9
8519,Anthropology,Native American & Indigenous Studies Playlist,,What Do Tribal Governments Do?,https://www.youtube.com/watch?v=b37DnbUwK1I,Module 9: Indigenous Futurisms: Sustainability and Beyond,9
8520,Anthropology,Native American & Indigenous Studies Playlist,,I'm not afraid. You're afraid | Tristan Harris | Nobel Prize Summit 2023,https://www.youtube.com/watch?v=6lVBp2XjWsg,Module 9: Indigenous Futurisms: Sustainability and Beyond,9
8521,Anthropology,Native American & Indigenous Studies Playlist,,"How Your Brain Is Getting Hacked: Facebook, Tinder, Slot Machines | Tristan Harris | Big Think",https://www.youtube.com/watch?v=JgkvTRz_Alo,Module 9: Indigenous Futurisms: Sustainability and Beyond,9
8522,Anthropology,Native American & Indigenous Studies Playlist,,3.1 Whanaungatanga With Mei Winitana,https://www.youtube.com/watch?v=Mxtj6_Kq1Bk,Module 9: Indigenous Futurisms: Sustainability and Beyond,9
8523,Anthropology,Native American & Indigenous Studies Playlist,,1.2 What is Tapatoru?,https://www.youtube.com/watch?v=GxEsQR2MvBI,Module 9: Indigenous Futurisms: Sustainability and Beyond,9
8524,Anthropology,Native American & Indigenous Studies Playlist,,Human Mask by Potlatch Carver Junior Henderson | Northwest Coast Art,https://www.youtube.com/watch?v=axlAilsXbOk,Module 9: Indigenous Futurisms: Sustainability and Beyond,9
8525,Anthropology,Native American & Indigenous Studies Playlist,,Tātai Kōrero – whakapapa,https://www.youtube.com/watch?v=YrBS1AMDN7c,Module 9: Indigenous Futurisms: Sustainability and Beyond,9
8526,Anthropology,Native American & Indigenous Studies Playlist,,How do we use Mātauranga Māori?,https://www.youtube.com/watch?v=Hou6i3weKOE,Module 9: Indigenous Futurisms: Sustainability and Beyond,9
8527,Anthropology,Native American & Indigenous Studies Playlist,,Being a great pāpā even with Christmas stresses,https://www.youtube.com/watch?v=ejzoip2e_W0,Module 9: Indigenous Futurisms: Sustainability and Beyond,9
8528,Anthropology,Native American & Indigenous Studies Playlist,,Structural Racism Explained,https://www.youtube.com/watch?v=lQ_8eOaiz8o,Module 9: Indigenous Futurisms: Sustainability and Beyond,9
8529,Anthropology,Native American & Indigenous Studies Playlist,,"He Reo Tawhito, a conversation with Dr Te Ahukaramū Charles Royal",https://www.youtube.com/watch?v=AA_6QqGXdbY,Module 9: Indigenous Futurisms: Sustainability and Beyond,9
8530,Anthropology,Native American & Indigenous Studies Playlist,,Manitoba premier-elect Wab Kinew swearing-in ceremony | APTN News,https://www.youtube.com/watch?v=gQ5JSKu0rCg,Module 9: Indigenous Futurisms: Sustainability and Beyond,9
8531,Anthropology,Native American & Indigenous Studies Playlist,,Maori Marsden: Taha Wairua,https://www.youtube.com/watch?v=h6R3iNfqsxo,Module 9: Indigenous Futurisms: Sustainability and Beyond,9
8532,Anthropology,Native American & Indigenous Studies Playlist,,Maori Ways of Healing by Donna Kerridge,https://www.youtube.com/watch?v=7UzJ2VlL8Cg,Module 9: Indigenous Futurisms: Sustainability and Beyond,9
8533,Anthropology,Native American & Indigenous Studies Playlist,,The resurgence of Rongoā Māori healing,https://www.youtube.com/watch?v=kyev9Ujct08,Module 9: Indigenous Futurisms: Sustainability and Beyond,9
8534,Anthropology,Native American & Indigenous Studies Playlist,,Communicating with Māori in a health setting,https://www.youtube.com/watch?v=ocNhA_DMd1A,Module 9: Indigenous Futurisms: Sustainability and Beyond,9
8535,Anthropology,Native American & Indigenous Studies Playlist,,Rongoā Māori: finding medicine in the bush,https://www.youtube.com/watch?v=F4C5A7hIXOw,Module 9: Indigenous Futurisms: Sustainability and Beyond,9
8536,Anthropology,Native American & Indigenous Studies Playlist,,Tikanga and Maramataka Professor Leonie Pihama,https://www.youtube.com/watch?v=2IG_nh1-2Zo,Module 9: Indigenous Futurisms: Sustainability and Beyond,9
8537,Anthropology,Native American & Indigenous Studies Playlist,,Rongoā i te ngahere - Healing in the forest I Auckland Council,https://www.youtube.com/watch?v=caUEUoofb-U,Module 9: Indigenous Futurisms: Sustainability and Beyond,9
8538,Anthropology,Native American & Indigenous Studies Playlist,,Sheila North on her open letter for Canada to recognize its human rights obligations | APTN News,https://www.youtube.com/watch?v=coRduWDjaUU,Module 9: Indigenous Futurisms: Sustainability and Beyond,9
8539,Anthropology,Native American & Indigenous Studies Playlist,,Healing with Tutu: Rongoā Māori,https://www.youtube.com/watch?v=UTkDFFMigIc,Module 9: Indigenous Futurisms: Sustainability and Beyond,9
8540,Anthropology,Native American & Indigenous Studies Playlist,,Sound and energy healing with Ngaronoa and Komako | Mānawa Maiea te Atawhai | Ep 9,https://www.youtube.com/watch?v=RfItTBVSGos,Module 9: Indigenous Futurisms: Sustainability and Beyond,9
8541,Anthropology,Native American & Indigenous Studies Playlist,,How Tikanga Informed Care is Trauma Informed Power to Protect Webinar 2022,https://www.youtube.com/watch?v=aow8uyDOjqw,Module 9: Indigenous Futurisms: Sustainability and Beyond,9
8542,Anthropology,Native American & Indigenous Studies Playlist,,"Toi Ako Webinar| Te hōkai nuku, te hōkai rangi: Rongoā Māori, traditional birthing & quantum physics",https://www.youtube.com/watch?v=aJ85ezkl2ho,Module 9: Indigenous Futurisms: Sustainability and Beyond,9
8543,Anthropology,Native American & Indigenous Studies Playlist,,Te Karakia O Te Atua (The Lord's Prayer) - Te Wiki o te Reo Māori 2022,https://www.youtube.com/watch?v=koNwV9UGfbU,Module 9: Indigenous Futurisms: Sustainability and Beyond,9
8544,Anthropology,Native American & Indigenous Studies Playlist,,Opening Karakia,https://www.youtube.com/watch?v=wWbbkix--uU,Module 9: Indigenous Futurisms: Sustainability and Beyond,9
8545,Anthropology,Native American & Indigenous Studies Playlist,,Mana Tangata - Matariki Kōrero: Karakia,https://www.youtube.com/watch?v=bi1aDpP-Pr4,Module 9: Indigenous Futurisms: Sustainability and Beyond,9
8546,Anthropology,Native American & Indigenous Studies Playlist,,Māori Calendar Song - Lyrics Video - Waiata Māori Song,https://www.youtube.com/watch?v=DUdSBjx8_lY,Module 9: Indigenous Futurisms: Sustainability and Beyond,9
8547,Anthropology,Native American & Indigenous Studies Playlist,,Leonie Pihama: He Waipuna Koropupū - A kaupapa Māori response to epistemic violence,https://www.youtube.com/watch?v=bnc9dtG3qaY,Module 9: Indigenous Futurisms: Sustainability and Beyond,9
8548,Anthropology,Native American & Indigenous Studies Playlist,,Indigenous 100 - Episode 25 - Dr Leonie Pihama,https://www.youtube.com/watch?v=NRlgZozSAOM,Module 9: Indigenous Futurisms: Sustainability and Beyond,9
8549,Anthropology,Native American & Indigenous Studies Playlist,,Te Kōkōmuka Episode 14 - Te Mana o te Mātauranga,https://www.youtube.com/watch?v=OWhPb7enl9o,Module 9: Indigenous Futurisms: Sustainability and Beyond,9
8550,Anthropology,Native American & Indigenous Studies Playlist,,"Dr Leonie Pihama, Associate Professor and leading kaupapa Māori Educator and Researcher",https://www.youtube.com/watch?v=DfVl06fH2Kc,Module 9: Indigenous Futurisms: Sustainability and Beyond,9
8551,Anthropology,Native American & Indigenous Studies Playlist,,Lakota Language & Culture Lesson - Ben Black Bear Jr. Explains the Rabbit Dance Song: Íŋkpata,https://www.youtube.com/watch?v=IFENZsi0vJA,Module 9: Indigenous Futurisms: Sustainability and Beyond,9
8552,Anthropology,Native American & Indigenous Studies Playlist,,24 Hours With Rita Ora and Taika Waititi | Vogue,https://www.youtube.com/watch?v=JwvWLYWzJvY,Module 9: Indigenous Futurisms: Sustainability and Beyond,9
8553,Anthropology,Native American & Indigenous Studies Playlist,,Te Atua,https://www.youtube.com/watch?v=oRw012HQyBk,Module 9: Indigenous Futurisms: Sustainability and Beyond,9
8554,Anthropology,Native American & Indigenous Studies Playlist,,Leonie Pihama,https://www.youtube.com/watch?v=1yczjxHzzaE,Module 9: Indigenous Futurisms: Sustainability and Beyond,9
8555,Anthropology,Native American & Indigenous Studies Playlist,,Wāhine Panel - The Power in Our Truth,https://www.youtube.com/watch?v=Hyaj37hg_F8,Module 9: Indigenous Futurisms: Sustainability and Beyond,9
8556,Anthropology,Native American & Indigenous Studies Playlist,,Rangatahi Panel - The Power in Our Truth,https://www.youtube.com/watch?v=Fu6OcWyXTbc,Module 9: Indigenous Futurisms: Sustainability and Beyond,9
8557,Anthropology,Native American & Indigenous Studies Playlist,,Shirley Simmonds 1,https://www.youtube.com/watch?v=CEO3xglvpGk,Module 9: Indigenous Futurisms: Sustainability and Beyond,9
8558,Anthropology,Native American & Indigenous Studies Playlist,,There is no one way for Indigenous education: Reflections on the Māori experience,https://www.youtube.com/watch?v=7MaFf4Bgufk,Module 9: Indigenous Futurisms: Sustainability and Beyond,9
8559,Anthropology,Native American & Indigenous Studies Playlist,,Tristan Harris and Liv Boeree talk Game Theory: The Driving Force Behind Humanity’s Biggest Issues,https://www.youtube.com/watch?v=wFp9IktzHfg,Module 9: Indigenous Futurisms: Sustainability and Beyond,9
8560,Anthropology,Native American & Indigenous Studies Playlist,,From Quito: THE WAORANI PEOPLE AGAINST OIL-DRILLING,https://www.youtube.com/watch?v=nPR6eCG2ZIc,Module 9: Indigenous Futurisms: Sustainability and Beyond,9
8561,Anthropology,Native American & Indigenous Studies Playlist,,The Origin of Race in the USA,https://www.youtube.com/watch?v=CVxAlmAPHec,Module 9: Indigenous Futurisms: Sustainability and Beyond,9
8562,Anthropology,Native American & Indigenous Studies Playlist,,"The Connection Between Whites and Asians? Genetics of the Sami, Ainu and Siberian Peopels",https://www.youtube.com/watch?v=aXzqI1r11eg,Module 9: Indigenous Futurisms: Sustainability and Beyond,9
8563,Anthropology,Native American & Indigenous Studies Playlist,,The Waorani Indians and the story of Kaigo's demise,https://www.youtube.com/watch?v=xvNTzGt83Fc,Module 9: Indigenous Futurisms: Sustainability and Beyond,9
8564,Anthropology,Native American & Indigenous Studies Playlist,,Why People get into Unhealthy Relationships,https://www.youtube.com/watch?v=tcOVPra6GW4,Module 9: Indigenous Futurisms: Sustainability and Beyond,9
8565,Anthropology,Native American & Indigenous Studies Playlist,,Our journey to learn more of the maramataka (maori lunar calender),https://www.youtube.com/watch?v=2QNhEAQjjjo,Module 9: Indigenous Futurisms: Sustainability and Beyond,9
8566,Anthropology,Native American & Indigenous Studies Playlist,,Waiata - Ngā marama o te tau Māori,https://www.youtube.com/watch?v=XU5nBSvxHds,Module 9: Indigenous Futurisms: Sustainability and Beyond,9
8567,Anthropology,Native American & Indigenous Studies Playlist,,Honouring the Voices of Elders: Indigenous Perspectives of Disability in Education,https://www.youtube.com/watch?v=88-jr9Sypmk,Module 9: Indigenous Futurisms: Sustainability and Beyond,9
8568,Anthropology,Native American & Indigenous Studies Playlist,,Racial Capitalism,https://www.youtube.com/watch?v=ZZSBT67IHXo,Module 9: Indigenous Futurisms: Sustainability and Beyond,9
8569,Anthropology,Native American & Indigenous Studies Playlist,,Maramataka: using the lunar calendar to connect to te ao Māori,https://www.youtube.com/watch?v=CGhNt6CCJBc,Module 9: Indigenous Futurisms: Sustainability and Beyond,9
8570,Anthropology,Native American & Indigenous Studies Playlist,,Moerangi explains the whakapapa and background  the six Māori values of E Tū Whānau.,https://www.youtube.com/watch?v=MBhTCN81MS0,Module 9: Indigenous Futurisms: Sustainability and Beyond,9
8571,Anthropology,Native American & Indigenous Studies Playlist,,A young tā moko apprentice on why she’s learning the art of her ancestors,https://www.youtube.com/watch?v=x2lM7WNebZc,Module 9: Indigenous Futurisms: Sustainability and Beyond,9
8572,Anthropology,Native American & Indigenous Studies Playlist,,Session 2: Restoring the mauri - physical environment - CHSH Conference 2023,https://www.youtube.com/watch?v=sd4aXuVgGiM,Module 9: Indigenous Futurisms: Sustainability and Beyond,9
8573,Anthropology,Native American & Indigenous Studies Playlist,,A look into the mahi of Rongoā Māori practitioners,https://www.youtube.com/watch?v=Zn9OKPVtDsQ,Module 9: Indigenous Futurisms: Sustainability and Beyond,9
8574,Anthropology,Native American & Indigenous Studies Playlist,,Taonga Pūoro - Voice Of The Elements,https://www.youtube.com/watch?v=_SBbNtx1cew,Module 9: Indigenous Futurisms: Sustainability and Beyond,9
8575,Anthropology,Native American & Indigenous Studies Playlist,,Richard Nunns uses Maori music therapy to overcome his battle with Parkinsons,https://www.youtube.com/watch?v=6e6sFru4EUs,Module 9: Indigenous Futurisms: Sustainability and Beyond,9
8576,Anthropology,Native American & Indigenous Studies Playlist,,"Taonga puoro were almost lost, now these wāhine are taking the revival to a new generation",https://www.youtube.com/watch?v=4kwwYQLA8ro,Module 9: Indigenous Futurisms: Sustainability and Beyond,9
8577,Anthropology,Native American & Indigenous Studies Playlist,,Theme: Whanaungatanga #1,https://www.youtube.com/watch?v=NClSpA47-j0,Module 9: Indigenous Futurisms: Sustainability and Beyond,9
8578,Anthropology,Native American & Indigenous Studies Playlist,,Theme: Whanaungatanga #2,https://www.youtube.com/watch?v=G-SxmXjtg1M,Module 9: Indigenous Futurisms: Sustainability and Beyond,9
8579,Anthropology,Native American & Indigenous Studies Playlist,,"The Fundamentals, New Zealand • Te Iwi E by Pariare Tomoana",https://www.youtube.com/watch?v=O19YHa7Xahk,Module 9: Indigenous Futurisms: Sustainability and Beyond,9
8580,Anthropology,Native American & Indigenous Studies Playlist,,"Colonial Mentality, Imperialism & Conformity: My Interview (Edited) by Fazeel Chauhan @GLOBALzebra",https://www.youtube.com/watch?v=qkax0Y_vaHI,Module 9: Indigenous Futurisms: Sustainability and Beyond,9
8581,Anthropology,Native American & Indigenous Studies Playlist,,Te Reo Māori Karakia For Eating,https://www.youtube.com/watch?v=ZH09J__B-Qs,Module 9: Indigenous Futurisms: Sustainability and Beyond,9
8582,Anthropology,Native American & Indigenous Studies Playlist,,Supporting whānau to connect with mātauranga Māori | Tākai Kōrero,https://www.youtube.com/watch?v=l3D0aQU61zo,Module 9: Indigenous Futurisms: Sustainability and Beyond,9
8583,Anthropology,Native American & Indigenous Studies Playlist,,"Recognizing and Treating Moral Injury - with Bill Nash, MD",https://www.youtube.com/watch?v=7hOnv0HANTQ,Module 9: Indigenous Futurisms: Sustainability and Beyond,9
8584,Anthropology,Native American & Indigenous Studies Playlist,,Hidden Wounds of War: Dr. Bill Nash - Preventing and Healing Combat and Occupational Stress Injuries,https://www.youtube.com/watch?v=de7t_MwNdP0,Module 9: Indigenous Futurisms: Sustainability and Beyond,9
