Unnamed: 0,Sector,CourseName,Duration,TopicName,URL,Module,ModuleNo
7682,Anthropology,Native American & Indigenous Studies Playlist,,Daniel Schmachtenberger on Emergence (Midjourney),https://www.youtube.com/watch?v=cvGQ94B4enU,Module 9: Indigenous Futurisms: Sustainability and Beyond,9
7683,Anthropology,Native American & Indigenous Studies Playlist,,The house of modernity,https://www.youtube.com/watch?v=nAke2iQ53jc,Module 9: Indigenous Futurisms: Sustainability and Beyond,9
7684,Anthropology,Native American & Indigenous Studies Playlist,,Dr. Gregory Cajete: Indigenous Knowledge and Western Science,https://www.youtube.com/watch?v=J_-icsscsD4,Module 9: Indigenous Futurisms: Sustainability and Beyond,9
7685,Anthropology,Native American & Indigenous Studies Playlist,,Decolonizing mindfulness​ with Dr Michael Yellow Bird,https://www.youtube.com/watch?v=_w2hxzDqANI,Module 9: Indigenous Futurisms: Sustainability and Beyond,9
7686,Anthropology,Native American & Indigenous Studies Playlist,,Gesturing towards decolonial futures by Professor Vanessa Andreotti,https://www.youtube.com/watch?v=ELvily7PGZY,Module 9: Indigenous Futurisms: Sustainability and Beyond,9
7687,Anthropology,Native American & Indigenous Studies Playlist,,EP.11 Vanessa Andreotti: The World as a Living Metabolism,https://www.youtube.com/watch?v=N7MX1UBUS1M,Module 9: Indigenous Futurisms: Sustainability and Beyond,9
7688,Anthropology,Native American & Indigenous Studies Playlist,,"Stephen Jenkinson | Covid Tribalism, the Role of Art, and Reading the Cultural Landscape",https://www.youtube.com/watch?v=CT4mJ3kc8Bk,Module 9: Indigenous Futurisms: Sustainability and Beyond,9
7689,Anthropology,Native American & Indigenous Studies Playlist,,What is Indigeneity? with Janene Yazzie,https://www.youtube.com/watch?v=DKYPeiipl-I,Module 9: Indigenous Futurisms: Sustainability and Beyond,9
7690,Anthropology,Native American & Indigenous Studies Playlist,,Project 562: Changing the Way We See Native America | Amanpour and Company,https://www.youtube.com/watch?v=Ka8iAhp6LYA,Module 9: Indigenous Futurisms: Sustainability and Beyond,9
7691,Anthropology,Native American & Indigenous Studies Playlist,,Transforming the Criminal Justice System: Indigenous Over-representation - Jorgina,https://www.youtube.com/watch?v=y7BiE1xIoWM,Module 9: Indigenous Futurisms: Sustainability and Beyond,9
7692,Anthropology,Native American & Indigenous Studies Playlist,,Native American Activists Occupy Alcatraz - Drunk History,https://www.youtube.com/watch?v=6Dx0mA6htVc,Module 9: Indigenous Futurisms: Sustainability and Beyond,9
7693,Anthropology,Native American & Indigenous Studies Playlist,,Doctrine of Discovery,https://www.youtube.com/watch?v=V3gF7ULVrl4,Module 9: Indigenous Futurisms: Sustainability and Beyond,9
7694,Anthropology,Native American & Indigenous Studies Playlist,,Sen. Murray Sinclair: How can Canadians work toward reconciliation,https://www.youtube.com/watch?v=j2Lv21Ktz84,Module 9: Indigenous Futurisms: Sustainability and Beyond,9
7695,Anthropology,Native American & Indigenous Studies Playlist,,Senator Murray Sinclair responds to Lynn Beyak's residential school remarks,https://www.youtube.com/watch?v=BVjHGNreBkU,Module 9: Indigenous Futurisms: Sustainability and Beyond,9
7696,Anthropology,Native American & Indigenous Studies Playlist,,Indian Horse: Canadian film connects hockey and Indigenous issues,https://www.youtube.com/watch?v=05rXdRi6pkc,Module 9: Indigenous Futurisms: Sustainability and Beyond,9
7697,Anthropology,Native American & Indigenous Studies Playlist,,Colonization,https://www.youtube.com/watch?v=SVoAre8wIoc,Module 9: Indigenous Futurisms: Sustainability and Beyond,9
7698,Anthropology,Native American & Indigenous Studies Playlist,,Wab Kinew Trauma of Residential Schools Clip,https://www.youtube.com/watch?v=bk5jlaRvTMo,Module 9: Indigenous Futurisms: Sustainability and Beyond,9
7699,Anthropology,Native American & Indigenous Studies Playlist,,The Government Plot To Erase Native Languages,https://www.youtube.com/watch?v=2GDCpD-3CT4,Module 9: Indigenous Futurisms: Sustainability and Beyond,9
7700,Anthropology,Native American & Indigenous Studies Playlist,,What term is most appropriate for referring to Native Americans?,https://www.youtube.com/watch?v=YQ3tpi20ZtU,Module 9: Indigenous Futurisms: Sustainability and Beyond,9
7701,Anthropology,Native American & Indigenous Studies Playlist,,We asked Ellen Gabriel: What does reconciliation mean to you?,https://www.youtube.com/watch?v=bknszmUIukI,Module 9: Indigenous Futurisms: Sustainability and Beyond,9
7702,Anthropology,Native American & Indigenous Studies Playlist,,We asked Ellen Gabriel: Has your understanding of reconciliation changed over the years?,https://www.youtube.com/watch?v=1WATQsl2PFQ,Module 9: Indigenous Futurisms: Sustainability and Beyond,9
7703,Anthropology,Native American & Indigenous Studies Playlist,,Ellen Gabriel talks to the Rise up! Conference about Native Issues,https://www.youtube.com/watch?v=1iX1JFgjGXg,Module 9: Indigenous Futurisms: Sustainability and Beyond,9
7704,Anthropology,Native American & Indigenous Studies Playlist,,"From Standing Rock to the Red Power Movement: New Series ""RISE"" Focuses on Indigenous Resistance",https://www.youtube.com/watch?v=JGoeT6izuJI,Module 9: Indigenous Futurisms: Sustainability and Beyond,9
7705,Anthropology,Native American & Indigenous Studies Playlist,,An easy way to make amazing life decisions,https://www.youtube.com/watch?v=BsBR9WlFGkk,Module 9: Indigenous Futurisms: Sustainability and Beyond,9
7706,Anthropology,Native American & Indigenous Studies Playlist,,Mohawk filmmaker on Quebec’s Oka Crisis,https://www.youtube.com/watch?v=DsKF3Lxkg_4,Module 9: Indigenous Futurisms: Sustainability and Beyond,9
7707,Anthropology,Native American & Indigenous Studies Playlist,,Killers of the Flower Moon | Official Teaser Trailer | Paramount Pictures Australia,https://www.youtube.com/watch?v=IZxCJa3sUFo,Module 9: Indigenous Futurisms: Sustainability and Beyond,9
7708,Anthropology,Native American & Indigenous Studies Playlist,,Killers of the Flower Moon Trailer REACTION | More Thoughts,https://www.youtube.com/watch?v=acZfl2gQPOo,Module 9: Indigenous Futurisms: Sustainability and Beyond,9
7709,Anthropology,Native American & Indigenous Studies Playlist,,Osage Murders | 2022 PBS Short Film Festival,https://www.youtube.com/watch?v=C5OiFBNlYkY,Module 9: Indigenous Futurisms: Sustainability and Beyond,9
7710,Anthropology,Native American & Indigenous Studies Playlist,,How Indigenous creators are changing Hollywood and pop culture l GMA,https://www.youtube.com/watch?v=bJvtKwasVns,Module 9: Indigenous Futurisms: Sustainability and Beyond,9
7711,Anthropology,Native American & Indigenous Studies Playlist,,Amber Midthunder ('Prey'): Portraying a Comanche woman as 'intelligent and innovative' | GOLD DERBY,https://www.youtube.com/watch?v=SGx9AivOG3s,Module 9: Indigenous Futurisms: Sustainability and Beyond,9
7712,Anthropology,Native American & Indigenous Studies Playlist,,Actor Michael Greyeyes talks about tearing up over his speech in Rutherford Falls,https://www.youtube.com/watch?v=R0BrdhHkk5o,Module 9: Indigenous Futurisms: Sustainability and Beyond,9
7713,Anthropology,Native American & Indigenous Studies Playlist,,PREY REVIEW (NO SPOILERS)| A Native American Perspective and Thoughts,https://www.youtube.com/watch?v=FrJwITy3Nno,Module 9: Indigenous Futurisms: Sustainability and Beyond,9
7714,Anthropology,Native American & Indigenous Studies Playlist,,Indigenous People Review Native American Characters In Film & TV,https://www.youtube.com/watch?v=DBBFWH4oSmM,Module 9: Indigenous Futurisms: Sustainability and Beyond,9
7715,Anthropology,Native American & Indigenous Studies Playlist,,Are Most Land Acknowledgments Performative? | The Agenda,https://www.youtube.com/watch?v=7_l84t8qjf0,Module 9: Indigenous Futurisms: Sustainability and Beyond,9
7716,Anthropology,Native American & Indigenous Studies Playlist,,"CTV News Channel Tantoo Cardinal on Idle No More January 16, 2013",https://www.youtube.com/watch?v=Paxc3bA7qvY,Module 9: Indigenous Futurisms: Sustainability and Beyond,9
7717,Anthropology,Native American & Indigenous Studies Playlist,,Jackie's Happy Memory | Reservation Dogs | FX,https://www.youtube.com/watch?v=6pWYODA16rk,Module 9: Indigenous Futurisms: Sustainability and Beyond,9
7718,Anthropology,Native American & Indigenous Studies Playlist,,Changing the way we see Native Americans | Matika Wilbur | TEDxTeachersCollege,https://www.youtube.com/watch?v=GIzYzz3rEZU,Module 9: Indigenous Futurisms: Sustainability and Beyond,9
7719,Anthropology,Native American & Indigenous Studies Playlist,,Anti-racism and being an ally to Indigenous Peoples,https://www.youtube.com/watch?v=RpfWuhU6feI,Module 9: Indigenous Futurisms: Sustainability and Beyond,9
7720,Anthropology,Native American & Indigenous Studies Playlist,,What systemic racism in Canada looks like,https://www.youtube.com/watch?v=7GmX5stT9rU,Module 9: Indigenous Futurisms: Sustainability and Beyond,9
7721,Anthropology,Native American & Indigenous Studies Playlist,,Lakota in America,https://www.youtube.com/watch?v=ie4m9LAVDGw,Module 9: Indigenous Futurisms: Sustainability and Beyond,9
7722,Anthropology,Native American & Indigenous Studies Playlist,,"Indigenous Women and Genderful People: Then, Today, and Tomorrow",https://www.youtube.com/watch?v=ptfJeyUMIYE,Module 9: Indigenous Futurisms: Sustainability and Beyond,9
7723,Anthropology,Native American & Indigenous Studies Playlist,,Kimberly TallBear: Decolonizing Science and Technology,https://www.youtube.com/watch?v=ZlK1QoM_qAo,Module 9: Indigenous Futurisms: Sustainability and Beyond,9
7724,Anthropology,Native American & Indigenous Studies Playlist,,"Native Americans have historically battled addiction, and now it could be getting worse",https://www.youtube.com/watch?v=35HJsVpjRLU,Module 9: Indigenous Futurisms: Sustainability and Beyond,9
7725,Anthropology,Native American & Indigenous Studies Playlist,,Sunrise Native Recovery discusses healthcare and addiction in Native communities,https://www.youtube.com/watch?v=Bc63hCEbH_k,Module 9: Indigenous Futurisms: Sustainability and Beyond,9
7726,Anthropology,Native American & Indigenous Studies Playlist,,The Native American Addiction,https://www.youtube.com/watch?v=IznepKzvGBM,Module 9: Indigenous Futurisms: Sustainability and Beyond,9
7727,Anthropology,Native American & Indigenous Studies Playlist,,Justine Teba on her personal connection to US nuclear colonialism,https://www.youtube.com/watch?v=E7kzJ0jkIJw,Module 9: Indigenous Futurisms: Sustainability and Beyond,9
7728,Anthropology,Native American & Indigenous Studies Playlist,,Native American Hair and its Cultural and Spiritual Importance,https://www.youtube.com/watch?v=6kiHekeu_GA,Module 9: Indigenous Futurisms: Sustainability and Beyond,9
7729,Anthropology,Native American & Indigenous Studies Playlist,,Lyla June Johnston | Indigenous social technologies,https://www.youtube.com/watch?v=WUcIWydfaS4,Module 9: Indigenous Futurisms: Sustainability and Beyond,9
7730,Anthropology,Native American & Indigenous Studies Playlist,,Stephen Jenkinson: Can Life be More than a Race Towards Growth?,https://www.youtube.com/watch?v=jwyXRnbasNA,Module 9: Indigenous Futurisms: Sustainability and Beyond,9
7731,Anthropology,Native American & Indigenous Studies Playlist,,Stephen Jenkinson on What it Means to BELONG,https://www.youtube.com/watch?v=zrMsadBrF9M,Module 9: Indigenous Futurisms: Sustainability and Beyond,9
7732,Anthropology,Native American & Indigenous Studies Playlist,,Die Wise: Stephen Jenkinson,https://www.youtube.com/watch?v=2FSJH0Exo0w,Module 9: Indigenous Futurisms: Sustainability and Beyond,9
7733,Anthropology,Native American & Indigenous Studies Playlist,,"Sherri Mitchell: We are Here on Purpose, Step Beyond the Illusion",https://www.youtube.com/watch?v=KXTrbXySy8E,Module 9: Indigenous Futurisms: Sustainability and Beyond,9
7734,Anthropology,Native American & Indigenous Studies Playlist,,Sherri Mitchell - Engaging the other,https://www.youtube.com/watch?v=PBvrjrwuoDs,Module 9: Indigenous Futurisms: Sustainability and Beyond,9
7735,Anthropology,Native American & Indigenous Studies Playlist,,"Quillwood Podcast 2: Dancing with the Cannibal Giant, with Sherri Mitchell",https://www.youtube.com/watch?v=62XNhTgZqNc,Module 9: Indigenous Futurisms: Sustainability and Beyond,9
7736,Anthropology,Native American & Indigenous Studies Playlist,,The Wisdom of our Stories - Sherri Mitchell Weh'na Ha'mu Kkwasset CTS 2021 Preview,https://www.youtube.com/watch?v=JGyJh6jJTWc,Module 9: Indigenous Futurisms: Sustainability and Beyond,9
7737,Anthropology,Native American & Indigenous Studies Playlist,,Home with Nowhere to Live,https://www.youtube.com/watch?v=HO6XB9aFMn8,Module 9: Indigenous Futurisms: Sustainability and Beyond,9
7738,Anthropology,Native American & Indigenous Studies Playlist,,Decolonization Is for Everyone | Nikki Sanchez | TEDxSFU,https://www.youtube.com/watch?v=QP9x1NnCWNY,Module 9: Indigenous Futurisms: Sustainability and Beyond,9
7739,Anthropology,Native American & Indigenous Studies Playlist,,What Is Decolonisation?,https://www.youtube.com/watch?v=jHQTuVKMeM0,Module 9: Indigenous Futurisms: Sustainability and Beyond,9
7740,Anthropology,Native American & Indigenous Studies Playlist,,Colonization and You,https://www.youtube.com/watch?v=IZlpGkRIJUI,Module 9: Indigenous Futurisms: Sustainability and Beyond,9
7741,Anthropology,Native American & Indigenous Studies Playlist,,The Doctrine of Discovery and its grip on Indigenous lands,https://www.youtube.com/watch?v=hGDUYYGqOz4,Module 9: Indigenous Futurisms: Sustainability and Beyond,9
7742,Anthropology,Native American & Indigenous Studies Playlist,,Cultural Appropriation,https://www.youtube.com/watch?v=80n0pj7EVws,Module 9: Indigenous Futurisms: Sustainability and Beyond,9
7743,Anthropology,Native American & Indigenous Studies Playlist,,"The Pretendians: Who's Native, Who Decides, and What Are the Consequences",https://www.youtube.com/watch?v=hJotHQuzZzY,Module 9: Indigenous Futurisms: Sustainability and Beyond,9
7744,Anthropology,Native American & Indigenous Studies Playlist,,How to Introduce Yourself in Ojibwe (60 seconds),https://www.youtube.com/watch?v=PgwVmPU6_TQ,Module 9: Indigenous Futurisms: Sustainability and Beyond,9
7745,Anthropology,Native American & Indigenous Studies Playlist,,"""Everything you wanted to know about Native Americans"" with Anton Treuer",https://www.youtube.com/watch?v=fgc_FOm8GOs,Module 9: Indigenous Futurisms: Sustainability and Beyond,9
7746,Anthropology,Native American & Indigenous Studies Playlist,,In Our Voices: Land Acknowledgement,https://www.youtube.com/watch?v=_HtG7j19na4,Module 9: Indigenous Futurisms: Sustainability and Beyond,9
7747,Anthropology,Native American & Indigenous Studies Playlist,,"Poems by Richard Wagamese: ""Ceremony"" & ""Pow Wow""",https://www.youtube.com/watch?v=Z1-lMOQdiIY,Module 9: Indigenous Futurisms: Sustainability and Beyond,9
7748,Anthropology,Native American & Indigenous Studies Playlist,,Oglala Lakota Nation Pow Wow | National Geographic,https://www.youtube.com/watch?v=on9bnvuOLtE,Module 9: Indigenous Futurisms: Sustainability and Beyond,9
7749,Anthropology,Native American & Indigenous Studies Playlist,,Oregon occupation: Native Paiute tribe speaks | AJ+,https://www.youtube.com/watch?v=Cw7E9GIgFGg,Module 9: Indigenous Futurisms: Sustainability and Beyond,9
7750,Anthropology,Native American & Indigenous Studies Playlist,,Oregon guide helps people explore tribal communities,https://www.youtube.com/watch?v=bWW2Vrok04k,Module 9: Indigenous Futurisms: Sustainability and Beyond,9
7751,Anthropology,Native American & Indigenous Studies Playlist,,Clatsop-Nehalem tribes’ return of ancestral land,https://www.youtube.com/watch?v=MKNNpSm3g90,Module 9: Indigenous Futurisms: Sustainability and Beyond,9
7752,Anthropology,Native American & Indigenous Studies Playlist,,Nibi Water Song and Teachings,https://www.youtube.com/watch?v=3dxpuBqMvIs,Module 9: Indigenous Futurisms: Sustainability and Beyond,9
7753,Anthropology,Native American & Indigenous Studies Playlist,,Voices of the Native Northwest Coast,https://www.youtube.com/watch?v=OIjAR3f9c60,Module 9: Indigenous Futurisms: Sustainability and Beyond,9
7754,Anthropology,Native American & Indigenous Studies Playlist,,Confederated Tribes of Grand Ronde Fishing at Willamette Falls,https://www.youtube.com/watch?v=9t6dw6wF82k,Module 9: Indigenous Futurisms: Sustainability and Beyond,9
7755,Anthropology,Native American & Indigenous Studies Playlist,,Our Story,https://www.youtube.com/watch?v=44A9LGZsdwo,Module 9: Indigenous Futurisms: Sustainability and Beyond,9
7756,Anthropology,Native American & Indigenous Studies Playlist,,Totem Poles | Native America | PBS,https://www.youtube.com/watch?v=hK1AFOD7SUE,Module 9: Indigenous Futurisms: Sustainability and Beyond,9
7757,Anthropology,Native American & Indigenous Studies Playlist,,Inside the Collections: Pacific Northwest Coast Peoples,https://www.youtube.com/watch?v=Mz9OkG_BlRM,Module 9: Indigenous Futurisms: Sustainability and Beyond,9
7758,Anthropology,Native American & Indigenous Studies Playlist,,WELCOME TO THE YAKAMA NATION,https://www.youtube.com/watch?v=ipFk4WTvWJA,Module 9: Indigenous Futurisms: Sustainability and Beyond,9
7759,Anthropology,Native American & Indigenous Studies Playlist,,Art & Story in Totem Poles / Ignite Dallas,https://www.youtube.com/watch?v=6Lht4XGkk0k,Module 9: Indigenous Futurisms: Sustainability and Beyond,9
7760,Anthropology,Native American & Indigenous Studies Playlist,,Chinook Indian Nation continues decades-long fight to be recognized by U.S. government,https://www.youtube.com/watch?v=30Kxj6K0gdE,Module 9: Indigenous Futurisms: Sustainability and Beyond,9
7761,Anthropology,Native American & Indigenous Studies Playlist,,The Confederated Tribes of the Umatilla Indian Reservation,https://www.youtube.com/watch?v=zHHjooGIHzw,Module 9: Indigenous Futurisms: Sustainability and Beyond,9
7762,Anthropology,Native American & Indigenous Studies Playlist,,Washington Tribes explained,https://www.youtube.com/watch?v=NOM2qgfG8C8,Module 9: Indigenous Futurisms: Sustainability and Beyond,9
7763,Anthropology,Native American & Indigenous Studies Playlist,,Washington Tribes - Preserving Culture 2016,https://www.youtube.com/watch?v=V8EbvsAdjSM,Module 9: Indigenous Futurisms: Sustainability and Beyond,9
7764,Anthropology,Native American & Indigenous Studies Playlist,,Indigenous Communities Are on the Front Lines of Climate Change | Hot Mess 🌎,https://www.youtube.com/watch?v=xlGnve1cjOY,Module 9: Indigenous Futurisms: Sustainability and Beyond,9
7765,Anthropology,Native American & Indigenous Studies Playlist,,Iroquois or Haudenosaunee?,https://www.youtube.com/watch?v=UHOem_7Re5E,Module 9: Indigenous Futurisms: Sustainability and Beyond,9
7766,Anthropology,Native American & Indigenous Studies Playlist,,Alaska Native Heritage Center,https://www.youtube.com/watch?v=YHUZOiSFJG0,Module 9: Indigenous Futurisms: Sustainability and Beyond,9
7767,Anthropology,Native American & Indigenous Studies Playlist,,Inuit Throat Singing,https://www.youtube.com/watch?v=NaZlhZBe_qc,Module 9: Indigenous Futurisms: Sustainability and Beyond,9
7768,Anthropology,Native American & Indigenous Studies Playlist,,Inuit throat-singing sisters from Canada,https://www.youtube.com/watch?v=DLMlkjnYe0U,Module 9: Indigenous Futurisms: Sustainability and Beyond,9
7769,Anthropology,Native American & Indigenous Studies Playlist,,katatjanik utippalianinga (The Return of Throat Singing),https://www.youtube.com/watch?v=RUzWaC2qsug,Module 9: Indigenous Futurisms: Sustainability and Beyond,9
7770,Anthropology,Native American & Indigenous Studies Playlist,,Ancient Ink Reborn: Revitalizing Traditional Inuit Tattooing,https://www.youtube.com/watch?v=pUZKgAmhsRU,Module 9: Indigenous Futurisms: Sustainability and Beyond,9
7771,Anthropology,Native American & Indigenous Studies Playlist,,Jana Angulalik’s journey to proudly wearing traditional Inuit tattoos,https://www.youtube.com/watch?v=NJk4Q6veGy4,Module 9: Indigenous Futurisms: Sustainability and Beyond,9
7772,Anthropology,Native American & Indigenous Studies Playlist,,E-Number : Inuit History,https://www.youtube.com/watch?v=XZPK6Z3TisU,Module 9: Indigenous Futurisms: Sustainability and Beyond,9
7773,Anthropology,Native American & Indigenous Studies Playlist,,"What People Get Wrong About Alaska Natives [Our Fight To Survive, Pt. 4] | AJ+",https://www.youtube.com/watch?v=lDU4PkSqWsQ,Module 9: Indigenous Futurisms: Sustainability and Beyond,9
7774,Anthropology,Native American & Indigenous Studies Playlist,,"How Alaska Native Women Are Healing From Generations Of Trauma | [Our Fight To Survive, Pt. 3] | AJ+",https://www.youtube.com/watch?v=FKJO1YyQMmY,Module 9: Indigenous Futurisms: Sustainability and Beyond,9
7775,Anthropology,Native American & Indigenous Studies Playlist,,Journey Through Downtown Iqaluit 🇨🇦: Office Buildings and Baffin Island Canners,https://www.youtube.com/watch?v=XUXP8qlYp40,Module 9: Indigenous Futurisms: Sustainability and Beyond,9
7776,Anthropology,Native American & Indigenous Studies Playlist,,Beautiful Iqaluit 🇨🇦: A Look at Arctic Mural Art!,https://www.youtube.com/watch?v=f0KgTBBGFqI,Module 9: Indigenous Futurisms: Sustainability and Beyond,9
7777,Anthropology,Native American & Indigenous Studies Playlist,,"WHAT IT'S LIKE IN NUNAVUT'S ONLY CITY | Iqaluit, Nunavut",https://www.youtube.com/watch?v=OFtxcvBOFn0,Module 9: Indigenous Futurisms: Sustainability and Beyond,9
7778,Anthropology,Native American & Indigenous Studies Playlist,,Sweden’s indigenous Sami people threatened by climate change,https://www.youtube.com/watch?v=X6RC-RzBl1k,Module 9: Indigenous Futurisms: Sustainability and Beyond,9
7779,Anthropology,Native American & Indigenous Studies Playlist,,The Sámi People in Northern Scandinavia | ❄ They live in Temperatures as low as -30° Celsius!,https://www.youtube.com/watch?v=swQw2kJCFIA,Module 9: Indigenous Futurisms: Sustainability and Beyond,9
7780,Anthropology,Native American & Indigenous Studies Playlist,,Three Days with the Sámi Reindeer People [Swedish Lapland],https://www.youtube.com/watch?v=0Tf2Qgcvfk4,Module 9: Indigenous Futurisms: Sustainability and Beyond,9
7781,Anthropology,Native American & Indigenous Studies Playlist,,Meet the native Hawaiians fighting U.S. occupation | AJ+,https://www.youtube.com/watch?v=QBokfBwYJo0,Module 9: Indigenous Futurisms: Sustainability and Beyond,9
7782,Anthropology,Native American & Indigenous Studies Playlist,,Te Iwi e,https://www.youtube.com/watch?v=29S3N0Nqw9w,Module 9: Indigenous Futurisms: Sustainability and Beyond,9
7783,Anthropology,Native American & Indigenous Studies Playlist,,Hill Monti | Reimagining: Stories of Resilience | Malinda Maynor Lowery,https://www.youtube.com/watch?v=KXoViiJFIT0,Module 9: Indigenous Futurisms: Sustainability and Beyond,9
7784,Anthropology,Native American & Indigenous Studies Playlist,,What Does It Mean To Be Indigenous?,https://www.youtube.com/watch?v=WQm1EEW79RI,Module 9: Indigenous Futurisms: Sustainability and Beyond,9
7785,Anthropology,Native American & Indigenous Studies Playlist,,Brazil: Thousands of indigenous people demonstrate for their land rights,https://www.youtube.com/watch?v=wNrrp42hJfo,Module 9: Indigenous Futurisms: Sustainability and Beyond,9
7786,Anthropology,Native American & Indigenous Studies Playlist,,Whose Land Are You On? What to Know About the Indigenous Land Back Movement | Lindsey Schneider |TED,https://www.youtube.com/watch?v=kADwVHIP8zs,Module 9: Indigenous Futurisms: Sustainability and Beyond,9
7787,Anthropology,Native American & Indigenous Studies Playlist,,What is Land back? Land back Movement Explained!,https://www.youtube.com/watch?v=1CKFES_x97I,Module 9: Indigenous Futurisms: Sustainability and Beyond,9
7788,Anthropology,Native American & Indigenous Studies Playlist,,Land Back host Angela Sterritt on her personal connection to the Delgamuukw case,https://www.youtube.com/watch?v=DOUscHKBlkA,Module 9: Indigenous Futurisms: Sustainability and Beyond,9
7789,Anthropology,Native American & Indigenous Studies Playlist,,NATIVE AMERICAN ART,https://www.youtube.com/watch?v=z7KXWHaiTkQ,Module 9: Indigenous Futurisms: Sustainability and Beyond,9
7790,Anthropology,Native American & Indigenous Studies Playlist,,END OF THE LINE: THE WOMEN OF STANDING ROCK Teaser,https://www.youtube.com/watch?v=SCxZepDj78A,Module 9: Indigenous Futurisms: Sustainability and Beyond,9
7791,Anthropology,Native American & Indigenous Studies Playlist,,Common Ground » Confederated Tribes of Warm Springs,https://www.youtube.com/watch?v=hjfB-IhCA6g,Module 9: Indigenous Futurisms: Sustainability and Beyond,9
7792,Anthropology,Native American & Indigenous Studies Playlist,,50th Annual Delta Park Powwow,https://www.youtube.com/watch?v=_CWqmMw-W9E,Module 9: Indigenous Futurisms: Sustainability and Beyond,9
7793,Anthropology,Native American & Indigenous Studies Playlist,,Motorcycle Club Life: Pacific Savagez Tribute,https://www.youtube.com/watch?v=XHILD14HNqg,Module 9: Indigenous Futurisms: Sustainability and Beyond,9
7794,Anthropology,Native American & Indigenous Studies Playlist,,Shannon Kring Interview for End of the Line: The Women of Standing Rock | Slamdance 2021,https://www.youtube.com/watch?v=QVJJUiG5w7E,Module 9: Indigenous Futurisms: Sustainability and Beyond,9
7795,Anthropology,Native American & Indigenous Studies Playlist,,A Conversation With Native Americans on Race | Op-Docs,https://www.youtube.com/watch?v=siMal6QVblE,Module 9: Indigenous Futurisms: Sustainability and Beyond,9
7796,Anthropology,Native American & Indigenous Studies Playlist,,Blood Quantum (Outdated Cut),https://www.youtube.com/watch?v=gp8qUM1Ca2o,Module 9: Indigenous Futurisms: Sustainability and Beyond,9
