Unnamed: 0,Sector,CourseName,Duration,TopicName,URL,Module,ModuleNo
11194,Statistics,Statistics PL19 - Nonparametric Methods,39hrs 3min,Statistics 101: Introduction to Nonparametric Methods and Sign Test,https://www.youtube.com/watch?v=sAcnz2u2yXI,Module 1: Introduction to Nonparametric Methods,1
11195,Statistics,Statistics PL19 - Nonparametric Methods,,"Statistics 101: Nonparametric Methods, Sign Test for Median Examples",https://www.youtube.com/watch?v=MFIcCOTHFPo,Module 1: Sign Test for Median,1
11196,Statistics,Statistics PL19 - Nonparametric Methods,,"Statistics 101: Nonparametric Methods, Mann-Whitney-Wilcoxon Rank Sum Test",https://www.youtube.com/watch?v=fEobVCV2TJE,Module 1: Mann-Whitney-Wilcoxon Rank Sum Test,1
11197,Statistics,Statistics PL19 - Nonparametric Methods,,"Statistics 101: Nonparametric Methods, Mann-Whitney-Wilcoxon Rank Sum in Excel",https://www.youtube.com/watch?v=WrJRJwHEODk,Module 2: Mann-Whitney-Wilcoxon Rank Sum Test in Excel,2
11198,Statistics,Statistics PL19 - Nonparametric Methods,,"Statistics 101: Nonparametric Methods, Wilcoxon Signed Rank Test in Excel",https://www.youtube.com/watch?v=peF0OXx0G2o,Module 2: Wilcoxon Signed Rank Test in Excel,2
11199,Statistics,Statistics PL19 - Nonparametric Methods,,"Statistics 101: Nonparametric Methods, Kruskal-Wallis Test in Excel",https://www.youtube.com/watch?v=HnNXUO7weQ0,Module 3: Kruskal-Wallis Test in Excel,3
11200,Statistics,Statistics PL19 - Nonparametric Methods,,"Statistics 101: Nonparametric Methods,  Friedman Test in Excel",https://www.youtube.com/watch?v=tjArRLuYvzc,Module 3: Friedman Test in Excel,3
11201,Statistics,Statistics PL19 - Nonparametric Methods,,"Statistics 101: Nonparametric Methods, Spearman Rank Correlation in Excel",https://www.youtube.com/watch?v=KJ8NOJe77y8,Module 3: Spearman Rank Correlation in Excel,3
11202,Statistics,Statistics PL19 - Nonparametric Methods,,"Statistics 101: Nonparametric Methods, Mood's Median Test in Excel",https://www.youtube.com/watch?v=tWcEZSCNEuI,Module 3: Mood's Median Test in Excel,3
