Unnamed: 0,Sector,CourseName,Duration,TopicName,URL,Module,ModuleNo
12324,Music,Music class - Musical education for kids,14hrs 12min,Musical Notation - Educational Videos about Music for kids,https://www.youtube.com/watch?v=JryT5ywzrsk,Module 1: Introduction to Music,1
12325,Music,Music class - Musical education for kids,,Wind Instruments for Kids - Musical Instruments,https://www.youtube.com/watch?v=JjDRBo5N0AU,Module 1: Introduction to Music,1
12326,Music,Music class - Musical education for kids,,String instruments for kids - Musical Instruments,https://www.youtube.com/watch?v=RL5wY6yJK6c,Module 1: Introduction to Music,1
12327,Music,Music class - Musical education for kids,,Percussion instruments for kids - Musical Instruments,https://www.youtube.com/watch?v=0vrK1POQPiE,Module 1: Introduction to Music,1
12328,Music,Music class - Musical education for kids,,"Musical Notation - Learning Music for Kids - The quarter note, the half note and the whole note",https://www.youtube.com/watch?v=y46FuaUMtBw,Module 2: Musical Notes and Rhythms,2
12329,Music,Music class - Musical education for kids,,"Musical Notation - The quarter, the eighth and the sixteenth note - Music for Kids",https://www.youtube.com/watch?v=2bJjigIRo4c,Module 2: Musical Notes and Rhythms,2
12330,Music,Music class - Musical education for kids,,A music lesson | Instruments and musical figures for kids,https://www.youtube.com/watch?v=0A6XwFWD-z0,Module 3: Exploring Instruments,3
