Unnamed: 0,Sector,CourseName,Duration,TopicName,URL,Module,ModuleNo
3102,Culinary Arts,international recipes | international cuisine recipes,,paneer popcorn recipe | paneer snacks recipe | paneer starter recipe,https://www.youtube.com/watch?v=xayqJPoyFIo,"Module 13: Snacks, Sides, and More",13
3103,Culinary Arts,international recipes | international cuisine recipes,,Chilli Garlic Pasta - New Spicy Spaghetti Pasta with Homemade Spicy Sauce | Garlic & Chilli Pasta,https://www.youtube.com/watch?v=plFj0vCV4O4,"Module 13: Snacks, Sides, and More",13
3104,Culinary Arts,international recipes | international cuisine recipes,,spaghetti recipe | vegetarian spagetti recipe with veg meat balls,https://www.youtube.com/watch?v=QEuKEUqQHUg,"Module 13: Snacks, Sides, and More",13
3105,Culinary Arts,international recipes | international cuisine recipes,,fruit salad recipe | fruit salad with ice cream | मिक्स फ्रूट आइस क्रीम | fruit salad dressing,https://www.youtube.com/watch?v=SoBfYX0WO6k,"Module 13: Snacks, Sides, and More",13
3106,Culinary Arts,international recipes | international cuisine recipes,,peanut butter cookies recipe in pressure cooker | no oven eggless peanut butter biscuits,https://www.youtube.com/watch?v=pi6vGjng7iQ,"Module 13: Snacks, Sides, and More",13
3107,Culinary Arts,international recipes | international cuisine recipes,,"refreshing iced tea recipe - 4 ways summer drink | lemon, mango, watermelon, orange flavored ice tea",https://www.youtube.com/watch?v=oqQONoMdyRY,"Module 13: Snacks, Sides, and More",13
3108,Culinary Arts,international recipes | international cuisine recipes,,Coconut Jelly Recipe - Coconut Milk & Coconut Water Jello Kids Favorite Dessert | No Gelatin Jelly,https://www.youtube.com/watch?v=0asc4bdKheA,"Module 13: Snacks, Sides, and More",13
3109,Culinary Arts,international recipes | international cuisine recipes,,leftover cake milkshake shake recipe - 2 ways | eggless vanilla & chocolate cake shakes recipe,https://www.youtube.com/watch?v=6owDtTnzyqg,"Module 13: Snacks, Sides, and More",13
3110,Culinary Arts,international recipes | international cuisine recipes,,4 ways pizza recipes without oven | indian pizza recipes | pizza recipes without baking,https://www.youtube.com/watch?v=9Kelu1jvoEE,"Module 13: Snacks, Sides, and More",13
3111,Culinary Arts,international recipes | international cuisine recipes,,tutti frutti cookies recipe | टूटी फ्रुटी कुकीज | tutti frutti biscuits | tooty fruity cookies,https://www.youtube.com/watch?v=GID_11h0PPg,"Module 13: Snacks, Sides, and More",13
3112,Culinary Arts,international recipes | international cuisine recipes,,veg chow mein noodles recipe | वेज चाऊमीन नूडल्स रेसिपी | vegetable chow mein noodles,https://www.youtube.com/watch?v=OmZlDxFEcMk,"Module 13: Snacks, Sides, and More",13
3113,Culinary Arts,international recipes | international cuisine recipes,,Sooji Crispy Bites Snacks - No Maida & No Frying Healthy Breakfast Recipe | Sooji Crispy Snack,https://www.youtube.com/watch?v=3c1WH2793Rg,"Module 13: Snacks, Sides, and More",13
3114,Culinary Arts,international recipes | international cuisine recipes,,spring roll noodles recipe | how to make noodles spring roll recipe,https://www.youtube.com/watch?v=ds12z0akWgA,"Module 13: Snacks, Sides, and More",13
3115,Culinary Arts,international recipes | international cuisine recipes,,peanut chaat recipe | पीनट चाट रेसिपी | boiled peanut chaat salad | groundnut chat,https://www.youtube.com/watch?v=mXVqDWiPA1M,"Module 13: Snacks, Sides, and More",13
3116,Culinary Arts,international recipes | international cuisine recipes,,Pasta Chilli Manchurian Recipe New & Unique Recipe | Pasta Indo Chinese Style with Manchurian Sauce,https://www.youtube.com/watch?v=3J1UtdUx37U,"Module 13: Snacks, Sides, and More",13
3117,Culinary Arts,international recipes | international cuisine recipes,,eggless coconut cookies recipe in cooker | no oven coconut biscuits | कोकोनट कुकीज़ रेसिपी,https://www.youtube.com/watch?v=1zBWRVxrKNg,"Module 13: Snacks, Sides, and More",13
3118,Culinary Arts,international recipes | international cuisine recipes,,chilli garlic noodles recipe | garlic noodles recipe | chinese noodles,https://www.youtube.com/watch?v=HFUt5JOdHhI,"Module 13: Snacks, Sides, and More",13
3119,Culinary Arts,international recipes | international cuisine recipes,,10 mins Chocolate Dessert Recipes For New Year Celebrations | Simple Unique Chocolate Sweet Recipes,https://www.youtube.com/watch?v=q4W4ABrqnQw,"Module 13: Snacks, Sides, and More",13
3120,Culinary Arts,international recipes | international cuisine recipes,,homemade garlic bread recipe | simple & easy garlic bread recipe,https://www.youtube.com/watch?v=CyuxwqfaCDE,"Module 13: Snacks, Sides, and More",13
3121,Culinary Arts,international recipes | international cuisine recipes,,2 healthy no sugar cakes for christmas | sugar free cake recipes for christmas | christmas cakes,https://www.youtube.com/watch?v=-w2mnHmIdpI,"Module 13: Snacks, Sides, and More",13
3122,Culinary Arts,international recipes | international cuisine recipes,,veg singapore noodles recipe - desi style | सिंगापुर नूडल्स राइस रेसिपी | singapore mei fun,https://www.youtube.com/watch?v=w2H7roSsfZE,"Module 13: Snacks, Sides, and More",13
3123,Culinary Arts,international recipes | international cuisine recipes,,desi pasta soup recipe - weight loss soup recipe | healthy soups for weight loss | soupy pasta,https://www.youtube.com/watch?v=4JBEp_FDLH8,"Module 13: Snacks, Sides, and More",13
3124,Culinary Arts,international recipes | international cuisine recipes,,Macaroni And Cheese Recipe - New Unique Desi Way | Macaroni Cheese Pasta 10 Mins - Homemade Sauce,https://www.youtube.com/watch?v=8yC4Z-yEmHQ,"Module 13: Snacks, Sides, and More",13
3125,Culinary Arts,international recipes | international cuisine recipes,,veg gold coin recipe | vegetable gold coins | chinese gold coins,https://www.youtube.com/watch?v=-7_ntBwNYPk,"Module 13: Snacks, Sides, and More",13
3126,Culinary Arts,international recipes | international cuisine recipes,,white pasta sauce recipe | creamy white pasta sauce,https://www.youtube.com/watch?v=bUQSCL39KU4,"Module 13: Snacks, Sides, and More",13
3127,Culinary Arts,international recipes | international cuisine recipes,,pasta & noodles combo for lunch & breakfast | creamy white sauce pasta with spicy veg noodles,https://www.youtube.com/watch?v=pKwgbDxon_E,"Module 13: Snacks, Sides, and More",13
3128,Culinary Arts,international recipes | international cuisine recipes,,Just Mix Apple & Milk for Healthy Morning Breakfast | Apple Cinnamon Pancakes - Eggless Pancakes,https://www.youtube.com/watch?v=pW1K-evAL9U,"Module 13: Snacks, Sides, and More",13
3129,Culinary Arts,international recipes | international cuisine recipes,,raisin bread recipe with atta & bread maker | sultana bread recipe | cinnamon raisin bread,https://www.youtube.com/watch?v=50usjJoJyTQ,"Module 13: Snacks, Sides, and More",13
3130,Culinary Arts,international recipes | international cuisine recipes,,cheesy hari chutney bombs recipe - kids favourite snack | green chatni corn cheese balls,https://www.youtube.com/watch?v=f0uctCmHIFc,"Module 13: Snacks, Sides, and More",13
3131,Culinary Arts,international recipes | international cuisine recipes,,tandoori paneer tikka frankie roll recipe - street style | paneer tikka kathi roll recipe - hebbars,https://www.youtube.com/watch?v=6b51joJCPbQ,"Module 13: Snacks, Sides, and More",13
3132,Culinary Arts,international recipes | international cuisine recipes,,4 Ways Eggless Veg Omelets Recipes for Morning Breakfast | Egg Alternative Omelets Recipes,https://www.youtube.com/watch?v=MaEgBzZfagA,"Module 13: Snacks, Sides, and More",13
3133,Culinary Arts,international recipes | international cuisine recipes,,momos soup recipe | momo jhol achar | paneer momo dumpling soup,https://www.youtube.com/watch?v=bFqiROBc6bY,"Module 13: Snacks, Sides, and More",13
3134,Culinary Arts,international recipes | international cuisine recipes,,kaju biscuit recipe | cashew cookies | काजू बिस्कुट रेसिपी | cashew biscuits | cashew nut cookies,https://www.youtube.com/watch?v=0zTepInKQzg,"Module 13: Snacks, Sides, and More",13
3135,Culinary Arts,international recipes | international cuisine recipes,,mango popsicles recipe | mango candy recipe | मॅंगो पॉप्सीकले रेसिपी | mango ice pops,https://www.youtube.com/watch?v=lvQE7OZnCDQ,"Module 13: Snacks, Sides, and More",13
3136,Culinary Arts,international recipes | international cuisine recipes,,Hot Chocolate Instant Mix - Homemade Choco Mix Store 1 Month | Refreshing Hot Beverage Instant Mix,https://www.youtube.com/watch?v=lGO59wWP3_g,"Module 13: Snacks, Sides, and More",13
3137,Culinary Arts,international recipes | international cuisine recipes,,"Mini Pizza with Liquid Dough - No Oven, No Maida, No Knead, No Yeast | Trending Quick Instant Pizza",https://www.youtube.com/watch?v=ruodh96gpR4,"Module 13: Snacks, Sides, and More",13
3138,Culinary Arts,international recipes | international cuisine recipes,,Pinwheel Pizza with Leftover Sandwich Bread Slices - Just 5 Mins | Trending New Pizza Recipe on Tawa,https://www.youtube.com/watch?v=BQhr9I6NWEQ,"Module 13: Snacks, Sides, and More",13
3139,Culinary Arts,international recipes | international cuisine recipes,,gluten free bread recipe | besan bread | yeast free bread | buckwheat bread,https://www.youtube.com/watch?v=ATfAO5PzG5A,"Module 13: Snacks, Sides, and More",13
3140,Culinary Arts,international recipes | international cuisine recipes,,veggie bites recipe | peri peri vegetable bites | how to make veggie ball recipe,https://www.youtube.com/watch?v=jdR0_Xl1Jb4,"Module 13: Snacks, Sides, and More",13
