Unnamed: 0,Sector,CourseName,Duration,TopicName,URL
4656,Nursing,Critical Care Nursing | Lecturio Nursing,22hrs 16min,First Degree AV Block | Critical Care Nursing,https://www.youtube.com/watch?v=lWHmodUi7R8
4657,Nursing,Critical Care Nursing | Lecturio Nursing,,Mean Arterial Pressure (MAP) - Blood Presure & Hemodynamics | Critical Care Nursing,https://www.youtube.com/watch?v=VcRCooz1Q1g
4658,Nursing,Critical Care Nursing | Lecturio Nursing,,Cardiac Output & Cardiac Index Explained | Critical Care Nursing,https://www.youtube.com/watch?v=ZJH9S9vxRJs
4659,Nursing,Critical Care Nursing | Lecturio Nursing,,Arterial Lines: Placement Locations & Line Pressure Monitoring | Lecturio Critical Care Nursing,https://www.youtube.com/watch?v=M4MLMu8xpS0
4660,Nursing,Critical Care Nursing | Lecturio Nursing,,Ventricular Tachycardia: ECG Interpretation & Presentation,https://www.youtube.com/watch?v=5TMTyqAJQ14
4661,Nursing,Critical Care Nursing | Lecturio Nursing,,Traumatic Brain Injury (TBI): Definition and Causes | Lecturio Critical Care Nursing,https://www.youtube.com/watch?v=tFyAh93cEY4
4662,Nursing,Critical Care Nursing | Lecturio Nursing,,Ventricular Fibrillation: ECG Interpretation & Presentation,https://www.youtube.com/watch?v=yfHF9SRydVU
4663,Nursing,Critical Care Nursing | Lecturio Nursing,,Acid Base Balance (Homeostasis) Explained | Lecturio Nursing Critical Care,https://www.youtube.com/watch?v=NIzgZZg_-yw
